title_id,title,complete_title,release_year,rating,rater,casts,casts_slug,genres,tags,screenwriter,director,poster,synopsis,country,type,episodes,aired,aired_on,original_network,duration,score,ranked,popularity,content_rating,watchers
680959-the-penthouse-season-2,The Penthouse Season 2: War in Life,The Penthouse Season 2: War in Life (2021),2021,8.7,21730,Kim So Yeon|Eugene|Lee Ji Ah|Uhm Ki Joon|Yoon Jong Hoon|Shin Eun Kyung,/people/609-kim-so-yeon|/people/336-eugene|/people/1106-lee-ji-ah|/people/1255-uhm-ki-joon|/people/5325-yoon-jong-hoon|/people/290-shin-eun-kyung,Thriller|Mystery|Drama,Revenge|Corruption|High Class Society|Greed|Murder|Rich Male Lead|Motherhood|School Bullying|Rich Female Lead|Jealousy (Vote or add tags),Kim Soon Ok,Joo Dong Min,https://i.mydramalist.com/670YW_4c.jpg,"After successfully framing Oh Yoon Hee, Cheon Seo Jin and Joo Dan Tae decided to get married. Their engagement party is interrupted by Oh Yoon Hee and Ha Yoon Cheol, who has just come back from the United States. As the secrets unveil, the relationships among the people at Hera Palace are entangled, yet another mysterious figure appears and confronts them.(Source: Wikipedia)",South Korea,Drama,13,"Feb 19, 2021 - Apr  2, 2021","Friday, Saturday",SBS,1 hr. 15 min.,"8.7 (scored by 21,730 users)",260,332,15+ - Teens 15 or older,37684
65391-nemesis,My Name,My Name (2021),2021,8.7,55754,Han So Hee|Park Hee Soon|Ahn Bo Hyun|Lee Hak Joo|Kim  Sang Ho|Chang Ryul,/people/16051-han-so-hee|/people/2587-park-hee-soon|/people/9854-ahn-bo-hyun|/people/9890-lee-hak-joo|/people/1812-kim-sang-ho|/people/17661-jang-yool,Action|Thriller|Mystery|Crime,Criminal Organization|Blood|Revenge|Badass Female Lead|Lying|Murder|Hidden Identity|Gun Violence|Gang|Double Identity (Vote or add tags),Kim Ba Da,Kim Jin Min,https://i.mydramalist.com/jD3br_4c.jpg,"Following her father's murder, a revenge-driven woman puts her trust in a powerful crime boss — and enters the police force under his direction.Yoon Ji Woo, a member of a organized crime ring, goes undercover as a police officer and harbors cold revenge in her heart. Helping Yoon Ji Woo go undercover is Choi Moo Jin, the boss of the biggest drug ring in Korea, whose true motives are not easy to read.Jeon Pil Do is a police detective in the Drug Investigation Unit. He is a stickler for rules who becomes Yoon Ji Woo’s partner when she joins the police. Cha Gi Ho is the team leader of the Drug Investigation Unit. He and Choi Moo Jin have long been enemies, with Cha Gi Ho vowing to take down his crime ring before he retires.Jung Tae Joo is Choi Moo Jin’s subordinate in the drug ring. Because of his steadfast loyalty, he is Choi Moo Jin’s most trusted henchman. Do Gang Jae is a former member of the drug ring. After causing problems and getting kicked out of the gang, he vowed revenge against them.(Source: Soompi, Netflix)",South Korea,Drama,8,"Oct 15, 2021",Friday,Netflix,50 min.,"8.7 (scored by 55,754 users)",273,61,18+ Restricted (violence & profanity),91595
19684-defendant,Defendant,Defendant (2017),2017,8.7,11683,Ji Sung|Uhm Ki Joon|Kwon Yu Ri|Oh Chang Seok|Uhm Hyun Kyung|Jung Dong Gyu,/people/469-ji-sung|/people/1255-uhm-ki-joon|/people/1811-kwon-yoo-ri|/people/5178-oh-chang-seok|/people/2886-uhm-hyun-kyung|/people/5863-jung-dong-gyu,Thriller|Mystery|Law|Drama,Murder|Amnesia|Wrongfully Accused|Identity Swap|Bromance|Suspense|Good Twin/Evil Twin|Deception|Competent Male Lead|Power Struggle (Vote or add tags),Choi Soo Jin|Choi Chang Hwan,Jo Young Kwang|Jung Dong Yoon,https://i.mydramalist.com/4JDbd_4c.jpg,"Park Jung Woo is a prosecutor at Seoul Central District Prosecutors’ Office. One day, he wakes up and finds himself a convict on death row. Suffering from temporary amnesia, Jung Woo has no idea what transpired to land him in prison. He struggles to recover his memory and clear his name before his time is up.",South Korea,Drama,18,"Jan 23, 2017 - Mar 21, 2017","Monday, Tuesday",SBS,1 hr. 10 min.,"8.7 (scored by 11,683 users)",277,430,15+ - Teens 15 or older,30983
694231-us-that-year,Our Beloved Summer,Our Beloved Summer (2021),2021,8.7,48649,Choi  Woo Shik|Kim Da Mi|Kim Sung Cheol|Roh Jeong Eui|Ahn Dong Goo|Park Jin Joo,/people/2551-choi-woo-shik|/people/14422-kim-da-mi|/people/16728-kim-sung-chul|/people/4419-noh-jung-eui|/people/31791-ahn-dong-goo|/people/2382-park-jin-joo,Romance|Life|Youth|Drama,Lovers Reunited|High School Sweethearts|First Love|Healing|Flashback To Past|Love/Hate Relationship|Interview|Second Chance Romance|Coming Of Age|Character Development (Vote or add tags),Lee Na Eun,Kim Yoon Jin,https://i.mydramalist.com/4QLgQ_4c.jpg,"Years after filming a viral documentary in high school, two bickering ex-lovers get pulled back in front of the camera — and into each other's lives. Choi Woong seems naive and a free-spirited man, but he wants to have something for the first time in his life. For that, he shows what he holds in his mind. Kook Yeon Soo aimed to become the top student at her school, but she is now an adult who lives fiercely, adapting to her reality.(Source: Netflix, AsianWiki)~~ Inspired by the webtoon “Our Beloved Summer” (그 해 우리는 - 초여름이 좋아!) by Lee Naeun (이나은) and Han Kyoung Chal (한경찰) which is a prequel story that depicts their high school days 10 years before drama timeline. It is a different perspective from their past including how they first met, grew on each other and fell in love with each other. The webtoon has a story that doesn't show up in drama sequel.",South Korea,Drama,16,"Dec  6, 2021 - Jan 25, 2022","Monday, Tuesday",Netflix SBS,60 min.,"8.7 (scored by 48,649 users)",275,68,15+ - Teens 15 or older,89544
10873-kill-me-heal-me,"Kill Me, Heal Me","Kill Me, Heal Me (2015)",2015,8.7,50463,Ji Sung|Hwang Jung Eum|Park Seo Joon|Kim Yoo Ri|Oh Min Suk|Kim Young Ae,/people/469-ji-sung|/people/669-hwang-jung-eum|/people/2195-park-seo-joon|/people/3216-kim-yoo-ri|/people/826-oh-min-suk|/people/837-kim-young-ae,Psychological|Comedy|Romance|Drama,Dissociative Identity Disorder|Trauma|Boss-Employee Relationship|Rich Male Lead|Psychiatry|Nice Male Lead|Mean Male Lead|Rich Man/Poor Woman|Psychiatrist Female Lead|Doctor Female Lead (Vote or add tags),Jin Soo Wan,Kim Jin Man|Kim Dae Jin,https://i.mydramalist.com/p2j0nc.jpg,"A traumatic childhood experience leaves Cha Do Hyeon, suffering from memory loss and dissociation. The latter has resulted in the creation of seven distinct personalities. Wanting to regain control over his life, he asks Oh Ri Jin, a first-year psychiatric resident, to help him, but she eventually falls in love with one of his personalities. Ri Jin’s twin brother, Oh Ri On, a famous mystery novelist, investigates Do Hyeon and his family. (Source: MyDramaList)",South Korea,Drama,20,"Jan  7, 2015 - Mar 12, 2015","Wednesday, Thursday",MBC,1 hr. 2 min.,"8.7 (scored by 50,463 users)",283,31,15+ - Teens 15 or older,111202
746193-gold-spoon,Flex X Cop,Flex X Cop (2024),2024,8.7,6545,Ahn Bo Hyun|Park Ji Hyun|Kang Sang Jun|Kim Shin Bi|Jang Hyun Sung|Kwak Shi Yang,/people/9854-ahn-bo-hyun|/people/15691-park-ji-hyun|/people/120495-kang-sang-jun|/people/78477-kim-shin-bi|/people/1476-jang-hyun-sung|/people/7009-kwak-shi-yang,Action|Thriller|Mystery|Comedy,Detective Fiction|Teamwork|Rich Male Lead|Investigation|Team Leader Female Lead|Immature Male Lead|Childish Male Lead|Character Development|Heir Male Lead|Conglomerate (Vote or add tags),Kim Ba Da,Kim Jae Hong,https://i.mydramalist.com/qYbz7B_4c.jpg,"Jin Yi Soo has everything in life. Being a third-generation conglomerate, he never requires others’ assistance. However, things start changing when he gets entangled in a case.Jin Yi Soo joins the violent investigative team at the Kangha Police Station that specializes in catching robbers. He aims to use his wealth and personal connections to his advantage. He works under Detective Lee Kang Hyun. Kang Hyun is dedicated and a smooth-talker and doesn't care for Yi Soo's presence when they begin working as partners.(Source: sportskeeda.com; edited by MyDramaList)~~ Remake of the Russian series ""Silver Spoon"" [2015].",South Korea,Drama,16,"Jan 26, 2024 - Mar 23, 2024","Friday, Saturday",SBS,1 hr. 10 min.,"8.7 (scored by 6,545 users)",276,769,15+ - Teens 15 or older,19907
699597-king-of-pigs,The King of Pigs,The King of Pigs (2022),2022,8.7,4885,Kim Dong Wook|Kim Sung Gyu|Chae Jung An|Choi Hyun Jin|Sim Hyun Seo|Lee Chan Yoo,/people/1465-kim-dong-wook|/people/19984-kim-sung-gyu|/people/442-chae-jung-ahn|/people/68515-choi-hyun-jin|/people/39759-shim-hyun-seo|/people/30335-lee-chan-yoo,Thriller|Mystery|Drama,School Bullying|Detective Male Lead|School Violence|Flashback To Past|Revenge|Murder|Detective Female Lead|Child Abuse|Mental Illness|Investigation (Vote or add tags),Tak Jae Young,Kim Dae Jin,https://i.mydramalist.com/2bO4w_4c.jpg,"Two friends meet up and recall their experiences as victims of school bullying when they receive a message from a friend from 20 years ago and mysterious serial killings begin to occur. Kyung Min lives with the trauma of the school violence he experienced twenty years ago and an unexpected case causes his suppressed emotions to reappear. Meanwhile, Detective Jong Suk receives a mysterious message sent from a friend from 20 years ago which reminds him of the school violence that took place back then. Chasing the mysterious message, he tries to put a stop to the murders.Through these characters with tragic fates, the drama touches on the origin of school violence and the bullying that pervades modern society. (Source: AsianWiki)~~ Adapted from the animated film ""The King of Pigs"" (돼지의 왕) by Yeon Sang Ho (연상호), based on a true story.",South Korea,Drama,12,"Mar 18, 2022 - Apr 22, 2022",Friday,TVING,55 min.,"8.7 (scored by 4,885 users)",287,1028,18+ Restricted (violence & profanity),15550
693591-in-house-confrontation,A Business Proposal,A Business Proposal (2022),2022,8.7,102238,Ahn Hyo Seop|Kim Se Jeong|Kim Min Gue|Seol In Ah|Lee Deok Hwa|Choi Byung Chan,/people/11001-ahn-hyo-sub|/people/13855-kim-se-jung|/people/11693-kim-min-kyu|/people/14261-seol-in-ah|/people/1397-lee-duk-hwa|/people/14273-choi-byung-chan,Comedy|Romance|Drama,Boss-Employee Relationship|Secondary Couple|Fake Identity|Contract Relationship|Company President (CEO) Male Lead|Double Identity|Sismance|Rich Male Lead|Cheerful Female Lead|Male Chases Female First (Vote or add tags),Han Sul Hee|Hong Bo Hee,Park Seon Ho,https://i.mydramalist.com/v24Pg_4c.jpg,"Shin Ha Ri is a single woman who works for a company. She has a male friend, who she has had a crush on for a long time, but she learns he has a girlfriend. Shin Ha Ri feels sad and decides to meet her friend Jin Young Seo, who is a daughter of a chaebol family. Jin Young Seo then asks Shin Ha Ri to take her place on a blind date and even offers some money for her time. Shin Ha Ri accepts her friend's offer. She goes out on a blind date as Jin Young Seo while having the intention of getting rejected by her date. When she sees her blind date, Shin Ha Ri is dumbfounded. Her blind date is Kang Tae Moo. He is the CEO of the company where she works.Kang Tae Moo is the CEO of a company that his grandfather founded. One day, his grandfather informed him of an upcoming blind date that he set up for him. Kang Tae Moo is a workaholic, and he is annoyed that his grandfather sets up blind dates for him. He decides to marry the next woman whom he meets on a blind date, so he won't be disturbed from his work anymore. That woman is Shin Ha Ri, but she is pretending to be Jin Young Seo.On the following day, Shin Ha Ri receives a phone call from Kang Tae Moo. He asks her to marry him.(Source: AsianWiki)~~ Adapted from the web novel ""The Office Blind Date"" (사내 맞선) by Hae Hwa (해화).",South Korea,Drama,12,"Feb 28, 2022 - Apr  5, 2022","Monday, Tuesday",Netflix SBS,60 min.,"8.7 (scored by 102,238 users)",282,15,15+ - Teens 15 or older,145457
717539-the-devil,Revenant,Revenant (2023),2023,8.7,10381,Kim Tae Ri|Oh Jung Se|Hong Kyung|Park Ji Young|Yang Hye Ji|Jin Seon Kyu,/people/8838-kim-tae-ri|/people/4684-oh-jung-se|/people/15693-hong-kyung|/people/7377-park-ji-young|/people/16354-yang-hye-ji|/people/5628-jin-sun-gyu,Thriller|Mystery|Horror|Supernatural,Spirit Possession|Occult|Folklore|Spirit|Student Female Lead|Winter Setting|Ghost Supporting Character|Professor Male Lead|Detective Supporting Character|Detective Male Lead (Vote or add tags),Kim Eun Hee,Lee Jung Rim|Kim Jae Hong,https://i.mydramalist.com/2wm4rd_4c.jpg,"When the door to another world opens, demons exist there. Ku San Young is possessed by one of those demons. Yeom Hae Sang can see the demon which has possessed Ku San Young. They try to figure out the truth behind the mysterious deaths related to the five sacred objects.Ku San Young is busy working part-time during the day and studying to become a low-ranking public officer at night. One day, she receives some articles left behind by her late father. Since then, mysterious deaths take place around her. She also finds herself slowly changing.Yeom Hae Sang comes from a rich background. He teaches Korean folklore at a university. Since he was a child, he has had the special ability to see demons in this world. He even saw his mother get killed by a demon in front of him when he was young. Yeom Hae Sang meets Ku San Young and he faces the demon which killed his mother.Lee Hong Sae is a lieutenant in the violent crimes investigation team. He only cares about advancing his career in the police department. Due to Ku San Young and Yeom Hae Sang, he gets involved in mysterious cases.(Source: AsianWiki)",South Korea,Drama,12,"Jun 23, 2023 - Jul 29, 2023","Friday, Saturday",Disney+ SBS,1 hr. 10 min.,"8.7 (scored by 10,381 users)",298,488,15+ - Teens 15 or older,28046
711391-the-police-station-next-to-fire-station,The First Responders,The First Responders (2022),2022,8.7,8311,Kim Rae Won|Son Ho Jun|Gong Seung Yeon|Kang Seo Ha|Hwang Young Hee|Kang Gi Doong,/people/301-kim-rae-won|/people/3891-son-ho-jun|/people/9347-gong-seung-yeon|/people/115109-kang-seo-ha|/people/3267-hwang-young-hee|/people/14229-kang-ki-doong,Action|Thriller|Mystery|Drama,Teamwork|Firefighter Male Lead|Slight Romance|Investigation|Paramedic Female Lead|Suspense|Bromance|Student-Teacher Relationship|Selfish Parent|Escape From Death (Vote or add tags),Min Ji Eun,Shin Kyung Soo,https://i.mydramalist.com/XnW5J_4c.jpg,"Follow the joint operations of a police force and a fire department, who together will tell a thrilling story. Fierce detective Jin Ho Gae is all about catching low-lifes. He solves cases with his excellent ability to grasp crime scenes, read a criminal's mind, and has a strong will to win. While the fearless firefighter Bong Do Jin, who seems cold on the outside, is nice to those around him, and he takes good care of victims. He rushes to fire sites without a moment of hesitation. Joining the duo is Song Seol, an empathetic paramedic who heals broken hearts while treating wounds.(Source: pinkvilla.com)",South Korea,Drama,12,"Nov 12, 2022 - Dec 30, 2022","Friday, Saturday",DRAMAcube ENA SBS SBS Plus,60 min.,"8.7 (scored by 8,311 users)",295,790,18+ Restricted (violence & profanity),19528
19510-romantic-doctor-teacher-kim,Dr. Romantic,Dr. Romantic (2016),2016,8.7,32621,Han Seok Kyu|Yoo Yeon Seok|Seo Hyun Jin|Choi Jin Ho|Yang Se Jong|Jang Hyuk Jin,/people/968-han-seok-kyu|/people/1908-yoo-yeon-seok|/people/941-seo-hyun-jin|/people/5899-choi-jin-ho|/people/13727-yang-se-jong|/people/13114-jang-hyuk-jin,Romance|Drama|Medical,Strong Male Lead|Hardworking Female Lead|Smart Male Lead|Hardworking Male Lead|Character Development|Slow Burn Romance|Smart Female Lead|Trauma|Male Chases Female First|Strong Female Lead (Vote or add tags),Kang Eun Kyung,Yoo In Shik|Park Soo Jin,https://i.mydramalist.com/KxgYRc.jpg,"Kim Sa Bu was once a famous surgeon at the peak of his career at a major hospital. But he suddenly gives it all up one day to live in seclusion and work as a neighborhood doctor in a small town. He now goes by “Teacher Kim” and refers to himself as the “Romantic Doctor”. Meanwhile, Kang Dong Joo became a doctor to make something of himself after growing up poor, and he seeks out VIP patients to achieve the success that he desperately wants. Yoon Seo Jung is a passionate young surgeon who is haunted by a mistake from her past and tries to get over it. When Dong Joo and Seo Jung meet the quirky Teacher Kim, their lives and careers will never be the same again.",South Korea,Drama,20,"Nov  7, 2016 - Jan 16, 2017","Monday, Tuesday",SBS,60 min.,"8.7 (scored by 32,621 users)",301,118,15+ - Teens 15 or older,68649
263-jewel-in-the-palace,Jewel in the Palace,Jewel in the Palace (2003),2003,8.7,8318,Lee Young Ae|Ji Jin Hee|Hong Ri Na|Im Ho|Yang  Mi Kyung|Kyeon Mi Ri,/people/305-lee-young-ae|/people/404-ji-jin-hee|/people/3911-hong-ri-na|/people/3439-im-ho|/people/2535-yang-mi-kyung|/people/918-kyun-mi-ri,Food|Historical|Romance|Medical,Strong Female Lead|Cooking|Royal Rules And Etiquette|Joseon Dynasty|Doctor Female Lead|Orphan Female Lead|Smart Female Lead|Nice Male Lead|Slow Burn Romance|Queen Dowager Supporting Character (Vote or add tags),Kim Young Hyun,Lee Byung Hoon,https://i.mydramalist.com/wJVdnc.jpg,"About 500 years ago during the time of Chosun Dynasty, Korea boasted a rigidly hierarchical and male dominated social structure. Based on a true story about a legendary girl, Jang Geum, who became the first woman to be the supreme royal physician of her times. Despite her poor condition as a low class girl in the male dominated society, Jang Geum overcame a series of social discrimination and landed herself as a royal cook, later becoming the royal physician, then ultimately the physician in charge of the king. She was even given by the king the title ""The Great Jang Geum."" The story of her checkered life on her success and breakdown as well as her love story beautifully unfold.(Source: AsianWiki)",South Korea,Drama,54,"Sep 15, 2003 - Mar 23, 2004","Monday, Tuesday",MBC,1 hr. 5 min.,"8.7 (scored by 8,318 users)",304,853,13+ - Teens 13 or older,18589
52941-eighteen-again,18 Again,18 Again (2020),2020,8.7,32492,Kim Ha Neul|Yoon Sang Hyun|Lee Do Hyun|Roh Jeong Eui|Ryeoun|Wi Ha Joon,/people/403-kim-ha-neul|/people/188-yoon-sang-hyun|/people/17489-lee-do-hyun|/people/4419-noh-jung-eui|/people/23633-ryeo-woon|/people/16210-wi-ha-joon,Romance|Life|Drama|Fantasy,First Love|Father-Son Relationship|Father-Daughter Relationship|Hardworking Female Lead|Mother-Daughter Relationship|Life Lesson|Becoming Young|Hidden Identity|Character Development|Teenage Pregnancy (Vote or add tags),Kim Do Yeon|Ahn Eun Bin|Choi Yi Ryun,Ha Byung Hoon,https://i.mydramalist.com/xnNnq_4c.jpg,"Jung Da Jung and Hong Dae Young have been married for almost two decades, raising their twins together. Despite appearances, their life is far from ideal, filled with Dae Young's incessant nonsense. When he gets fired and Da Jung can't take it anymore, she files for divorce. This drastic step forces Dae Young to reflect on his life and all his regrets. Suddenly, he transforms into an eighteen-year-old with the same middle-aged mind. Renaming himself Ko Woo Young, he enrolls in his children's school, gaining a new perspective on life.(Source: MyDramaList)~~ Remake of the American film “17 Again"" [2009].",South Korea,Drama,16,"Sep 21, 2020 - Nov 10, 2020","Monday, Tuesday",jTBC,1 hr. 10 min.,"8.7 (scored by 32,492 users)",296,109,15+ - Teens 15 or older,71674
10619-incomplete-life,Misaeng: Incomplete Life,Misaeng: Incomplete Life (2014),2014,8.7,12761,Yim Si Wan|Lee Sung Min|Kang So Ra|Kang Ha Neul|Kim Dae Myung|Byun Yo Han,/people/1891-im-shi-wan|/people/1658-lee-sung-min|/people/1155-kang-so-ra|/people/3850-kang-ha-neul|/people/7712-kim-dae-myung|/people/7710-byun-yo-han,Business|Life|Drama,Workplace Abuse|Teamwork|Adapted From A Webtoon|Hardworking Male Lead|Smart Female Lead|Strong Female Lead|Nice Male Lead|Hardworking Female Lead|Bromance|Boss-Employee Relationship (Vote or add tags),Jung Yoon Jung,Kim Won Suk,https://i.mydramalist.com/jqA1wc.jpg,"Jang Geu Rae has played the game of Go since he was a child. When his plans of becoming a professional Go player fail, the down-and-out Geu Rae is forced to take an office job as an intern set up for him by an acquaintance’s recommendation for him to a large company called One International.On his first day of work, Geu Rae meets an eager fellow intern, An Yeong Yi, as they both try to please their new boss, Section Chief Oh Sang Shik and keep up with the ambitious employee, Jang Baek Ki. But they quickly find that their department is a little different from the others.Geu Rae does his best at his new job while trying not to lose his humanity along the way.~~ Adapted from the webtoon series ""Misaeng: Incomplete Life"" (미생 - 아직 살아 있지 못한 자) by Yoon Tae Ho (윤태호).",South Korea,Drama,20,"Oct 17, 2014 - Dec 20, 2014","Friday, Saturday",tvN,1 hr. 20 min.,"8.7 (scored by 12,761 users)",306,398,15+ - Teens 15 or older,32867
33075-strangers-from-hell,Strangers from Hell,Strangers from Hell (2019),2019,8.7,29914,Yim Si Wan|Lee Dong Wook|Lee Jung Eun|Ahn Eun Jin|Park Jong Hwan|Lee Joong Ok,/people/1891-im-shi-wan|/people/274-lee-dong-wook|/people/10706-lee-jung-eun|/people/18592-ahn-eun-jin|/people/9627-park-jong-hwan|/people/20230-lee-joong-ok,Thriller|Horror|Psychological|Drama,Adapted From A Webtoon|Murder|Gaslighting|Mental Torment|Mental Illness|Trauma|Torture|Hot-Tempered Male Lead|Animal Abuse|Animal Death (Vote or add tags),Jung Yi Do,Lee Chang Hee,https://i.mydramalist.com/4p2vdc.jpg,"Yoon Jong Woo is a young guy in his 20s who moves from the countryside to Seoul after his college friend, Jae Ho, offers him a job. While looking for a place to live, he stumbles upon Eden Gosiwon, a cheap hostel that shares the kitchen and bathroom with other residents. He is not thrilled about the quality of the place or the other abnormal residents, such as his next-door neighbor Seo Moon Jo, a charismatic dentist. Nevertheless, Jong Woo decides to put up with it for 6 months until he saves enough money to move out. However, mysterious events start occurring in the apartment, causing Jong Woo to begin fearing the apartment's residents.(Source: MyDramaList)~~ Adapted from a webtoon of the same title by Kim Yong Ki.",South Korea,Drama,10,"Aug 31, 2019 - Oct  6, 2019","Saturday, Sunday",OCN,60 min.,"8.7 (scored by 29,914 users)",307,117,15+ - Teens 15 or older,68978
697585-our-blues,Our Blues,Our Blues (2022),2022,8.6,13827,Lee Byung Hun|Shin Min Ah|Cha Seung Won|Lee Jung Eun|Uhm Jung Hwa|Han Ji Min,/people/324-lee-byung-hun|/people/282-shin-min-ah|/people/488-cha-seung-won|/people/10706-lee-jung-eun|/people/632-uhm-jung-hwa|/people/1225-han-ji-min,Romance|Life|Drama|Melodrama,Multiple Mains|Anthology|Island Setting|Middle-Aged Female Lead|Friendship|Slow Burn Story|Depression|Father-Daughter Relationship|Multiple Couples|Middle-Aged Male Lead (Vote or add tags),Noh Hee Kyung,Kim Kyu Tae|Lee Jung Mook,https://i.mydramalist.com/48LYQ_4c.jpg,"""Our Blues"" takes on an omnibus-style drama, which tells the story of diverse characters that are somewhat interconnected, in one way or the other.Lee Dong Suk, a guy born on the beautiful island of Jeju, selling goods from the mainland in his truck for a living. He meets Min Sun Ah, a girl with a mysterious past, who has come to Jeju to escape that life.Park Jung Joon, a ship captain, falls in love with Lee Young Ok, a diver with a bright and bubbly personality.Jung Eun Hee, a fish shop owner, reunites with her past lover Choi Han Soo. They cross paths in Jeju Island when he returns back, after realizing that city life is not for him.(Source: EpicStream.com, edited by MyDramaList)",South Korea,Drama,20,"Apr  9, 2022 - Jun 12, 2022","Saturday, Sunday",Netflix tvN,1 hr. 10 min.,"8.6 (scored by 13,827 users)",322,311,15+ - Teens 15 or older,38853
22403-chicago-typewriter,Chicago Typewriter,Chicago Typewriter (2017),2017,8.6,24219,Yoo Ah In|Lim Soo Jung|Go Kyung Pyo|Kwak Shi Yang|Jo  Woo Jin|Oh Na Ra,/people/432-yoo-ah-in|/people/283-im-soo-jung|/people/2374-go-kyung-pyo|/people/7009-kwak-shi-yang|/people/6557-jo-woo-jin|/people/2915-oh-na-ra,Comedy|Romance|Supernatural|Political,Reincarnation|Friendship|Hardworking Male Lead|Hardworking Female Lead|Strong Female Lead|Successful Male Lead|Bromance|Flashback To Past|Tragic Past|Character Development (Vote or add tags),Jin Soo Wan,Kim Chul Gyu,https://i.mydramalist.com/Jkd1jc.jpg,"This drama follows the lives of two men and a woman through two eras: one during the 1930s Japanese occupation of Korea and the other in the 21st century. The three main characters are:(1) Han Se Joo was a writer in his past life and a bestselling author in the present. But Se Joo is depressed with writer’s block so he can't write his next book.(2) Yu Jin Oh owned a bar in his previous life. In 2017, he is a talented ghostwriter who can bail Se Joo out of his predicament, but the mysterious man has a condition for his services. Se Joo may not be able to meet it.(3) Jeon Seol was a sniper. Now she has extremely varied expertise. She is a former Olympian hopeful, a veterinarian, and a book lover who runs her own delivery service. She oscillates between extreme fandom and anti-fandom of Se Joo.The intricately woven story of these three characters unfolds to reveal strange mirroring connections between the time periods as well as possibilities for past lives to be redeemed or improved in the modern world. This story depicts Korea and the friendship between the three beautifully through different times.",South Korea,Drama,16,"Apr  7, 2017 - Jun  3, 2017","Friday, Saturday",tvN,1 hr. 10 min.,"8.6 (scored by 24,219 users)",314,135,15+ - Teens 15 or older,62663
