quote,author,likes,category
"For to know a man's library is, in some measure, to know his mind.",Geraldine Brooks,2629,
I wonder if the snow,Lewis Carroll,2628,appreciation|nature|seasons|snow|winter
The only way to deal with an unfree world is to become so absolutely free that your very existence is an act of rebellion.,Albert Camus,2627,
"If books could have more, give more, be more, show more, they would still need readers who bring to them sound and smell and light and all the rest that can’t be in books.",Gary Paulsen,2626,books
"There is only one sin. and that is theft... when you tell a lie, you steal someones right to the truth.",Khaled Hosseini,2626,life
Knowing too much of your future is never a good thing.,Rick Riordan,2625,fate|future|knowledge
The clearest way into the Universe is through a forest wilderness.,John Muir,2624,animals|caring|earth|forests|nature|plants|trees|wilderness
"If I am really a part of your dream, you'll come back one day.",Paulo Coelho,2624,
Better to die fighting for freedom then be a prisoner all the days of your life.,Bob Marley,2620,freedom|liberty|life|revolution
Only you can control your future.,Dr. Seuss,2620,
"We sit silently and watch the world around us. This has taken a lifetime to learn. It seems only the old are able to sit next to one another and not say anything and still feel content. The young, brash and impatient, must always break the silence. It is a waste, for silence is pure. Silence is holy. It draws people together because only those who are comfortable with each other can sit without speaking. This is the great paradox.",Nicholas Sparks,2618,perception|silence
Sometimes love means letting go when you want to hold on tighter.,Melissa Marr,2618,love
"If you look the right way, you can see that the whole world is a garden.",Frances Hodgson Burnett,2618,perspective|positive-attitude
"Behind every beautiful thing, there's some kind of pain.",Bob Dylan,2617,beautiful|behind|kind|of|pain|thing
I myself have never been able to find out precisely what feminism is: I only know that people call me a feminist whenever I express sentiments that differentiate me from a doormat.,Rebecca West,2616,feminism|qotd
Time was passing like a hand waving from a train I wanted to be on.,Jonathan Safran Foer,2616,desperate|life|losing|love|nostalgia|pain|regret|solitude
"Ah, music,"" he said, wiping his eyes. ""A magic beyond all we do here!",J.K. Rowling,2616,dumbledore|magic|music|power-of-music
Very few of us are what we seem.,Agatha Christie,2615,
Tears are words that need to be written.,Paulo Coelho,2615,inspirational|sadness|writing
Shut your eyes and see.,James Joyce,2612,
"Children have never been very good at listening to their elders, but they have never failed to imitate them.",James     Baldwin,2612,parenting|role-models
A word after a word after a word is power.,Margaret Atwood,2611,reading|writing
"It's not worth doing something unless someone, somewhere, would much rather you weren't doing it.",Terry Pratchett,2611,
"I know of a cure for everything: salt water...in one way or the other. Sweat, or tears, or the salt sea.",Karen Blixen,2610,
Adults are always asking little kids what they want to be when they grow up ’cause they’re looking for ideas.,Paula Poundstone,2610,
"When we're incomplete, we're always searching for somebody to complete us. When, after a few years or a few months of a relationship, we find that we're still unfulfilled, we blame our partners and take up with somebody more promising. This can go on and on--series polygamy--until we admit that while a partner can add sweet dimensions to our lives, we, each of us, are responsible for our own fulfillment. Nobody else can provide it for us, and to believe otherwise is to delude ourselves dangerously and to program for eventual failure every relationship we enter.",Tom Robbins,2610,relationships
"Dreams are always crushing when they don't come true. But it's the simple dreams that are often the most painful because they seem so personal, so reasonable, so attainable. You're always close enough to touch, but never quite close enough to hold and it's enough to break your heart.",Nicholas Sparks,2609,life-dreams
"You could say sorry,"" suggested Harry bluntly.",J.K. Rowling,2609,humor-mustache
"Talking to a drunk person was like talking to an extremely happy, severely brain-damaged three-year-old.",John Green,2607,
No one has ever become poor by giving.,Anne Frank,2607,charity|compassion|helping-others|kindness
In the world I am,Bei Dao,2607,
You can only be young once. But you can always be immature.,Pat  Monahan,2607,humor|immature|young
Only those who will risk going too far can possibly find out how far one can go.,T.S. Eliot,2607,poetry
"Laughter is wine for the soul - laughter soft, or loud and deep, tinged through with seriousness - the hilarious declaration made by man that life is worth living.",Seán O'Casey,2606,joy|laughter
"Selfishness is not living as one wishes to live, it is asking others to live as one wishes to live.",Oscar Wilde,2606,selfishness
so I wait for you like a lonely house,Pablo Neruda,2605,
"If I had my life to live over again, I would have made a rule to read some poetry and listen to some music at least once every week.",Charles Darwin,2605,arts|life|music|poetry
Let everything happen to you,Rainer Maria Rilke,2602,enjoy-life|fearlessness|live-in-the-moment
"I don't mind making jokes, but I don't want to look like one.",Marilyn Monroe,2602,appearance|jokes|marilyn-monroe
"I've lived through some terrible things in my life, some of which actually happened.",Mark Twain,2602,humor
"And then something invisible snapped insider her, and that which had come together commenced to fall apart.",John Green,2601,depressing|wise
"You must write every single day of your life... You must lurk in libraries and climb the stacks like ladders to sniff books like perfumes and wear books like hats upon your crazy heads... may you be in love every day for the next 20,000 days. And out of that love, remake a world.",Ray Bradbury,2600,writing
"When you read a book, you hold another's mind in your hands.",James  Burke,2599,
"the free soul is rare, but you know it when you see it - basically because you feel good, very good, when you are near or with them.",Charles Bukowski,2598,
There are two means of refuge from the misery of life — music and cats.,Albert Schweitzer,2598,cats|life|music
You’ll miss the best things if you keep your eyes shut.,Dr. Seuss,2596,
Only the dead have seen the end of war.,Plato,2596,dead|life-lessons|war|warriors
Be glad. Be good. Be brave.,Eleanor H. Porter,2596,
There are nights when the wolves are silent and only the moon howls.,George Carlin,2591,
"Never be bullied into silence. Never allow yourself to be made a victim. Accept no one's definition of your life, but define yourself.",Harvey Fierstein,2591,be-yourself|identity|individuality|inspirational|life|self-determination|self-esteem|self-expression
That's what careless words do. They make people love you a little less.,Arundhati Roy,2589,words
That which you believe becomes your world.,Richard Matheson,2588,
I feel like someone breathed new air into my lungs. I am not Abnegation. I am not Dauntless.,Veronica Roth,2587,
"I am lonely, yet not everybody will do. I don't know why, some people fill the gaps and others emphasize my loneliness. In reality those who satisfy me are those who simply allow me to live with my ''idea of them.",Anaïs Nin,2587,diary-entry
"Of all the words of mice and men, the saddest are, ""It might have been.",Kurt Vonnegut,2586,hindsight|regret
"I’m on a roller coaster that only goes up, my friend.",John Green,2585,
Being entirely honest with oneself is a good exercise.,Sigmund Freud,2585,
"The trouble is not that I am single and likely to stay single, but that I am lonely and likely to stay lonely.",Charlotte Brontë,2584,companionship|loneliness|marriage|single|spinsterhood
Kindred spirits are not so scarce as I used to think. It's splendid to find out there are so many of them in the world.,L.M. Montgomery,2583,
If you never did you should. These things are fun and fun is good.,Dr. Seuss,2583,suess
"[D]on't ever apologise to an author for buying something in paperback, or taking it out from a library (that's what they're there for.",Neil Gaiman,2581,books|libraries|library|reading
"From childhood's hour I have not been. As others were, I have not seen. As others saw, I could not awaken. My heart to joy at the same tone. And all I loved, I loved alone.",Edgar Allan Poe,2581,heartache|loss|love
I got schooled this year,Colleen Hoover,2579,layken|slammed
"If you're texting Magnus to say 'I think u r kewl,' I'm going to kill you.""",Cassandra Clare,2579,alec|city-of-ashes|isabelle|magnus-bane|max|mortal-instruments
"You should write because you love the shape of stories and sentences and the creation of different words on a page. Writing comes from reading, and reading is the finest teacher of how to write.",Annie Proulx,2579,reading|words|writing
"Alec looked at her and shook his head. ""How do you manage never to get mud on your clothes?""",Cassandra Clare,2577,alec-lightwood|city-of-ashes|clean|dirt|humor|isabelle-lightwood|sarcasm
"Things need not have happened to be true. Tales and dreams are the shadow-truths that will endure when mere facts are dust and ashes, and forgot.",Neil Gaiman,2577,sandman
A person often meets his destiny on the road he took to avoid it.,Jean de La Fontaine,2576,
Break my heart. Break it a thousand times if you like. It was only ever yours to break anyway.,Kiera Cass,2575,
"silence is the language of god,",Jalaluddin Rumi,2575,language|power-of-words|remaining-silent
those who escape hell,Charles Bukowski,2575,
"In my next life I want to live my life backwards. You start out dead and get that out of the way. Then you wake up in an old people's home feeling better every day. You get kicked out for being too healthy, go collect your pension, and then when you start work, you get a gold watch and a party on your first day. You work for 40 years until you're young enough to enjoy your retirement. You party, drink alcohol, and are generally promiscuous, then you are ready for high school. You then go to primary school, you become a kid, you play. You have no responsibilities, you become a baby until you are born. And then you spend your last 9 months floating in luxurious spa-like conditions with central heating and room service on tap, larger quarters every day and then Voila! You finish off as an orgasm!",Woody Allen,2574,
"What's up?"" I asked.",Richelle Mead,2573,fight|humor
Trees that are slow to grow bear the best fruit.,Molière,2571,inspirational|patience
"Literature is a textually transmitted disease, normally contracted in childhood.",Jane Yolen,2571,childhood|disease|literature
"I wish I were a girl again, half-savage and hardy, and free.",Emily Brontë,2569,
Even in the Future the Story Begins with Once Upon a Time.,Marissa Meyer,2569,
"Have you tried talking to her?""",Cassandra Clare,2569,humor-sarcasm
A well-composed book is a magic carpet on which we are wafted to a world that we cannot enter in any other way.,Caroline Gordon,2567,books|imagination|writing
Some walks you have to take alone.,Suzanne Collins,2566,
"Life is a mirror: if you frown at it, it frowns back; if you smile, it returns the greeting.",William Makepeace Thackeray,2566,
I like good strong words that mean something…,Louisa May Alcott,2565,little-women|louisa-may-alcott|words
"It's going to be all right, sir,"" Harry said over and over again, more worried by Dumbledore's silence than he had been by his weakened voice. ""We're nearly there ... I can Apparate us both back ... don't worry ...""",J.K. Rowling,2563,dumbledore|harry-potter|hope
Never underestimate the power of stupid people in large groups.,George Carlin,2562,human-nature|humor|misattributed-george-carlin|stupidity
Try to be a rainbow in someone's cloud.,Maya Angelou,2562,2008|advice
"It's much easier to not know things sometimes. Things change and friends leave. And life doesn't stop for anybody. I wanted to laugh. Or maybe get mad. Or maybe shrug at how strange everybody was, especially me. I think the idea is that every person has to live for his or her own life and than make the choice to share it with other people. You can't just sit their and put everybody's lives ahead of yours and think that counts as love. You just can't. You have to do things. I'm going to do what I want to do. I'm going to be who I really am. And I'm going to figure out what that is. And we could all sit around and wonder and feel bad about each other and blame a lot of people for what they did or didn't do or what they didn't know. I don't know. I guess there could always be someone to blame. It's just different. Maybe it's good to put things in perspective, but sometimes, I think that the only perspective is to really be there. Because it's okay to feel things. I was really there. And that was enough to make me feel infinite. I feel infinite.",Stephen Chbosky,2560,
"If you stay, I'll do whatever you want. I'll quit the band, go with you to New York. But if you need me to go away, I'll do that, too. I was talking to Liz and she said maybe coming back to your old life would be too painful, that maybe it'd be easier for you to erase us. And that would suck, but I'd do it. I can lose you like that if I don't lose you today. I'll let you go. If you stay.",Gayle Forman,2560,infatuation|life|love|self-sacrifice
"I am beginning to learn that it is the sweet, simple things of life which are the real ones after all.",Laura Ingalls Wilder,2559,
The brick walls are there for a reason. The brick walls are not there to keep us out. The brick walls are there to give us a chance to show how badly we want something. Because the brick walls are there to stop the people who don’t want it badly enough. They’re there to stop the other people.,Randy Pausch,2558,barriers|challenges|failure|failures|inspirational|perseverance
"I'm always happy,"" Sasha said. ""Sometimes I just forget.",Jennifer Egan,2557,
"Trains are great dirty smoky things,"" said Will. ""You won't like it.""",Cassandra Clare,2556,clockwork-prince|humor|jem-carstairs|teasing|tessa-gray|will-herondale
Nothing takes the taste out of peanut butter quite like unrequited love.,Charles M. Schulz,2556,humor|love
I have nothing to declare except my genius.,Oscar Wilde,2556,humor
Only a generation of readers will spawn a generation of writers.,Steven Spielberg,2555,education|reading
I hope that one day you will have the experience of doing something you do not understand for someone you love.,Jonathan Safran Foer,2555,
There is more than one way to burn a book. And the world is full of people running about with lit matches.,Ray Bradbury,2555,censorship
"Light thinks it travels faster than anything but it is wrong. No matter how fast light travels, it finds the darkness has always got there first, and is waiting for it.",Terry Pratchett,2554,darkness|light|speed-of-light
"I am glad you are here with me. Here at the end of all things, Sam.",J.R.R. Tolkien,2554,friendship|frodo
"Where you used to be, there is a hole in the world, which I find myself constantly walking around in the daytime, and falling in at night. I miss you like hell.",Edna St. Vincent Millay,2554,loneliness|loss|yearning
"In one aspect, yes, I believe in ghosts, but we create them. We haunt ourselves.",Laurie Halse Anderson,2553,ghosts|haunt
"He awoke each morning with the desire to do right, to be a good and meaningful person, to be, as simple as it sounded and as impossible as it actually was, happy. And during the course of each day his heart would descend from his chest into his stomach. By early afternoon he was overcome by the feeling that nothing was right, or nothing was right for him, and by the desire to be alone. By evening he was fulfilled: alone in the magnitude of his grief, alone in his aimless guilt, alone even in his loneliness.",Jonathan Safran Foer,2552,sadness
,Cassandra Clare,2551,cassandra-clare|clockwork-prince|tessa-gray|will-herondale|will-s-letter-to-tessa
"I hope you will have a wonderful year, that you'll dream dangerously and outrageously, that you'll make something that didn't exist before you made it, that you will be loved and that you will be liked, and that you will have people to love and to like in return. And, most importantly (because I think there should be more kindness and more wisdom in the world right now), that you will, when you need to be, be wise, and that you will always be kind.",Neil Gaiman,2549,kindness
"I am looking for friends. What does that mean -- tame?""",Antoine de Saint-Exupéry,2549,friendship|wisdom
The snake which cannot cast its skin has to die. As well the minds which are prevented from changing their opinions; they cease to be mind.,Friedrich Nietzsche,2549,change|mind|nietzsche
The most certain sign of wisdom is cheerfulness.,Michel de Montaigne,2548,
"Owners of dogs will have noticed that, if you provide them with food and water and shelter and affection, they will think you are god. Whereas owners of cats are compelled to realize that, if you provide them with food and water and shelter and affection, they draw the conclusion that",Christopher Hitchens,2548,affection|atheism|cats|dogs|food|god|pets|religion|shelter|water
Sex is part of nature. I go along with nature.,Marilyn Monroe,2546,
Some things in life are out of your control. You can make it a party or a tragedy.,Nora Roberts,2544,
There are two ways of spreading light: to be the candle or the mirror that receives it.,Edith Wharton,2542,
"Hope can be a powerful force. Maybe there's no actual magic in it, but when you know what you hope for most and hold it like a light within you, you can make things happen, almost like magic.",Laini Taylor,2542,hope|hopelessness|magic
Is there no way out of the mind?,Sylvia Plath,2542,
It does not matter how slowly you go as long as you do not stop.,Confucius,2542,education|inspirational|life|perseverance
"When someone is in your heart, they're never truly gone. They can come back to you, even at unlikely times.",Mitch Albom,2541,love
Maybe our girlfriends are our soulmates and guys are just people to have fun with.,Candace Bushnell,2541,dating|humor|relationships|soulmates
I am too fond of reading books to care to write them.,Oscar Wilde,2540,reading
"You know, Hobbes, some days even my lucky rocket ship underpants don't help.",Bill Watterson,2539,bad-day|calvin-and-hobbes|luck
"Come sleep with me: We won't make Love, Love will make us.",Julio Cortázar,2537,love|poem|relationships|romance
"Writing is like sex. First you do it for love, then you do it for your friends, and then you do it for money.",Virginia Woolf,2537,writing
"There are only the pursued, the pursuing, the busy and the tired.",F. Scott Fitzgerald,2537,demographics
The best way to cheer yourself is to cheer somebody else up.,Albert Einstein,2537,
"We dream to give ourselves hope. To stop dreaming - well, that’s like saying you can never change your fate.",Amy Tan,2536,dream|fate|hope
"They always say time changes things, but you actually have to change them yourself.",Andy Warhol,2536,change|initiative|time
Let the first act of every morning be to make the following resolve for the day:,Mahatma Gandhi,2535,bravery|god|goodness|humanity|justice|kindness|peace|suffering
"Holding Eleanor's hand was like holding a butterfly. Or a heartbeat. Like holding something complete, and completely alive.",Rainbow Rowell,2534,friendship|high-school|love|relationships|sweet|teenage-love
"I am always saying ""Glad to've met you"" to somebody I'm not at all glad I met. If you want to stay alive, you have to say that stuff, though.",J.D. Salinger,2534,friendship|insincerity|manners
The unfed mind devours itself.,Gore Vidal,2534,
I'm killing time while I wait for life to shower me with meaning and happiness.,Bill Watterson,2532,calvin-and-hobbes|humor|life
Everything must be made as simple as possible. But not simpler.,Albert Einstein,2532,einstein|paraphrased|science|systems
"You are not special. You're not a beautiful and unique snowflake. You're the same decaying organic matter as everything else. We're all part of the same compost heap. We're all singing, all dancing crap of the world.",Chuck Palahniuk,2531,unique
Courage is found in unlikely places.,J.R.R. Tolkien,2530,bravery|courage
"History does not always repeat itself. Sometimes it just yells, 'Can't you remember anything I told you?' and lets fly with a club.",John W. Campbell Jr.,2527,
"To die, it's easy. But you have to struggle for life.",Art Spiegelman,2527,
Don't cry over someone who wouldn't cry over you.,Lauren Conrad,2526,crying|heartache|love|sadness|tears
I suffer from girlnextdooritis where the guy is friends with you and that's it.,Taylor Swift,2524,relationships
"I used to dream about escaping my ordinary life, but my life was never ordinary. I had simply failed to notice how extraordinary it was.",Ransom Riggs,2523,
"To err is human, to forgive, divine.",Alexander Pope,2523,failure|forgiveness|humanity|mistakes
"I hope you're pleased with yourselves. We could all have been killed - or worse, expelled. Now if you don't mind, I'm going to bed.",J.K. Rowling,2523,humor|school
"The Very first moment I beheld him, my heart was irrevocably gone.",Jane Austen,2522,romance
"With enough courage, you can do without a reputation.",Margaret Mitchell,2522,courage|reputation
"Every book, every volume you see here, has a soul. The soul of the person who wrote it and of those who read it and lived and dreamed with it. Every time a book changes hands, every time someone runs his eyes down its pages, its spirit grows and strengthens.",Carlos Ruiz Zafón,2521,inspirational|soul|spiritual-growth
"Raise your words, not voice. It is rain that grows flowers, not thunder.",Jalaluddin Rumi,2520,
"Trust your heart if the seas catch fire, live by love though the stars walk backward.",E.E. Cummings,2520,decisions|love|stars|taking-chances
"Why do people say ""grow some balls""? Balls are weak and sensitive. If you wanna be tough, grow a vagina. Those things can take a pounding.",Sheng Wang,2519,feminism|humor|misattributed-betty-white
"When God Created Mothers""",Erma Bombeck,2515,children|family|humor|love|mothers|mothers-day|sadness
Do not fall in love with people like me.,Caitlyn Siehl,2514,beautiful|blood|kiss|life|love|mouth|museums|parks
Happiness is something that comes into our lives through doors we don't even remember leaving open.,Rose Wilder Lane,2514,
"Once you have read a book you care about, some part of it is always with you.",Louis L'Amour,2514,books|inspirational|reading
The past is never where you think you left it.,Katherine Anne Porter,2514,past
This is the way the world ends,T.S. Eliot,2514,apocalypse|despair|poetry
"You never know what life is like, until you have lived it.",Marilyn Monroe,2513,
"You may encounter many defeats, but you must not be defeated. In fact, it may be necessary to encounter the defeats, so you can know who you are, what you can rise from, how you can still come out of it.",Maya Angelou,2513,adversity|character|failure|perseverance
Holding anger is a poison...It eats you from inside...We think that by hating someone we hurt them...But hatred is a curved blade...and the harm we do to others...we also do to ourselves.,Mitch Albom,2510,ruby-anger
"But I believe in true love, you know? I don't believe that everybody gets to keep their eyes or not get sick or whatever, but everybody should have true love, and it should last at least as long as your life does.",John Green,2509,
But I love your feet,Pablo Neruda,2509,
"That which can be asserted without evidence, can be dismissed without evidence.",Christopher Hitchens,2509,atheism|reason|science|skeptic
What's terrible is to pretend that second-rate is first-rate. To pretend that you don't need love when you do; or you like your work when you know quite well you're capable of better.,Doris Lessing,2506,inspirational
"People have forgotten this truth,"" the fox said. ""But you mustn’t forget it. You become responsible forever for what you’ve tamed. You’re responsible for your rose.",Antoine de Saint-Exupéry,2505,friendship|love|responsibility
Children learn more from what you are than what you teach.,W.E.B. Du Bois,2505,
"Absence diminishes small loves and increases great ones, as the wind blows out the candle and fans the bonfire.",François de La Rochefoucauld,2505,love
"I guess that's what saying good-bye is always like--like jumping off an edge. The worst part is making the choice to do it. Once you're in the air, there's nothing you can do but let go.",Lauren Oliver,2504,before-i-fall|young-adult-fiction
"Imagination is like a muscle. I found out that the more I wrote, the bigger it got.",Philip José Farmer,2504,imagination|writing
Nothing on earth can make up for the loss of one who has loved you.,Selma Lagerlöf,2503,
Those who know do not speak. Those who speak do not know.,Lao Tzu,2502,philosophy|wayfinding
Wanting to be someone else is a waste of the person you are.,Marilyn Monroe,2501,inspirational|misattributed|self-acceptance|self-esteem
"A mother is the truest friend we have, when trials heavy and sudden fall upon us; when adversity takes the place of prosperity; when friends desert us; when trouble thickens around us, still will she cling to us, and endeavor by her kind precepts and counsels to dissipate the clouds of darkness, and cause peace to return to our hearts.",Washington Irving,2501,mother
"Stop fighting me!"" he said, trying to pull on the arm he held.",Richelle Mead,2500,blood|bridge|death|dhampir|dimitri|love|magic|promise|rose|stake|strigoi
