quote,author,likes,category
"Don't cry because it's over, smile because it happened.",Dr. Seuss,174616,cry|crying|experience|happiness|joy|life|misattributed-dr-seuss|optimism|sadness|smile|smiling
"I'm selfish, impatient and a little insecure. I make mistakes, I am out of control and at times hard to handle. But if you can't handle me at my worst, then you sure as hell don't deserve me at my best.",Marilyn Monroe,138415,best|life|love|mistakes|out-of-control|truth|worst
Be yourself; everyone else is already taken.,Oscar Wilde,130176,be-yourself|honesty|inspirational|misattributed-oscar-wilde
Two things are infinite: the universe and human stupidity; and I'm not sure about the universe.,Albert Einstein,116961,human-nature|humor|infinity|philosophy|science|stupidity|universe
"Be who you are and say what you feel, because those who mind don't matter, and those who matter don't mind.",Bernard M. Baruch,111385,ataraxy|be-yourself|confidence|fitting-in|individuality|those-who-matter
"So many books, so little time.",Frank Zappa,109930,books|humor
"You've gotta dance like there's nobody watching,",William W. Purkey,108773,dance|heaven|hurt|inspirational|life|love|sing
A room without books is like a body without a soul.,Marcus Tullius Cicero,107147,books|simile|soul
You know you're in love when you can't fall asleep because reality is finally better than your dreams.,Dr. Seuss,105310,dreams|love|reality|sleep
"You only live once, but if you do it right, once is enough.",Mae West,97524,humor|life
Be the change that you wish to see in the world.,Mahatma Gandhi,95892,action|change|inspirational|philosophy|wish
In three words I can sum up everything I've learned about life: it goes on.,Robert Frost,90340,life
"If you want to know what a man's like, take a good look at how he treats his inferiors, not his equals.",J.K. Rowling,84232,
"Friendship ... is born at the moment when one man says to another ""What! You too? I thought that no one but myself . . .",C.S. Lewis,79347,friendship
Don’t walk in front of me… I may not follow,Albert Camus,78427,friends|friendship|misattributed-albert-camus
No one can make you feel inferior without your consent.,Eleanor Roosevelt,77023,confidence|inspirational|wisdom
"If you tell the truth, you don't have to remember anything.",Mark Twain,76017,lies|lying|memory|truth
A friend is someone who knows all about you and still loves you.,Elbert Hubbard,72718,friend|friendship|knowledge|love
"I've learned that people will forget what you said, people will forget what you did, but people will never forget how you made them feel.",Maya Angelou,70121,
Always forgive your enemies; nothing annoys them so much.,Oscar Wilde,68976,enemies|forgiveness|strategy
Live as if you were to die tomorrow. Learn as if you were to live forever.,Mahatma Gandhi,66683,carpe-diem|education|inspirational|learning
"To live is the rarest thing in the world. Most people exist, that is all.",Oscar Wilde,65541,life
Darkness cannot drive out darkness: only light can do that. Hate cannot drive out hate: only love can do that.,Martin Luther King Jr.,65388,darkness|drive-out|hate|inspirational|light|love|peace
I am so clever that sometimes I don't understand a single word of what I am saying.,Oscar Wilde,63567,intelligence|self-deprecation
"Without music, life would be a mistake.",Friedrich Nietzsche,61032,inspirational|music|philosophy
To be yourself in a world that is constantly trying to make you something else is the greatest accomplishment.,Ralph Waldo Emerson,59808,accomplishment|be-yourself|conformity|individuality
"Here's to the crazy ones. The misfits. The rebels. The troublemakers. The round pegs in the square holes. The ones who see things differently. They're not fond of rules. And they have no respect for the status quo. You can quote them, disagree with them, glorify or vilify them. About the only thing you can't do is ignore them. Because they change things. They push the human race forward. And while some may see them as the crazy ones, we see genius. Because the people who are crazy enough to think they can change the world, are the ones who do.",Rob Siltanen,59797,advertising|apple|change|commercial|computers|different|madness|misattributed-apple|misattributed-steve-jobs|misfits|nonconformity|progressive|rebels|status-quo|think-different|troublemakers
"Insanity is doing the same thing, over and over again, but expecting different results.",Narcotics Anonymous,57801,humor|insanity|life|misattributed-ben-franklin|misattributed-mark-twain|misattributed-to-einstein
We accept the love we think we deserve.,Stephen Chbosky,57444,inspirational|love
"I believe that everything happens for a reason. People change so that you can learn to let go, things go wrong so that you appreciate them when they're right, you believe lies so you eventually learn to trust no one but yourself, and sometimes good things fall apart so better things can fall together.",Marilyn Monroe,55986,misattributed-marilyn-monroe
Twenty years from now you will be more disappointed by the things that you didn't do than by the ones you did do. So throw off the bowlines. Sail away from the safe harbor. Catch the trade winds in your sails. Explore. Dream. Discover.,H. Jackson Brown Jr.,55122,actions|disappointed|disappointment|dream|dreams|explore|misattributed-mark-twain|sail
"Only once in your life, I truly believe, you find someone who can completely turn your world around. You tell them things that you’ve never shared with another soul and they absorb everything you say and actually want to hear more. You share hopes for the future, dreams that will never come true, goals that were never achieved and the many disappointments life has thrown at you. When something wonderful happens, you can’t wait to tell them about it, knowing they will share in your excitement. They are not embarrassed to cry with you when you are hurting or laugh with you when you make a fool of yourself. Never do they hurt your feelings or make you feel like you are not good enough, but rather they build you up and show you the things about yourself that make you special and even beautiful. There is never any pressure, jealousy or competition but only a quiet calmness when they are around. You can be yourself and not worry about what they will think of you because they love you for who you are. The things that seem insignificant to most people such as a note, song or walk become invaluable treasures kept safe in your heart to cherish forever. Memories of your childhood come back and are so clear and vivid it’s like being young again. Colours seem brighter and more brilliant. Laughter seems part of daily life where before it was infrequent or didn’t exist at all. A phone call or two during the day helps to get you through a long day’s work and always brings a smile to your face. In their presence, there’s no need for continuous conversation, but you find you’re quite content in just having them nearby. Things that never interested you before become fascinating because you know they are important to this person who is so special to you. You think of this person on every occasion and in everything you do. Simple things bring them to mind like a pale blue sky, gentle wind or even a storm cloud on the horizon. You open your heart knowing that there’s a chance it may be broken one day and in opening your heart, you experience a love and joy that you never dreamed possible. You find that being vulnerable is the only way to allow your heart to feel true pleasure that’s so real it scares you. You find strength in knowing you have a true friend and possibly a soul mate who will remain loyal to the end. Life seems completely different, exciting and worthwhile. Your only hope and security is in knowing that they are a part of your life.",Bob Marley,51473,love
It is better to be hated for what you are than to be loved for what you are not.,André Gide,51347,life|love
"All that is gold does not glitter,",J.R.R. Tolkien,47817,frost|glitter|gold|lost|poetry|roots|strength|strong|wander|wither
"Imperfection is beauty, madness is genius and it's better to be absolutely ridiculous than absolutely boring.",Marilyn Monroe,46246,be-yourself|inspirational
"It is our choices, Harry, that show what we truly are, far more than our abilities.",J.K. Rowling,44798,abilities|choices
There are only two ways to live your life. One is as though nothing is a miracle. The other is as though everything is a miracle.,Albert Einstein,44625,inspirational|life|live|miracle|miracles
"The person, be it gentleman or lady, who has not pleasure in a good novel, must be intolerably stupid.",Jane Austen,44583,aliteracy|books|classic|humor
It does not do to dwell on dreams and forget to live.,J.K. Rowling,43126,dreams|life
"As he read, I fell in love the way you fall asleep: slowly, and then all at once.",John Green,43015,love
"It is better to remain silent at the risk of being thought a fool, than to talk and remove all doubt of it.",Maurice Switzer,42294,misattributed-to-abraham-lincoln|remaining-silent|wisdom
"Good friends, good books, and a sleepy conscience: this is the ideal life.",Mark Twain,41795,books|contentment|friends|friendship|life
Life is what happens to us while we are making other plans.,Allen Saunders,41102,fate|life|misattributed-john-lennon|planning|plans
"The fool doth think he is wise, but the wise man knows himself to be a fool.",William Shakespeare,40682,wisdom
"Whenever you find yourself on the side of the majority, it is time to reform (or pause and reflect).",Mark Twain,40558,individuality|majority|minority|pause|reflect|wisdom
"Yesterday is history, tomorrow is a mystery, today is a gift of God, which is why we call it the present.",Bil Keane,39701,hope|inspirational|misattributed-eleanor-roosevelt|past|present|widely-misattributed
"We are all in the gutter, but some of us are looking at the stars.",Oscar Wilde,39493,inspirational|optimism|perception|pessimism
A woman is like a tea bag; you never know how strong it is until it's in hot water.,Eleanor Roosevelt,38616,misattributed-eleanor-roosevelt
"Fairy tales are more than true: not because they tell us that dragons exist, but because they tell us that dragons can be beaten.",Neil Gaiman,37945,books|dragons|fairy-tales|inspirational|paraphrasing-g-k-chesterton
"I have not failed. I've just found 10,000 ways that won't work.",Thomas A. Edison,37723,edison|failure|inspirational|paraphrased
If you don't stand for something you will fall for anything.,Gordon A. Eadie,37302,belief|integrity|misattributed-to-malcolm-x|misattributed-to-rosa-parks
The man who does not read has no advantage over the man who cannot read.,Mark Twain,37198,aliteracy|literacy
"The opposite of love is not hate, it's indifference. The opposite of art is not ugliness, it's indifference. The opposite of faith is not heresy, it's indifference. And the opposite of life is not death, it's indifference.",Elie Wiesel,36788,activism|apathy|hate|indifference|inspirational|love|opposite|philosophy
"It is not a lack of love, but a lack of friendship that makes unhappy marriages.",Friedrich Nietzsche,36503,friendship|lack-of-friendship|lack-of-love|love|marriage|unhappy-marriage
"I may not have gone where I intended to go, but I think I have ended up where I needed to be.",Douglas Adams,35796,life|navigation
I am enough of an artist to draw freely upon my imagination. Imagination is more important than knowledge. Knowledge is limited. Imagination encircles the world.,Albert Einstein,35200,1929|imagination|inspirational|viereck-interview
"Outside of a dog, a book is man's best friend. Inside of a dog it's too dark to read.",Groucho Marx,35127,animals|books|dogs|friends|humor
I solemnly swear that I am up to no good.,J.K. Rowling,34736,mischief
"I love you without knowing how, or when, or from where. I love you simply, without problems or pride: I love you in this way because I do not know any other way of loving but this, in which there is no I or you, so intimate that your hand upon my chest is my hand, so intimate that when I fall asleep your eyes close.",Pablo Neruda,34142,love|poetry
"I like nonsense, it wakes up the brain cells. Fantasy is a necessary ingredient in living.",Dr. Seuss,33844,fantasy
"A day without sunshine is like, you know, night.",Steve Martin,33630,humor|obvious|simile
Have you ever been in love? Horrible isn't it? It makes you so vulnerable. It opens your chest and it opens up your heart and it means that someone can get inside you and mess you up.,Neil Gaiman,32686,love
Never put off till tomorrow what may be done day after tomorrow just as well.,Mark Twain,32655,humor|procrastination
"Love all, trust a few, do wrong to none.",William Shakespeare,32617,do-wrong|love|trust|wrong
You have brains in your head. You have feet in your shoes. You can steer yourself any direction you choose. You're on your own. And you know what you know. And YOU are the one who'll decide where to go...,Dr. Seuss,32194,inspirational
The Paradoxical Commandments,Kent M. Keith,32089,forgiveness|goodness|happiness|honesty|kindness|misattributed-to-mother-teresa|world
That which does not kill us makes us stronger.,Friedrich Nietzsche,31707,paraphrased|strength
"If you judge people, you have no time to love them.",Mother Teresa,30305,
For every minute you are angry you lose sixty seconds of happiness.,Ralph Waldo Emerson,30199,happiness
"There is never a time or place for true love. It happens accidentally, in a heartbeat, in a single flashing, throbbing moment.",Sarah Dessen,29780,love
"This life is what you make it. No matter what, you're going to mess up sometimes, it's a universal truth. But the good part is you get to decide how you're going to mess it up. Girls will be your friends - they'll act like it anyway. But just remember, some come, some go. The ones that stay with you through everything - they're your true best friends. Don't let go of them. Also remember, sisters make the best friends in the world. As for lovers, well, they'll come and go too. And baby, I hate to say it, most of them - actually pretty much all of them are going to break your heart, but you can't give up because if you give up, you'll never find your soulmate. You'll never find that half who makes you whole and that goes for everything. Just because you fail once, doesn't mean you're gonna fail at everything. Keep trying, hold on, and always, always, always believe in yourself, because if you don't, then who will, sweetie? So keep your head high, keep your chin up, and most importantly, keep smiling, because life's a beautiful thing and there's so much to smile about.",Marilyn Monroe,29757,friends|heartbreak|inspirational|life|love|sisters
It is never too late to be what you might have been.,George Eliot,29730,inspirational|source-unknown
"Being deeply loved by someone gives you strength, while loving someone deeply gives you courage.",Lao Tzu,29667,courage|deeply-loved|love|strength|widely-misattributed
"A reader lives a thousand lives before he dies, said Jojen. The man who never reads lives only one.",George R.R. Martin,29603,read|readers|reading|reading-books
I love deadlines. I love the whooshing noise they make as they go by.,Douglas Adams,29179,deadlines|humor|humour|work|writing
My thoughts are stars I cannot fathom into constellations.,John Green,29018,
"It takes a great deal of bravery to stand up to our enemies, but just as much to stand up to our friends.",J.K. Rowling,28619,courage|friends
Anyone who thinks sitting in church can make you a Christian must also think that sitting in a garage can make you a car.,Garrison Keillor,27781,humor|religion
"If you can't explain it to a six year old, you don't understand it yourself.",Albert Einstein,27777,simplicity|understand
Love is that condition in which the happiness of another person is essential to your own.,Robert A. Heinlein,27752,essential|happiness|love
"I'm not upset that you lied to me, I'm upset that from now on I can't believe you.",Friedrich Nietzsche,27512,lies|lying|trust
"Women and cats will do as they please, and men and dogs should relax and get used to the idea.",Robert A. Heinlein,26833,cats|humor|women
There is no greater agony than bearing an untold story inside you.,Maya Angelou,26560,1970|inspirational|stories|writing
I have always imagined that Paradise will be a kind of library.,Jorge Luis Borges,26547,books|library
Everything you can imagine is real.,Pablo Picasso,26303,art|imagination|inspirational|life
Sometimes the questions are complicated and the answers are simple.,Dr. Seuss,26067,life
"You love me. Real or not real?""",Suzanne Collins,25856,katniss|love|peeta|suzanne-collins|the-hunger-games
We read to know we're not alone.,William Nicholson,25699,misattributed-to-c-s-lewis|reading
"We don't see things as they are, we see them as we are.",Anaïs Nin,25617,
"You may not be her first, her last, or her only. She loved before she may love again. But if she loves you now, what else matters? She's not perfect—you aren't either, and the two of you may never be perfect together but if she can make you laugh, cause you to think twice, and admit to being human and making mistakes, hold onto her and give her the most you can. She may not be thinking about you every second of the day, but she will give you a part of her that she knows you can break—her heart. So don't hurt her, don't change her, don't analyze and don't expect more than she can give. Smile when she makes you happy, let her know when she makes you mad, and miss her when she's not there.",Bob Marley,25530,love
All you need is love. But a little chocolate now and then doesn't hurt.,Charles M. Schulz,25146,chocolate|food|humor
Beauty is in the eye of the beholder and it may be necessary from time to time to give a stupid or misinformed beholder a black eye.,Jim Henson,24886,humor
"Sometimes, you read a book and it fills you with this weird evangelical zeal, and you become convinced that the shattered world will never be put back together unless and until all living humans read the book.",John Green,24562,books|power-of-words|reading
Never trust anyone who has not brought a book with them.,Lemony Snicket,24427,books|reading
"Today you are You, that is truer than true. There is no one alive who is Youer than You.",Dr. Seuss,24316,comedy|life|yourself
You can never get a cup of tea large enough or a book long enough to suit me.,C.S. Lewis,23678,books|inspirational|reading|tea
"If you only read the books that everyone else is reading, you can only think what everyone else is thinking.",Haruki Murakami,23628,books|thought
I'm not afraid of death; I just don't want to be there when it happens.,Woody Allen,23516,death|fear|humor|life
"It is impossible to live without failing at something, unless you live so cautiously that you might as well not have lived at all - in which case, you fail by default.",J.K. Rowling,23504,
Have you fallen in love with the wrong person yet?',Cassandra Clare,23260,city-of-bones|jace
"Whenever I feel the need to exercise, I lie down until it goes away.",Paul   Terry,23253,exercise|humor|laziness|misattributed-to-hutchins
"If you want your children to be intelligent, read them fairy tales. If you want them to be more intelligent, read them more fairy tales.",Albert Einstein,23207,children|fairy-tales
"Of course it is happening inside your head, Harry, but why on earth should that mean that it is not real?",J.K. Rowling,23098,dumbledore
"To the well-organized mind, death is but the next great adventure.",J.K. Rowling,22958,death|inspirational
"I am nothing special, of this I am sure. I am a common man with common thoughts and I've led a common life. There are no monuments dedicated to me and my name will soon be forgotten, but I've loved another with all my heart and soul, and to me, this has always been enough..",Nicholas Sparks,22882,love
Logic will get you from A to Z; imagination will get you everywhere.,Albert Einstein,22831,imagination
"I'm in love with you,"" he said quietly.",John Green,22723,doomed|inevitable|love|oblivion|pleasure|simple
"If one cannot enjoy reading a book over and over again, there is no use in reading it at all.",Oscar Wilde,22552,books|reading
"The more that you read, the more things you will know. The more that you learn, the more places you'll go.",Dr. Seuss,22485,learning|reading|seuss
You don't get to choose if you get hurt in this world...but you do have some say in who hurts you. I like my choices.,John Green,22443,satisfaction|self-determination
"One good thing about music, when it hits you, you feel no pain.",Bob Marley,22427,music
Folks are usually about as happy as they make their minds up to be.,Abraham Lincoln,22372,happiness
"If you live to be a hundred, I want to live to be a hundred minus one day so I never have to live without you.",Joan Powers,22126,friendship|misattributed-a-a-milne
Sometimes people are beautiful.,Markus Zusak,22067,beauty|life
Life isn't about finding yourself. Life is about creating yourself.,George Bernard Shaw,22045,inspirational|life|yourself
"The truth is, everyone is going to hurt you. You just got to find the ones worth suffering for.",Bob Marley,22033,friendship
"Do what you can, with what you have, where you are.",Theodore Roosevelt,21877,inspirational
"Saying 'I notice you're a nerd' is like saying, 'Hey, I notice that you'd rather be intelligent than be stupid, that you'd rather be thoughtful than be vapid, that you believe that there are things that matter more than the arrest record of Lindsay Lohan. Why is that?' In fact, it seems to me that most contemporary insults are pretty lame. Even 'lame' is kind of lame. Saying 'You're lame' is like saying 'You walk with a limp.' Yeah, whatever, so does 50 Cent, and he's done all right for himself.",John Green,21801,humor|nerdfighters
Not all of us can do great things. But we can do small things with great love.,Mother Teresa,21777,misattributed-to-mother-teresa|paraphrased
"Love looks not with the eyes, but with the mind,",William Shakespeare,21660,love
"Listen to the mustn'ts, child. Listen to the don'ts. Listen to the shouldn'ts, the impossibles, the won'ts. Listen to the never haves, then listen close to me... Anything can happen, child. Anything can be.",Shel Silverstein,21312,anything-can-be|hope|impossible|inspirational|musn-t|possibilities|shouldn-t|won-t
"Love is like the wind, you can't see it but you can feel it.",Nicholas Sparks,21293,love|simile
You don’t,Walter M. Miller Jr.,21180,body-soul|misattributed-to-c-s-lewis
"When one door of happiness closes, another opens; but often we look so long at the closed door that we do not see the one which has been opened for us.",Helen Keller,20983,inspirational
The difference between genius and stupidity is: genius has its limits.,Alexandre Dumas fils,20964,misattributed-to-einstein
"I find television very educating. Every time somebody turns on the set, I go into the other room and read a book.",Groucho Marx,20786,books|humor|reading|television
"I would venture to guess that Anon, who wrote so many poems without signing them, was often a woman.",Virginia Woolf,20540,women
"If you can make a woman laugh, you can make her do anything.",Marilyn Monroe,20509,girls|love
"People think a soul mate is your perfect fit, and that's what everyone wants. But a true soul mate is a mirror, the person who shows you everything that is holding you back, the person who brings you to your own attention so you can change your life.",Elizabeth Gilbert,20463,love
There is no friend as loyal as a book.,Ernest Hemingway,20415,books|friends|novelist-quotes
"You don't love someone because they're perfect, you love them in spite of the fact that they're not.",Jodi Picoult,20306,imperfect|love
"We’re all a little weird. And life is a little weird. And when we find someone whose weirdness is compatible with ours, we join up with them and fall into mutually satisfying weirdness—and call it love—true love.",Robert Fulghum,20261,love|weirdness
Some infinities are bigger than other infinities.,John Green,19953,infinity|john-green|life|tfios|the-fault-in-our-stars
"Life is like riding a bicycle. To keep your balance, you must keep moving.",Albert Einstein,19883,life|simile
The story so far:,Douglas Adams,19823,humor|scifi
"It matters not what someone is born, but what they grow to be.",J.K. Rowling,19797,dumbledore
"Success is not final, failure is not fatal: it is the courage to continue that counts.",Winston S. Churchill,19752,bravery|courage|failure|inspirational|success
Do one thing every day that scares you.,Eleanor Roosevelt,19721,attributed|fear|inspiration
"So, this is my life. And I want you to know that I am both happy and sad and I'm still trying to figure out how that could be.",Stephen Chbosky,19673,charlie|favourite-books|inspirational|sad|soul-searching|wallflower
"Love never dies a natural death. It dies because we don't know how to replenish its source. It dies of blindness and errors and betrayals. It dies of illness and wounds; it dies of weariness, of witherings, of tarnishings.",Anaïs Nin,19571,death|love
"He's like a drug for you, Bella.",Stephenie Meyer,19506,drug|romance|simile
The real lover is the man who can thrill you by kissing your forehead or smiling into your eyes or just staring into space.,Marilyn Monroe,19459,love
"There is nothing I would not do for those who are really my friends. I have no notion of loving people by halves, it is not my nature.",Jane Austen,19313,friendship|love
"A wise girl kisses but doesn't love, listens but doesn't believe, and leaves before she is left.",Marilyn Monroe,19250,
Time you enjoy wasting is not wasted time.,Marthe Troly-Curtin,19248,happiness|misattributed-john-lennon|procrastination|time
