quote,author,likes,category
"The best moments in reading are when you come across something – a thought, a feeling, a way of looking at things – which you had thought special and particular to you. Now here it is, set down by someone else, a person you have never met, someone even who is long dead. And it is as if a hand has come out and taken yours.",Alan Bennett,3290,books|history|reading
Real loneliness is not necessarily limited to when you are alone.,Charles Bukowski,3287,
"That's why when major badasses greet each other in movies, they don't say anything, they just nod. The nod means, 'I' am a badass, and I recognize that you, too, are a badass,' but they don't say anything because they're Wolverine and Magneto and it would mess up their vibe to explain.",Cassandra Clare,3286,city-of-bones|simon-lewis
"Anyone who falls in love is searching for the missing pieces of themselves. So anyone who's in love gets sad when they think of their lover. It's like stepping back inside a room you have fond memories of, one you haven't seen in a long time.",Haruki Murakami,3286,love
"What makes the desert beautiful,' said the little prince, 'is that somewhere it hides a well...",Antoine de Saint-Exupéry,3286,inspirational
"Knowledge speaks, but wisdom listens",Jimi Hendrix,3285,wisdom
"- ""Why don't you like to be touched?""",E.L. James,3282,
"I nodded, looking at Rachel with respect. ""You hit the Lord of the Titans in the eye with a blue plastic hairbrush.",Rick Riordan,3281,percy-jackson|rachel-elizabeth-dare
There is greatness in doing something you hate for the sake of someone you love.,Shmuley Boteach,3280,relationships
أحسد الأطفال الرضّع، لأنهم يملكون وحدهم حق الصراخ والقدرة عليه، قبل أن تروض الحياة حبالهم الصوتية، وتعلِّمهم الصمت,أحلام مستغانمي,3278,
,Charlotte Brontë,3278,ataraxy|defiance|empowerment|independence|individuality|self-assurance|self-awareness|self-containment|self-determination|self-esteem|self-reliance|self-respect|self-sufficiency|self-trust|solitude
Happiness [is] only real when shared,Jon Krakauer,3278,family|happiness|inspirational|love|marriage
"What if it lines up like it did in the Trojan War ... Athena versus Poseidon?""",Rick Riordan,3277,annabeth-chase|athena|percy-jackson|poseidon
To say goodbye is to die a little.,Raymond Chandler,3276,change|life|parting|romantics
"I cannot remember the books I've read any more than the meals I have eaten; even so, they have made me.",Ralph Waldo Emerson,3275,books|reading|we-are-what-we-eat|we-are-what-we-read|you-are-what-you-eat|you-are-what-you-read
Art and love are the same thing: It’s the process of seeing yourself in things that are not you.,Chuck Klosterman,3274,art|love|profound
The measure of intelligence is the ability to change.,Albert Einstein,3272,adaptation|flexibility|intelligence|open-mindedness|wisdom
"Never forget what you are, for surely the world will not. Make it your strength. Then it can never be your weakness.",George R.R. Martin,3271,
"She read books as one would breathe air, to fill up and live.",Annie Dillard,3271,books|literature|reading|words
"Let's think the unthinkable, let's do the undoable. Let us prepare to grapple with the ineffable itself, and see if we may not eff it after all.",Douglas Adams,3271,philosophy
I'm sure the universe is full of intelligent life. It's just been too intelligent to come here.,Arthur C. Clarke,3270,extraterrestrials|humor|intelligent-life|life|science|universe
You know what charm is: a way of getting the answer yes without having asked any clear question.,Albert Camus,3268,romance
"The thing that is really hard, and really amazing, is giving up on being perfect and beginning the work of becoming yourself.",Anna Quindlen,3268,
"Every time you smile at someone, it is an action of love, a gift to that person, a beautiful thing.",Mother Teresa,3267,paraphrased
"For me, trees have always been the most penetrating preachers. I revere them when they live in tribes and families, in forests and groves. And even more I revere them when they stand alone. They are like lonely persons. Not like hermits who have stolen away out of some weakness, but like great, solitary men, like Beethoven and Nietzsche. In their highest boughs the world rustles, their roots rest in infinity; but they do not lose themselves there, they struggle with all the force of their lives for one thing only: to fulfil themselves according to their own laws, to build up their own form, to represent themselves. Nothing is holier, nothing is more exemplary than a beautiful, strong tree. When a tree is cut down and reveals its naked death-wound to the sun, one can read its whole history in the luminous, inscribed disk of its trunk: in the rings of its years, its scars, all the struggle, all the suffering, all the sickness, all the happiness and prosperity stand truly written, the narrow years and the luxurious years, the attacks withstood, the storms endured. And every young farmboy knows that the hardest and noblest wood has the narrowest rings, that high on the mountains and in continuing danger the most indestructible, the strongest, the ideal trees grow.",Hermann Hesse,3267,eternity|fear|forests|history|holiness|home|life|longing|poet|roots|self-discovery|spirituality|strength|trees|trust
Do not go gentle into that good night.,Dylan Thomas,3265,
"You will find that it is necessary to let things go; simply for the reason that they are heavy. So let them go, let go of them. I tie no weights to my ankles.",C. JoyBell C.,3265,forgetting|forgiving|inspirational-life|inspirational-quotes|letting-go|life|life-and-living|moving-on|people
"You have to know what you stand for, not just what you stand against.",Laurie Halse Anderson,3264,defend
Wherever you go becomes a part of you somehow.,Anita Desai,3261,travel
"Crying is all right in its way while it lasts. But you have to stop sooner or later, and then you still have to decide what to do.",C.S. Lewis,3260,books|cry|crying|decisions
A woman without a man is like a fish without a bicycle.,Irina Dunn,3260,feminism|humour|misattributed-gloria-steinem
"The beginning of love is the will to let those we love be perfectly themselves, the resolution not to twist them to fit our own image. If in loving them we do not love what they are, but only their potential likeness to ourselves, then we do not love them: we only love the reflection of ourselves we find in them",Thomas Merton,3254,friendship|love|self-discovery|trust|truth
"No one knows for certain how much impact they have on the lives of other people. Oftentimes, we have no clue. Yet we push it just the same.",Jay Asher,3254,care|impact|life|reach-out|think
Cowards die many times before their deaths;,William Shakespeare,3254,dramatist-quotes
I want to grow old without facelifts. I want to have the courage to be loyal to the face I have made.,Marilyn Monroe,3253,marilyn-monroe
Life isn't finding shelter in the storm. It's about learning to dance in the rain.,Sherrilyn Kenyon,3251,
"And he took her in his arms and kissed her under the sunlit sky, and he cared not that they stood high upon the walls in the sight of many.",J.R.R. Tolkien,3251,gondor|romance
My Best Friend is a person who will give me a book I have not read.,Abraham Lincoln,3251,books
"But it is the nature of stars to cross, and never was Shakespeare more wrong than when he has Cassius note, ‘The fault, dear Brutus, is not in our stars / But in ourselves.",John Green,3248,tfios|the-fault-in-our-stars
"I was wise enough never to grow up, while fooling people into believing I had.",Margaret Mead,3247,
"If you treat an individual as he is, he will remain how he is. But if you treat him as if he were what he ought to be and could be, he will become what he ought to be and could be.",Johann Wolfgang von Goethe,3247,inspiration
There are books of which the backs and covers are by far the best parts.,Charles Dickens,3244,books|writing
An expert is a person who has made all the mistakes that can be made in a very narrow field.,Niels Bohr,3241,science
"He smiled understandingly-much more than understandingly. It was one of those rare smiles with a quality of eternal reassurance in it, that you may come across four or five times in life. It faced--or seemed to face--the whole eternal world for an instant, and then concentrated on you with an irresistible prejudice in your favor. It understood you just as far as you wanted to be understood, believed in you as you would like to believe in yourself, and assured you that it had precisely the impression of you that, at your best, you hoped to convey.",F. Scott Fitzgerald,3240,smiling
I suppose a fire that burns that bright is not meant to last.,Veronica Roth,3239,four|heartbreaking|tobias
و كلما أمسكت بحالة من حالاتي و قلت هذا هو أنا .. ما تلبث هذه الحالة أن تفلت من أصابعي و تحل محلها حالة أخرى .. هي أنا .. أيضاً..,مصطفى محمود,3239,
Winter is coming.,George R.R. Martin,3236,forcasting|mottos|winter
!لك شيء في هذا العالم.. فقم,غسان كنفاني,3229,
If you do not tell the truth about yourself you cannot tell it about other people.,Virginia Woolf,3227,honesty|lies|stories|truth
Politeness is deception in pretty packaging.,Veronica Roth,3226,
A book must be the axe for the frozen sea within us.,Franz Kafka,3222,books
As if you were on fire from within.,Pablo Neruda,3221,beauty|inner-beauty|love|passion
She refused to be bored chiefly because she wasn't boring.,Zelda Fitzgerald,3219,boredom
I am constantly torn between killing myself and killing everyone around me.,David Levithan,3215,homicide|suicide
"I could not tell you if I loved you the first moment I saw you, or if it was the second or third or fourth. But I remember the first moment I looked at you walking toward me and realized that somehow the rest of the world seemed to vanish when I was with you.",Cassandra Clare,3214,devotion|love|love-at-first-sight|true-love
"Without suffering, there'd be no compassion.",Nicholas Sparks,3210,
"Beauty is only skin deep, but ugly goes clean to the bone.",Dorothy Parker,3210,beauty|classic-insult|humor|ugly
"I am different, not less.",Temple Grandin,3208,
"أتمنى أن أبكي و أرتجف , التصق بواحد من الكبار , لكن الحقيقة القاسية هي أنك الكبار! .. أنت من يجب أن يمنح القوة و الأمن للآخرين!",أحمد خالد توفيق,3208,
The creative adult is the child who has survived.,Ursula K. Le Guin,3207,
"I can listen no longer in silence. I must speak to you by such means as are within my reach. You pierce my soul. I am half agony, half hope. Tell me not that I am too late, that such precious feelings are gone for ever. I offer myself to you again with a heart even more your own than when you almost broke it, eight years and a half ago. Dare not say that man forgets sooner than woman, that his love has an earlier death. I have loved none but you. Unjust I may have been, weak and resentful I have been, but never inconstant. You alone have brought me to Bath. For you alone, I think and plan. Have you not seen this? Can you fail to have understood my wishes? I had not waited even these ten days, could I have read your feelings, as I think you must have penetrated mine. I can hardly write. I am every instant hearing something which overpowers me. You sink your voice, but I can distinguish the tones of that voice when they would be lost on others. Too good, too excellent creature! You do us justice, indeed. You do believe that there is true attachment and constancy among men. Believe it to be most fervent, most undeviating, in F. W.",Jane Austen,3203,romance
"I am a cage, in search of a bird.",Franz Kafka,3202,franz-kafka
"If you love what you do and are willing to do what it takes, it's within your reach. And it'll be worth every minute you spend alone at night, thinking and thinking about what it is you want to design or build. It'll be worth it, I promise.",Steve Wozniak,3200,
Science and religion are not at odds. Science is simply too young to understand.,Dan Brown,3199,books|dan-brown|religion|science
"For whatever we lose (like a you or a me),",E.E. Cummings,3196,water
Always do what is right. It will gratify half of mankind and astound the other.,Mark Twain,3194,morals
"One ought, every day at least, to hear a little song, read a good poem, see a fine picture, and, if it were possible, to speak a few reasonable words.",Johann Wolfgang von Goethe,3193,art|good-life|music|poetry|self-improvement
"Don't feel bad, I'm usually about to die.",Rick Riordan,3190,death|greek|humor|mythology|percy-jackson|sorry
So many things are possible just as long as you don't know they're impossible.,Norton Juster,3188,
"From there to here, from here to there, funny things are everywhere!",Dr. Seuss,3187,humor
"Where there is love, there is often also hate. They can exist side by side.",Cassandra Clare,3186,
"There is more to sex appeal than just measurements. I don't need a bedroom to prove my womanliness. I can convey just as much sex appeal, picking apples off a tree or standing in the rain.",Audrey Hepburn,3185,sex-appeal|women
You do not have to be good.,Mary Oliver,3185,beauty|birds|nature|poetry|shore|woods
"Beware; for I am fearless, and therefore powerful.",Mary Wollstonecraft Shelley,3180,
We can easily forgive a child who is afraid of the dark; the real tragedy of life is when men are afraid of the light.,Plato,3180,darkness|dishonesty|fear|light|willful-ignorance
A common mistake that people make when trying to design something completely foolproof is to underestimate the ingenuity of complete fools.,Douglas Adams,3180,design|foolproof|ingenuity
"The beauty of a woman is not in the clothes she wears, the figure that she carries, or the way she combs her hair. The beauty of a woman is seen in her eyes, because that is the doorway to her heart, the place where love resides. True beauty in a woman is reflected in her soul. It's the caring that she lovingly gives, the passion that she shows & the beauty of a woman only grows with passing years.",Audrey Hepburn,3178,
"Some lose all mind and become soul,insane.",Charles Bukowski,3178,
"I wasn't actually in love, but I felt a sort of tender curiosity.",F. Scott Fitzgerald,3177,affection|amity|love
"Trust is like a mirror, you can fix it if it's broken, but you can still see the crack in that mother fucker's reflection.",Lady Gaga,3175,beyonce|lady-gaga|mirror|trust
There ain't no sin and there ain't no virtue. There's just stuff people do.,John Steinbeck,3174,
"In a way, it's nice to know that there are Greek gods out there, because you have somebody to blame when things go wrong. For instance, when you're walking away from a bus that's just been attacked by monster hags and blown up by lightning, and it's raining on top of everything else, most people might think that's just really bad luck; when you're a half-blood, you understand that some devine force is really trying to mess up your day.",Rick Riordan,3172,books|humor|olympians
"All women become like their mothers. That is their tragedy. No man does, and that is his.",Oscar Wilde,3171,women-mothers
"She says nothing at all, but simply stares upward into the dark sky and watches, with sad eyes, the slow dance of the infinite stars.",Neil Gaiman,3169,
I think the reward for conformity is that everyone likes you except yourself.,Rita Mae Brown,3168,conformity|individuality|self-love|self-respect
"I've been homesick for countries I've never been, and longed to be where I couldn't be.",John Cheever,3165,
"We can never judge the lives of others, because each person knows only their own pain and renunciation. It's one thing to feel that you are on the right path, but it's another to think that yours is the only path.",Paulo Coelho,3165,life
Nitwit! Blubber! Oddment! Tweak!,J.K. Rowling,3164,dumbledore
There are years that ask questions and years that answer.,Zora Neale Hurston,3164,inspiration
"When I am with you, we stay up all night.",Jalaluddin Rumi,3163,love
Rivers know this: there is no hurry. We shall get there some day.,A.A. Milne,3162,patience|perseverance
May the forces of evil become confused on the way to your house.,George Carlin,3159,benediction|evil|goodwill|humor|inspirational|wishes
"Ah, my daughter,ʺ he said. ʺEighteen, and already youʹve been accused of murder, aided felons, and acquired a death count higher than most guardians will ever see.ʺ He paused. ʺI couldnʹt be prouder.",Richelle Mead,3157,abe-mazur|last-sacrifice|rosemarie-hathaway
Open your heart. Someone will come. Someone will come for you. But first you must open your heart.,Kate DiCamillo,3157,edward
One thing you can't hide - is when you're crippled inside.,John Lennon,3157,beatles|emotions|hypocrisy|pain|suffering
"Because you can't argue with all the fools in the world. It's easier to let them have their way, then trick them when they're not paying attention.",Christopher Paolini,3156,common-sense|humor|smart
"It's not gray,"" Clary felt compelled to point out. ""It's green.""",Cassandra Clare,3155,clary|gray-book|humor|jace
"Our mothers always remain the strangest, craziest people we've ever met.",Marguerite Duras,3154,mothers
What is that you express in your eyes? It seems to me more than all the print I have read in my life.,Walt Whitman,3154,poetry
"Is it so bad, then, to be misunderstood? Pythagoras was misunderstood, and Socrates, and Jesus, and Luther, and Copernicus, and Galileo, and Newton, and every pure and wise spirit that ever took flesh. To be great is to be misunderstood.",Ralph Waldo Emerson,3154,greatness
"And thus the heart will break, yet brokenly live on.",George Gordon Byron,3153,
A good book is an event in my life.,Stendhal,3152,books|literature|reading
"If you don't read the newspaper, you're uninformed. If you read the newspaper, you're mis-informed.",Mark Twain,3151,misattributed-mark-twain|newspapers
Love is the absence of judgment.,Dalai Lama XIV,3150,inspiration
"He was going to live forever, or die in the attempt.",Joseph Heller,3149,
"The important thing to you is not how many years in your life, but how much life in your years!",Edward J. Stieglitz,3149,inspirational
"When I had nothing to lose, I had everything. When I stopped being who I am, I found myself.",Paulo Coelho,3148,
"You yourself, as much as anybody in the entire universe, deserve your love and affection",Sharon Salzberg,3148,inspiration|life|love|self-acceptance|self-esteem|wisdom
"The function of prayer is not to influence God, but rather to change the nature of the one who prays.",Søren Kierkegaard,3147,faith|god|prayer
"We've got to live, no matter how many skies have fallen.",D.H. Lawrence,3146,
The worst part of success is trying to find someone who is happy for you.,Bette Midler,3144,friendship|happiness|humor|inspirational|jealousy|success
"You will lose someone you can’t live without,and your heart will be badly broken, and the bad news is that you never completely get over the loss of your beloved. But this is also the good news. They live forever in your broken heart that doesn’t seal back up. And you come through. It’s like having a broken leg that never heals perfectly—that still hurts when the weather gets cold, but you learn to dance with the limp.",Anne Lamott,3143,grief|loss|recovery
"The beginning of love is the will to let those we love be perfectly themselves, the resolution not to twist them to fit our own image.",Thomas Merton,3142,
"Stay gold, Ponyboy, stay gold.",S.E. Hinton,3142,benediction|johnny-cade|ponyboy-curtis|ralph-macchio
"Don’t try to make life a mathematics problem with yourself in the center and everything coming out equal. When you’re good, bad things can still happen. And if you’re bad, you can still be lucky.",Barbara Kingsolver,3138,life|unfairness
"Ah! There is nothing like staying at home, for real comfort.",Jane Austen,3138,relaxation
"The moment you doubt whether you can fly, you cease for ever to be able to do it.",J.M. Barrie,3137,barrie|belief|fantasy|flying|imagination|kensington-gardens|london|magic|neverland|park|peter-pan|scotland|self-confidence
You can't depend on your eyes when your imagination is out of focus.,Mark Twain,3137,imagination
"When I was a child, adults would tell me not to make things up, warning me of what would happen if I did. As far as I can tell so far, it seems to involve lots of foreign travel and not having to get up too early in the morning.",Neil Gaiman,3137,
Beautiful face. Beautiful body. Horrible attitude. It was the holy trinity of hot boys.,Jennifer L. Armentrout,3135,boys|hot|humor
The past has no power over the present moment.,Eckhart Tolle,3130,education|inspirational|life|philosophy|truth|wisdom
"Fools talk, cowards are silent, wise men listen.",Carlos Ruiz Zafón,3127,
"You're just worried they'll hire a male instructor and he'll be hotter than you.""",Cassandra Clare,3125,city-of-fallen-angels|clary-fray|jace-lightwood
"Did you ever think that in a past life Alec was an old woman with ninety cats who was always yelling at the neighborhood kids to get off her lawn? Because I do,",Cassandra Clare,3125,jace
Creativity is intelligence having fun.,Albert Einstein,3124,
Try a little harder to be a little better.,Gordon B. Hinckley,3124,inspirational
We must be willing to let go of the life we planned so as to have the life that is waiting for us.,Joseph Campbell,3122,wisdom
Would it save you a lot of time if I just gave up and went mad now?,Douglas Adams,3120,british|humor|science-fiction|social-commentary|thumb|towel
"I am trying here to prevent anyone saying the really foolish thing that people often say about Him: I’m ready to accept Jesus as a great moral teacher, but I don’t accept his claim to be God. That is the one thing we must not say. A man who was merely a man and said the sort of things Jesus said would not be a great moral teacher. He would either be a lunatic — on the level with the man who says he is a poached egg — or else he would be the Devil of Hell. You must make your choice. Either this man was, and is, the Son of God, or else a madman or something worse. You can shut him up for a fool, you can spit at him and kill him as a demon or you can fall at his feet and call him Lord and God, but let us not come with any patronizing nonsense about his being a great human teacher. He has not left that open to us. He did not intend to.",C.S. Lewis,3119,faith|god|jesus
What's the good of living if you don't try a few things?,Charles M. Schulz,3117,cartoonist|humor|inspirational
It is forbidden to kill; therefore all murderers are punished unless they kill in large numbers and to the sound of trumpets.,Voltaire,3117,double-standards|ethics|governments|humor|irony|killing|law|mankind|morality|murder|nationalism|nations|war
"I loved you like a man loves a woman he never touches, only writes to, keeps little photographs of.",Charles Bukowski,3117,love
"The saddest people I've ever met in life are the ones who don't care deeply about anything at all. Passion and satisfaction go hand in hand, and without them, any happiness is only temporary, because there's nothing to make it last.",Nicholas Sparks,3114,life|love|passion
"When did we see each other face-to-face? Not until you saw into my cracks and I saw into yours. Before that, we were just looking at ideas of each other, like looking at your window shade but never seeing inside. But once the vessel cracks, the light can get in. The light can get out.",John Green,3112,cracks
"If conversation was the lyrics, laughter was the music, making time spent together a melody that could be replayed over and over without getting stale.",Nicholas Sparks,3110,love|nicholas-sparks|relationships|the-choice
"What she was finding also was how one book led to another, doors kept opening wherever she turned and the days weren't long enough for the reading she wanted to do.",Alan Bennett,3110,books
"If I had a world of my own, everything would be nonsense. Nothing would be what it is, because everything would be what it isn't. And contrary wise, what is, it wouldn't be. And what it wouldn't be, it would. You see?",Lewis Carroll,3110,alice-in-wonderland|mad-hatter|nonsense
Time is an illusion. Lunchtime doubly so.,Douglas Adams,3110,humor|philosophy|science-fiction
"Suffering has been stronger than all other teaching, and has taught me to understand what your heart used to be. I have been bent and broken, but - I hope - into a better shape.",Charles Dickens,3109,growth|heart|life|suffering
"My tongue will tell the anger of my heart, or else my heart concealing it will break.",William Shakespeare,3102,
"Really, the combination of the scabs and the ointment looks hideous. I can't help enjoying his distress.",Suzanne Collins,3100,catching-fire|finnick|hunger-games|katniss|mirror|pretty
So many things become beautiful when you really look.,Lauren Oliver,3099,
"You could have fooled me. Everytime I called you, Luke said you were sick. I figured you were avoiding me. Again.""",Cassandra Clare,3092,die|love|romance
The pleasure of all reading is doubled when one lives with another who shares the same books.,Katherine Mansfield,3091,
Reputation is what other people know about you. Honor is what you know about yourself.,Lois McMaster Bujold,3089,inspirational|sci-fi|vorkosigan
Illegal aliens have always been a problem in the United States. Ask any Indian.,Robert Orben,3087,humour|politics|truth
Tears shed for another person are not a sign of weakness. They are a sign of a pure heart.,José N. Harris,3085,grief|grieving|hope|loss|love|pain|sadness|strength|tears
