quote,author,likes,category
I spent my life folded between the pages of books.,Tahereh Mafi,5556,books|power-of-words|reading
"I am not sure exactly what heaven will be like, but I know that when we die and it comes time for God to judge us, he will not ask, 'How many good things have you done in your life?' rather he will ask, 'How much love did you put into what you did?",Mother Teresa,5548,inspirational|love
"Love is a fire. But whether it is going to warm your hearth or burn down your house, you can never tell.",Joan Crawford,5538,love
"Everybody has a secret world inside of them. I mean everybody. All of the people in the whole world, I mean everybody — no matter how dull and boring they are on the outside. Inside them they've all got unimaginable, magnificent, wonderful, stupid, amazing worlds... Not just one world. Hundreds of them. Thousands, maybe.",Neil Gaiman,5537,
"Love does not consist of gazing at each other, but in looking outward together in the same direction.",Antoine de Saint-Exupéry,5527,love
"Don't order any of the faerie food,"" said Jace, looking at her over the top of his menu. ""It tends to make humans a little crazy. One minute you're munching a faerie plum, the next minute you're running naked down Madison Avenue with antlers on your head. Not,"" he added hastily, ""that this has ever happened to me.",Cassandra Clare,5526,cassandra-clare|city-of-bones|jace|mortal-instruments
"Live, travel, adventure, bless, and don't be sorry.",Jack Kerouac,5523,
Maybe 'okay' will be our 'always,John Green,5517,augustus-waters|hazel-grace
"If he’s not calling you, it’s because you are not on his mind. If he creates expectations for you, and then doesn’t follow through on little things, he will do same for big things. Be aware of this and realize that he’s okay with disappointing you. Don’t be with someone who doesn’t do what they say they’re going to do. If he’s choosing not to make a simple effort that would put you at ease and bring harmony to a recurring fight, then he doesn’t respect your feelings and needs. Busy is another word for asshole. Asshole is another word for the guy you’re dating. You deserve a fcking phone call.",Greg Behrendt,5514,busy|call|dating|dating-advice|faith|greg-behrendt|guys|he-s-not-just-into-you|love|marriage|romance|true
"When a man gives his opinion, he's a man. When a woman gives her opinion, she's a bitch.",Bette Davis,5513,clichés|double-standards|empowerment|feminism|gender|hypocrisy|misogyny|opinions|speaking-out|stereotypes|women
"I think God, in creating man, somewhat overestimated his ability.",Oscar Wilde,5512,creation|god|humor|man
My ambition is handicapped by laziness,Charles Bukowski,5510,
"You haven't got a letter on yours,"" George observed. ""I suppose she thinks you don't forget your name. But we're not stupid-we know we're called Gred and Forge.",J.K. Rowling,5509,humor
My tastes are simple: I am easily satisfied with the best.,Winston S. Churchill,5508,humor|taste
It's not denial. I'm just selective about the reality I accept.,Bill Watterson,5505,calvin-and-hobbes-reality
"Loyalty to country ALWAYS. Loyalty to government, when it deserves it.",Mark Twain,5493,patriotism|politics
"Never be afraid to raise your voice for honesty and truth and compassion against injustice and lying and greed. If people all over the world...would do this, it would change the earth.",William Faulkner,5488,advocacy|dissent|protest|truth|truth-telling
"Whoever fights monsters should see to it that in the process he does not become a monster. And if you gaze long enough into an abyss, the abyss will gaze back into you.",Friedrich Nietzsche,5488,corruption|dark-side|fighting|monsters|soul
It isn't what you have or who you are or where you are or what you are doing that makes you happy or unhappy. It is what you think about it.,Dale Carnegie,5479,attitude|contentment|happiness|inspirational|life
"But I don’t want to go among mad people,"" Alice remarked.",Lewis Carroll,5466,alice-s-adventures-in-wonderland
The future belongs to those who believe in the beauty of their dreams.,Eleanor Roosevelt,5458,dreams|future|inspirational|misattributed-eleanor-roosevelt
Education is the most powerful weapon which you can use to change the world.,Nelson Mandela,5448,change|education
"Sometimes crying or laughing are the only options left, and laughing feels better right now.",Veronica Roth,5441,crying|laughter|options
"Books are like mirrors: if a fool looks in, you cannot expect a genius to look out.",J.K. Rowling,5435,books
"I like living. I have sometimes been wildly, despairingly, acutely miserable, racked with sorrow; but through it all I still know quite certainly that just to be alive is a grand thing.",Agatha Christie,5409,inspirational
"I have something I need to tell you,"" he says. I run my fingers along the tendons in his hands and look back at him. ""I might be in love with you."" He smiles a little. ""I'm waiting until I'm sure to tell you, though.""",Veronica Roth,5397,beatrice|divergent|humor|love|tobias
None of us really changes over time. We only become more fully what we are.,Anne Rice,5397,
"Painting is poetry that is seen rather than felt, and poetry is painting that is felt rather than seen.",Leonardo da Vinci,5395,art|poetry
You have to die a few times before you can really,Charles Bukowski,5387,
"If music be the food of love, play on,",William Shakespeare,5385,music|romance|unrequited-love
You wouldn't worry so much about what others think of you if you realized how seldom they do.,Eleanor Roosevelt,5368,confidence
"Will looked horrified. ""What kind of monster could possibly hate chocolate?",Cassandra Clare,5362,chocolate|monsters
"You have your way. I have my way. As for the right way, the correct way, and the only way, it does not exist.",Friedrich Nietzsche,5351,amorality|correct-way|individuality|my-way|only-way|right-way|the-way|your-way
"You are the answer to every prayer I've offered. You are a song, a dream, a whisper, and I don't know how I could have lived without you for as long as I have.",Nicholas Sparks,5345,love
"You think your pain and your heartbreak are unprecedented in the history of the world, but then you read. It was books that taught me that the things that tormented me most were the very things that connected me with all the people who were alive, who had ever been alive.",James     Baldwin,5341,books|empathy|pain|reading
"Truth is stranger than fiction, but it is because Fiction is obliged to stick to possibilities; Truth isn't.",Mark Twain,5340,books|truth
"Show me a hero, and I'll write you a tragedy.",F. Scott Fitzgerald,5339,f-scott-fitzgerald
Sometimes you make choices in life and sometimes choices make you.,Gayle Forman,5331,
"It's just that I don't want to be somebody's crush. If somebody likes me, I want them to like the real me, not what they think I am. And I don't want them to carry it around inside. I want them to show me, so I can feel it too.",Stephen Chbosky,5326,
Wise men speak because they have something to say; fools because they have to say something.,Plato,5326,intellect|philosophy
Freedom is not worth having if it does not include the freedom to make mistakes.,Mahatma Gandhi,5322,freedom|humanity|mistakes
"She is too fond of books, and it has turned her brain.",Louisa May Alcott,5319,books
I don't want to die without any scars.,Chuck Palahniuk,5308,death|scars|tyler-durden
"The simple things are also the most extraordinary things, and only the wise can see them.",Paulo Coelho,5305,wisdom
Who said nights were for sleep?,Marilyn Monroe,5305,
To be nobody but,E.E. Cummings,5296,poetry
Reader's Bill of Rights,Daniel Pennac,5293,books|reading|rights
"I can feel Peeta press his forehead into my temple and he asks, 'So now that you've got me, what are you going to do with me?' I turn into him. 'Put you somewhere you can't get hurt.",Suzanne Collins,5283,love|romance
I never travel without my diary. One should always have something sensational to read in the train.,Oscar Wilde,5283,drama|humor|plays
"That is part of the beauty of all literature. You discover that your longings are universal longings, that you're not lonely and isolated from anyone. You belong.",F. Scott Fitzgerald,5281,belonging|company|desires|literature|longings
"One day, in retrospect, the years of struggle will strike you as the most beautiful.",Sigmund Freud,5266,inspirational-quotes
"She generally gave herself very good advice, (though she very seldom followed it).",Lewis Carroll,5265,
People haven't always been there for me but music always has.,Taylor Swift,5264,music
Woke up this morning with a terrific urge to lie in bed all day and read.,Raymond Carver,5263,
"In the case of good books, the point is not to see how many of them you can get through, but rather how many can get through to you.",Mortimer J. Adler,5257,books|reading
Fear doesn't shut you down; it wakes you up,Veronica Roth,5256,divergent|fear
"One of the Silent Brothers is here to see you. Hodge sent me to wake you up. Actually he offered to wake you himself, but since it's 5 a.m., I figured you'd be less cranky if you had something nice to look at.""",Cassandra Clare,5250,clary-fray|ego|jace-wayland
Wrinkles should merely indicate where the smiles have been.,Mark Twain,5246,age
"We’re all seeking that special person who is right for us. But if you’ve been through enough relationships, you begin to suspect there’s no right person, just different flavors of wrong. Why is this? Because you yourself are wrong in some way, and you seek out partners who are wrong in some complementary way. But it takes a lot of living to grow fully into your own wrongness. And it isn’t until you finally run up against your deepest demons, your unsolvable problems—the ones that make you truly who you are—that we’re ready to find a lifelong mate. Only then do you finally know what you’re looking for. You’re looking for the wrong person. But not just any wrong person: it's got to be the right wrong person—someone you lovingly gaze upon and think, This is the problem I want to have.",Andrew  Boyd,5240,being-loved|completion|inspirational|love|relationships
"Happiness is having a large, loving, caring, close-knit family in another city.",George Burns,5240,family|happiness|humor
"Finnick?"" I say, ""Maybe some pants?""",Suzanne Collins,5229,finnick|humour|hunger-games
"I don't trust people who don't love themselves and tell me, 'I love you.' ... There is an African saying which is: Be careful when a naked person offers you a shirt.",Maya Angelou,5229,1997|annie-clark-tanner-lecture|inspirational|love|trust
"I may die young, but at least I'll die smart.",John Green,5229,
War is peace.,George Orwell,5225,freedom|ignorance|inspirational|war
Nobody can hurt me without my permission.,Mahatma Gandhi,5222,fighting|hurt|inner-peace|peace|permission|strength|trial
"I've got a stele we can use. Who wants to do me?""",Cassandra Clare,5201,jace-wayland|magnus-bane|regret|stele
None but ourselves can free our minds.,Bob Marley,5200,bob-marley|inspirational|music|reggae
"Fire is catching! And if we burn, you burn with us!",Suzanne Collins,5194,mockingjay
The road to hell is paved with adverbs.,Stephen King,5192,writing
"It is not the critic who counts; not the man who points out how the strong man stumbles, or where the doer of deeds could have done them better. The credit belongs to the man who is actually in the arena, whose face is marred by dust and sweat and blood; who strives valiantly; who errs, who comes short again and again, because there is no effort without error and shortcoming; but who does actually strive to do the deeds; who knows great enthusiasms, the great devotions; who spends himself in a worthy cause; who at the best knows in the end the triumph of high achievement, and who at the worst, if he fails, at least fails while daring greatly, so that his place shall never be with those cold and timid souls who neither know victory nor defeat.",Theodore Roosevelt,5190,inspirational|politics|presidential
"Resist much, obey little.",Walt Whitman,5186,poetry
"Love doesn't just sit there, like a stone, it has to be made, like bread; remade all the time, made new.",Ursula K. Le Guin,5185,love
Books are mirrors: you only see in them what you already have inside you.,Carlos Ruiz Zafón,5182,books|reading|truth
"And now these three remain: faith, hope and love. But the greatest of these is love.",Anonymous,5174,faith|god|hope|love
"Should I kill myself, or have a cup of coffee?",Albert Camus,5170,
"Friendship is the hardest thing in the world to explain. It's not something you learn in school. But if you haven't learned the meaning of friendship, you really haven't learned anything.",Muhammad Ali,5166,friendship
No book is really worth reading at the age of ten which is not equally – and often far more – worth reading at the age of fifty and beyond.,C.S. Lewis,5146,age|books|re-reading|reading
Life's under no obligation to give us what we expect.,Margaret Mitchell,5139,expectation|hope|life
"It was love at first sight, at last sight, at ever and ever sight.",Vladimir Nabokov,5135,humbert-humbert|love
The best and most beautiful things in the world cannot be seen or even touched. They must be felt with the heart,Helen Keller,5135,by-anne-sullivan|emotions|feelings
"If you have a garden and a library, you have everything you need.",Marcus Tullius Cicero,5132,books
Fiction is the truth inside the lie.,Stephen King,5130,writing
"Pain and suffering are always inevitable for a large intelligence and a deep heart. The really great men must, I think, have great sadness on earth.",Fyodor Dostoyevsky,5123,
"Don't talk to me.""",J.K. Rowling,5121,ferret-malfoy|harry-potter|humor|ron-weasley
"The fact that we live at the bottom of a deep gravity well, on the surface of a gas covered planet going around a nuclear fireball 90 million miles away and think this to be normal is obviously some indication of how skewed our perspective tends to be.",Douglas Adams,5121,humor|perspective|science
"Can I help you with something?""",Cassandra Clare,5108,city-of-bones|clary|jace
"If you remember me, then I don't care if everyone else forgets.",Haruki Murakami,5106,inspirational|love
"I am coming to terms with the fact that loving someone requires a leap of faith, and that a soft landing is never guaranteed.",Sarah Dessen,5088,
Women who seek to be equal with men lack ambition.,Timothy Leary,5085,ambition|equality
"You know, Minister, I disagree with Dumbledore on many counts...but you cannot deny he's got style...",J.K. Rowling,5083,dumbledore|fudge|minister|style
Deadlines just aren't real to me until I'm staring one in the face.,Rick Riordan,5078,deadlines|humor|procrastinate
Stories of imagination tend to upset those without one.,Terry Pratchett,5078,fantasy|humor|imagination|literature|stories
"What happens when people open their hearts?""",Haruki Murakami,5071,healing|vulnerability
Everything is possible. The impossible just takes longer.,Dan Brown,5068,
I read so I can live more than one life in more than one place.,Anne Tyler,5061,
To be a Christian means to forgive the inexcusable because God has forgiven the inexcusable in you.,C.S. Lewis,5060,christianity|forgiveness|god
"Ever had a flying burrito hit you? Well, it's a deadly projectile, right up there with cannonballs and grenades.",Rick Riordan,5047,
Don't judge each day by the harvest you reap but by the seeds that you plant.,Robert Louis Stevenson,5045,day|inspirational|judge|plant|reap|seed|seeds|sow
"You can spend minutes, hours, days, weeks, or even months over-analyzing a situation; trying to put the pieces together, justifying what could've, would've happened... or you can just leave the pieces on the floor and move the fuck on.",Tupac Shakur,5044,moving-on
"I’d said it before and meant it: Alive or undead, the love of my life was a badass.",Richelle Mead,5043,dimitri|humor|paranormal-romance|rose|urban-fantasy|vampire|young-adult-novels
You cannot swim for new horizons until you have courage to lose sight of the shore.,William Faulkner,5036,courage|determination|hope|risk
You must have chaos within you to give birth to a dancing star.,Friedrich Nietzsche,5034,art|chaos
"Some things don't last forever, but some things do. Like a good song, or a good book, or a good memory you can take out and unfold in your darkest times, pressing down on the corners and peering in close, hoping you still recognize the person you see there.",Sarah Dessen,5031,forever
"It's strange because sometimes, I read a book, and I think I am the people in the book.",Stephen Chbosky,5027,books-reading
We do not need magic to transform our world. We carry all the power we need inside ourselves already.,J.K. Rowling,5006,
"If you like her, if she makes you happy, and if you feel like you know her---then don't let her go.",Nicholas Sparks,5002,love
"Why are they all staring?"" demanded Albus as he and Rose craned around to look at the other students.",J.K. Rowling,4992,albus-potter|fame|harry-potter|humor|ron-weasley
Mom says it's because she has PMS.,Nicholas Sparks,4990,humor
"Blessed is he who expects nothing, for he shall never be disappointed.",Alexander Pope,4988,beatitudes|disappointment|expectations|hope
"You guessed? You must have been pretty sure, considering you could have killed me.""",Cassandra Clare,4983,humor|paranormal-romance
A brave man acknowledges the strength of others.,Veronica Roth,4976,bravery|recognition|strength
Never say goodbye because goodbye means going away and going away means forgetting.,J.M. Barrie,4975,goodbye
It always shocked me when I realized that I wasn’t the only person in the world who thought and felt such strange and awful things.,John Green,4972,john-green|looking-for-alaska
"When life gives you lemons, squirt someone in the eye.",Cathy Guisewite,4968,eyes|funny|lemons
"Music is a total constant. That's why we have such a strong visceral connection to it, you know? Because a song can take you back instantly to a moment, or a place, or even a person. No matter what else has changed in your or the world, that one song says the same, just like that moment.",Sarah Dessen,4963,owen-armstrong
"The most important things are the hardest to say. They are the things you get ashamed of, because words diminish them -- words shrink things that seemed limitless when they were in your head to no more than living size when they're brought out. But it's more than that, isn't it? The most important things lie too close to wherever your secret heart is buried, like landmarks to a treasure your enemies would love to steal away. And you may make revelations that cost you dearly only to have people look at you in a funny way, not understanding what you've said at all, or why you thought it was so important that you almost cried while you were saying it. That's the worst, I think. When the secret stays locked within not for want of a teller but for want of an understanding ear.",Stephen King,4962,writing
"Love conquers all,"" Aphrodite promised. ""Look at Helen and Paris. Did they let anything come between them?""",Rick Riordan,4957,humor|true-love
"Sometimes our light goes out, but is blown again into instant flame by an encounter with another human being.",Albert Schweitzer,4957,inspirational|life|spiritual|uplifting
How many slams in an old screen door? Depends how loud you shut it. How many slices in a bread? Depends how thin you cut it. How much good inside a day? Depends how good you live 'em. How much love inside a friend? Depends how much you give 'em.,Shel Silverstein,4953,friend|friendship|good-day|how-many|how-much|life|live-well|love
"You smell good, too, said Patch",Becca Fitzpatrick,4951,hush
"Once you can accept the universe as matter expanding into nothing that is something, wearing stripes with plaid comes easy.",Albert Einstein,4946,funny
"I don’t know if you’ve ever felt like that. That you wanted to sleep for a thousand years. Or just not exist. Or just not be aware that you do exist. Or something like that. I think wanting that is very morbid, but I want it when I get like this. That’s why I’m trying not to think. I just want it all to stop spinning.",Stephen Chbosky,4939,esist|sleep|spinning
"By three methods we may learn wisdom: First, by reflection, which is noblest; Second, by imitation, which is easiest; and third by experience, which is the bitterest.",Confucius,4936,wisdom
"Investigation?"" Isabelle laughed. ""Now we're detectives? Maybe we should all have code names.""",Cassandra Clare,4923,humor|investigation|isabelle-lightwood|jace-wayland|joke
"Like most misery, it started with apparent happiness.",Markus Zusak,4919,
"If pain must come, may it come quickly. Because I have a life to live, and I need to live it in the best way possible. If he has to make a choice, may he make it now. Then I will either wait for him or forget him.",Paulo Coelho,4916,forgetting|hope|love|pain|suffering|waiting
We live for books.,Umberto Eco,4910,bibliophiles|book-lovers|books|reading
"My dear,",Charles Bukowski,4903,death|love
"Wow,"" Thalia muttered. ""Apollo is hot.""",Rick Riordan,4901,apollo|gods|hot|olympians|percy-jackson|sun|thalia
God has no religion.,Mahatma Gandhi,4901,god|religion
"If you don't imagine, nothing ever happens at all.",John Green,4900,
Music was my refuge. I could crawl into the space between the notes and curl my back to loneliness.,Maya Angelou,4894,loneliness|music|refuge
Only in the darkness can you see the stars.,Martin Luther King Jr.,4888,hope|inspirational
"Why, sometimes I've believed as many as six impossible things before breakfast.",Lewis Carroll,4887,alice-in-wonderland|breakfast|carroll
"I saw my life branching out before me like the green fig tree in the story. From the tip of every branch, like a fat purple fig, a wonderful future beckoned and winked. One fig was a husband and a happy home and children, and another fig was a famous poet and another fig was a brilliant professor, and another fig was Ee Gee, the amazing editor, and another fig was Europe and Africa and South America, and another fig was Constantin and Socrates and Attila and a pack of other lovers with queer names and offbeat professions, and another fig was an Olympic lady crew champion, and beyond and above these figs were many more figs I couldn't quite make out. I saw myself sitting in the crotch of this fig tree, starving to death, just because I couldn't make up my mind which of the figs I would choose. I wanted each and every one of them, but choosing one meant losing all the rest, and, as I sat there, unable to decide, the figs began to wrinkle and go black, and, one by one, they plopped to the ground at my feet.",Sylvia Plath,4887,life-choices-fig-trees
"Words are, of course, the most powerful drug used by mankind.",Rudyard Kipling,4887,words
I don't want to repeat my innocence. I want the pleasure of losing it again.,F. Scott Fitzgerald,4882,lost-innocence|memories
The truth does not change according to our ability to stomach it.,Flannery O'Connor,4877,truth
I was never really insane except upon occasions when my heart was touched.,Edgar Allan Poe,4874,inspiration
Be careful of love. It'll twist your brain around and leave you thinking up is down and right is wrong.,Rick Riordan,4873,love
"He must have known I'd want to leave you.""",J.K. Rowling,4864,dumbledore|friendship|harry-potter|ron-weasley
Some people have lives; some people have music.,John Green,4851,humor|life|music
Angry people are not always wise.,Jane Austen,4845,anger|jane-austen|wisdom
I love you. Remember. They cannot take it,Lauren Oliver,4836,amor-deliria-nervosa|love
"Begin at the beginning,"" the King said, very gravely, ""and go on till you come to the end: then stop.",Lewis Carroll,4835,humor
Do you think I'm pretty?,Richelle Mead,4829,beauty|love
I love you more than there are stars in the sky and fish in the sea.,Nicholas Sparks,4827,love
Stop acting so small. You are the universe in ecstatic motion.,Jalaluddin Rumi,4826,
Life has no meaning. Each of us has meaning and we bring it to life. It is a waste to be asking the question when you are the answer.,Joseph Campbell,4826,meaning-of-life
"Let us step into the night and pursue that flighty temptress, adventure.",J.K. Rowling,4815,adventure
Only a true best friend can protect you from your immortal enemies.,Richelle Mead,4811,friendship|humor|romance
"If you love somebody, let them go, for if they return, they were always yours. If they don't, they never were.",Kahlil Gibran,4805,life|love|romance
War is what happens when language fails.,Margaret Atwood,4805,war
It is better to fail in originality than to succeed in imitation.,Herman Melville,4794,success
"I’m here. I love you. I don’t care if you need to stay up crying all night long, I will stay with you. If you need the medication again, go ahead and take it—I will love you through that, as well. If you don’t need the medication, I will love you, too. There’s nothing you can ever do to lose my love. I will protect you until you die, and after your death I will still protect you. I am stronger than Depression and I am braver than Loneliness and nothing will ever exhaust me.",Elizabeth Gilbert,4783,comfort|healing|loneliness
"Tell the truth, or someone will tell it for you.",Stephanie Klein,4780,humor|life|memoir|truth
Don't tell me the moon is shining; show me the glint of light on broken glass.,Anton Chekhov,4771,broken-glass|glass|moon|moonshine|show-don-t-tell|writing
"All animals are equal, but some animals are more equal than others.",George Orwell,4767,animal-farm
A woman's heart should be so hidden in God that a man has to seek Him just to find her.,Max Lucado,4763,inspirational|love
