Company	Valuation ($B)	Country	Category	Select Investors
Bytedance (Toutiao)	$75	China	Digital Media/ AI	Sequoia Capital China, SIG Asia Investments, Sina Weibo, Softbank Group
Didi Chuxing	$56	China	On-Demand	Matrix Partners, Tiger Global Management, Softbank Corp.,
JUUL Labs	$50	United States	Consumer Electronics	Tiger Global Management
WeWork	$47	United States	Facilities	T. Rowe Price, Benchmark Capital, SoftBank Group
Airbnb	$29	United States	eCommerce/Marketplace	General Catalyst Partners, Andreessen Horowitz, ENIAC Ventures
Stripe	$23	United States	Fintech	Khosla Ventures, Lowercase Capital, capitalG
SpaceX	$19	United States	Other Transportation	Founders Fund, Draper Fisher Jurvetson, Rothenberg Ventures
Epic Games	$15	United States	Gaming	Tencent Holdings, KKR, Smash Ventures
GrabTaxi	$14	Singapore	On-Demand	GGV Capital, Vertex Venture Holdings, Softbank Group
Bitmain Technologies	$12	China	Blockchain	Coatue Management, Sequoia Capital China, IDG Capital
Samumed	$12	United States	Biotechnology	Vickers Venture Partners, IKEA GreenTech
Global Switch	$11	United Kingdom	Computer Hardware & Services	Aviation Industry Corporation of China, Essence Financial, Jiangsu Sha Steel Group
Palantir Technologies	$11	United States	Big Data	RRE Ventures, Founders Fund, In-Q-Tel
DJI Innovations	$10	China	Hardware	Accel Partners, Sequoia Capital
Go-Jek	$10	Indonesia	On-Demand	Formation Group, Sequoia Capital India, Warburg Pincus
Infor	$10	United States	Internet Software & Services	Blackstone Group, Koch Industries
One97 Communications (operates Paytm)	$10	India	Fintech	Intel Capital, Sapphire Ventures, Alibaba Group
Coupang	$9	South Korea	eCommerce/Marketplace	Sequoia Capital, Founder Collective, Wellington Management
Guazi (Chehaoduo)	$9	China	eCommerce/Marketplace	Sequoia Capital China, GX Capital
Coinbase	$8	United States	Fintech	Y Combinator, Union Square Ventures, DFJ Growth
Instacart	$8	United States	On-Demand	Khosla Ventures, Kleiner Perkins Caufield & Byers, Collaborative Fund
DoorDash	$7	United States	Food Delivery	Softbank Group, Sequoia Capital, Khosla Ventures
Slack Technologies	$7	United States	Internet Software & Services	Google Ventures, Institutional Venture Partners, Index Ventures
Roivant Sciences	$7	Switzerland	Biotechnology	SoftBankGroup, Founders Fund
Snapdeal	$7	India	e-commerce	SoftBankGroup, Blackrock, Alibaba Group
Tokopedia	$7	Indonesia	Marketplace	SoftBankGroup, Alibaba Group, Sequoia Capital India
UiPath	$7	United States	Robotic Process Automation	Accel, capitalG, Earlybrid Venture Capital, Seedcamp
Tanium	$7	United States	Cybersecurity	Andreessen Horowitz, Nor-Cal Invest, TPG Growth
Magic Leap	$6	United States	VR/AR	Obvious Ventures, Qualcomm Ventures, Andreessen Horowitz
Manbang Group	$6	China	Supply chain & Logistics	Softbank Group, CapitalG
Lianjia (Homelink)	$6	China	eCommerce/Marketplace	Tencent, Baidu, Huasheng Capital
EasyHome	$6	China	Retail	Alibaba Group, Boyu Capital, Borui Capital
Vice Media	$6	United States	Media	Technology Crossover Ventures, A&E Television Networks
Robinhood	$6	United States	Fintech	Google Ventures, Andreessen Horowitz, DST Global
Intarcia Therapeutics	$6	United States	Healthcare	New Enterprise Associates, New Leaf Venture Partners, Charter Venture Capital
Bluehole	$5	South Korea	Travel Tech	Tencent Holdings, Stonebridge Capital, IMM Investment
BYJU’S	$5	India	Ed Tech	Tencent Holdings, Lightspeed India Partners, Sequoia Capital India
Hellobike	$5	China	Travel	Ant Financial Services Group, GGV Capital
Machine Zone	$5	United States	Gaming	J.P. Morgan Chase & Co., Menlo Ventures
Outcome Health	$5	United States	Healthcare	Goldman Sachs, capitalG, Pritzker Group Venture Capital
UBTECH Robotics	$5	China	Robotics	CDH Investments, Goldstone Investments, Qiming Venture Partners
United Imaging Healthcare	$5	China	Healthcare	China Life Insurance, China Development Bank Capital, CITIC Securities International
Meizu Technology	$5	China	Hardware	Telling Telecommunication Holding Co., Alibaba Group
Fanatics	$5	United States	eCommerce/Marketplace	SoftBank Group, Andreessen Horowitz, Temasek Holdings
SenseTime	$5	China	Computer Vision/ AI	Star VC, IDG Capital, Infore Capital, Alibaba Group
Social Finance (SoFi)	$5	United States	Fintech	Baseline Ventures, DCM Ventures, Institutional Venture Partners
Compass	$4	United States	Real Estate	Founders Fund, Thrive Capital, Wellington Management
Olacabs	$4	India	On-demand	Accel Partners, SoftBank Group, Sequoia Capital
Oyo Rooms	$4	India	Travel Tech	SoftBank Group, Sequoia Capital India,Lightspeed India Partners
Peloton Interactive	$4	United States	Fitness	True Ventures, Tiger Global Management, L Catterton
Houzz	$4	United States	eCommerce/Marketplace	New Enterprise Associates, Sequoia Capital, Comcast Ventures
Niantic	$4	United States	AR/VR	Nintendo, Google, Pokemon Company International, Spark Capital
Nubank	$4	Brazil	Fintech	Sequoia Capital, Redpoint e.ventures, Kaszek Ventures
Yello Mobile	$4	South Korea	Mobile Software & Services	Formation 8
Snowflake Computing	$4	United States	Internet Software & Services	Redpoint Ventures,Iconiq Capital, Madrona Venture Group
OpenDoor Labs	$4	United States	Real Estate	Norwest Venture Partners, New Enterprise Associates, Khosla Ventures
XPeng Motors	$4	China	Automobile	Morningside Venture Capital, Foxconn Technology Company, Alibaba Group
Samsara	$4	United States	Internet of Things	Andreessen Horowitz, General Catalyst
Auto1 Group	$4	Germany	eCommerce/Marketplace	Digital Sky Technologies, Piton Capital, DN Capital, SoftBank Group
Credit Karma	$4	United States	Fintech	Felicis Ventures, SV Angel, Founders Fund
Indigo Agriculture	$4	United States	Biotech	Activant Capital Group, Alaska Permanent Fund, Baillie Gifford & Co.
Klarna	$4	Sweden	Fintech	Institutional Venture Partners, Sequoia Capital, General Atlantic
Otto Bock HealthCare	$4	Germany	Healthcare	EQT Partners
Youxia Motors	$3	China	Automobile	China Environmental Protection Industry, China Fortune Ocean
Cloudwalk	$3	China	AI	Oriza Holdings, Guangdong Technology Financial Group
Rubrik	$3	United States	Internet Software & Services	Greylock Partners, Lightspeed Venture Partners, Khosla Ventures
Swiggy	$3	India	On-demand	Accel India, SAIF Partners, Norwest Venture Partners
The Hut Group	$3	United Kingdom	eCommerce	KKR, Old Mutual Global Investors, Artemis Investment Management
Flexport	$3	United States	Internet Software & Services	Bloomberg Beta, Founders Fund, First Round Capital
Oscar Health Insurance Co.	$3	United States	Healthcare	BoxGroup, Formation8, Khosla Ventures
SmileDirectClub	$3	United States	Health & Wellnes	Clayton Dubilier & Rice, Kleiner Perkins Caufield & Byers, Spark Capital
Zoox	$3	United States	Auto Tech	AID Partners, Draper Fisher Jurvetson
Ziroom	$3	China	Real Estate Tech	Sequoia Capital China, Warburg Pincus, General Catalyst
BGL Group	$3	United Kingdom	Fintech	CPP Investment Board
Circle Internet Financial	$3	United States	Fintech	General Catalyst, Digital Currency Group, Accel
ContextLogic (dba. Wish)	$3	United States	eCommerce/Marketplace	Founders Fund, GGV Capital, Digital Sky Technologies
CrowdStrike	$3	United States	Cybersecurity	Warbug Pincus, capitalG, Accel Partners
Horizon Robotics	$3	China	AI/Robotics	Hillhouse Capital Management, Linear Venture, Morningside Venture Capital
Kuaishou	$3	China	Social	Morningside Venture Capital, Sequoia Capital, Baidu
Procore Technologies	$3	United States	Construction Tech	Bessemer Venture Partners, O’Connor Ventures, Iconiq Capital
Royole Corporation	$3	China	Hardware	Warmsun Holding, IDG Capital Partners
SouChe Holdings	$3	China	AutoTech	Morningside Ventures, Warburg Pincus, CreditEase Fintech Investment Fund
UCommune	$3	China	Real Estate	Ant Financial Services Group, Dahong Group, Sequoia Capital China
Unity Technologies	$3	United States	Gaming	Sequoia Capital, iGlobe Partners, DFJ Growth
VANCL	$3	China	eCommerce/Marketplace	Ceyuan Ventures, QiMing Venture Partners, Temasek Holdings
Vipkid	$3	China	Edtech	Sequoia Capital China, Tencent Holdings, Sinovation Ventures
Xiaohongshu	$3	China	eCommerce/Marketplace	GGV Capital, ZhenFund, Tencent
Yuanfudao	$3	China	Edtech	Tencent Holdings, Warbug Pincus, IDG Capital
Affirm	$3	United States	Fintech	Andreessen Horowitz, Khosla Ventures, Singapore Wealth Fund
luckin coffee	$3	China	Food & Beverage	JOY Capital, Lu Zhengyao
Shanghai Henlius	$3	China	Real Estate	Green Tomato, Fuguo Asset Management, Jacobson Pharma
ESR Cayman (e-Shang Redwood)	$3	China	Drug Development	SK Group, GF Investments, China Minsheng Banking Corp.
Meicai	$3	China	Food & Grocery	Tiger Global Management, Blue Lake Capital, ZhenFund
Databricks	$3	United States	Internet Software & Services	Andreessen Horowitz, New Enterprise Associates, Battery Ventures
N26	$3	Germany	Fintech	Redalpine Venture Partners, Earlybird Venture Capital, Valar Ventures
Toast	$3	United States	Restaurant Tech	Bessemer Venture Partners, Tiger Global Management, Google Ventures
Plaid Technologies	$3	United States	Fintech	New Enterprise Associates, Spark Capital,
Automation Anywhere	$3	United States	Robotics	General Atlantic, Goldman Sachs, New Enterprise Associates
Woowa Brothers	$3	South Korea	On Demand	Hillhouse Capital Management, Altos Ventures, Sequoia Capital
Confluent	$3	United States	Internet Software & Services	Benchmark, Sequoia Capital, Index Ventures
VistaJet	$3	Malta	On-demand	Rhone Capital
Zhihu	$3	China	Internet Software & Services	Tencent Holdings, Sinovation Ventures, Qiming Venture Partners
GRAIL	$2	United States	Genomics	Kleiner Perkins Caufield & Byers, Amazon, Merck & Co.
Lime	$2	United States	Travel	Andreessen Horowitz, Coatue Management, Uber
Medallia	$2	United States	Internet Software & Services	Sequoia Capital
YITU Technology	$2	China	Computer Vision	Sequoia Capital China, Banyan Capital
ACORN OakNorth	$2	United Kingdom	Fintech	Clermont Group, Coltrane Asset Management, Toscafund Asset Management
Dadi Cinema	$2	China	Entertainment	Alibaba Pictures Group
Uptake	$2	United States	Big Data	Revolution, New Enterprise Associates, Caterpillar
Zume Pizza	$2	United States	On Demand	Softbank Group, AME Cloud Ventures, SignalFire
MINISO Life	$2	China	Retail	Hillhouse Capital Management, and Tencent Holdings
NuCom Group	$2	Germany	Management & Strategy Consulting	General Atlantic
Zomato Media	$2	India	Social	Sequoia Capital, VY Capital
benevolent.ai	$2	United Kingdom	Healthcare	Woodford Investment Management
Aurora	$2	United States	AutoTech	Index Ventures, Greylock Partners, Lightspeed Venture Partners
Avant	$2	United States	Fintech	RRE Ventures, Tiger Global, August Capital
Bird Rides	$2	United States	Travel	Tusk Ventures, Craft Ventures, Sequoia Capital
Cambricon	$2	China	Chips & Semiconductors	Alibaba Entrepreneurs Fund, CAS Investment Management Co., Lenovo Ventures Group
Checkout.com	$2	United Kingdom	Fintech	Insight Partners, DST Global
Deliveroo	$2	United Kingdom	On-demand	Accel Partners, General Catalyst, Index Ventures
Discord	$2	United States	eSports	Benchmark, Greylock Partners, Tencent Holdings
Eggshell Apartment	$2	China	Real Estate Tech	JOY Capital, Gaorong Capital, Tiger Global Management
Huimin	$2	China	On-Demand	Zheshang Venture Capital, GP Capital, Western Capital Management
Improbable	$2	United Kingdom	AR/VR	Andreessen Horowitz, SoftBank Group, Temasek Holdings
LegalZoom	$2	United States	RegTech	K1 Capital, Francisco Partners, Neuberger Berman
Lemonade	$2	United States	Fintech	Google Ventures, Thrive Capital, SoftBank Group
Preferred Networks	$2	Japan	Internet Software & Services	Toyota Motor Corporation, Mizuho Financial Group, FANUC
ReNew Power Ventures	$2	India	Energy & Utilities	Goldman Sachs, JERA, Asian Development Bank
Tempus Labs	$2	United States	Robotic Process Automation	New Enterprise Associates, T. Rowe Associates, Lightbank
Traveloka	$2	Indonesia	TravelTech	Global Founders Capital, East Ventures, Expedia Inc.
Trendy Group International	$2	China	Clothing & Accessories	L Capital Partners
Zenefits	$2	United States	Fintech	SV Angel, Institutional Venture Partners, Venrock
HashiCorp	$2	United States	DevOps	Redpoint Ventures, True Ventures, Mayfield Fund
InVision	$2	United States	Internet Software & Services	FirstMark Capital, Tiger Global Management, ICONIQ Capital
Postmates	$2	United States	On Demand	Founders Fund, Matrix Partners, Tiger Global Management
Afiniti	$2	United States	Internet Software & Services	GAM Holding
Devoted Health	$2	United States	Healthcare	Andreessen Horowitz, F-Prime Capital, Venrock
Quora	$2	United States	Internet Software & Services	Y Combinator, Matrix Partners, Benchmark
reddit	$2	United States	Social	Y Combinator, Sequoia Capital, Coatue Management
Sprinklr	$2	United States	Internet Software & Services	Azure Capital Partners, Battery Ventures, Intel Capital
Zocdoc	$2	United States	Healthcare	Founders Fund, Khosla Ventures, Goldman Sachs
L&P Cosmetic	$2	South Korea	Beauty & grooming	CDIB Capital
23andMe	$2	United States	Healthcare	Google Ventures, New Enterprise Associates, MPM Capital
Buzzfeed	$2	United States	Media	SV Angel, RRE Ventures, New Enterprise Associates
Carbon3D	$2	United States	Hardware	Google Ventures, Sequoia Capital, Wakefield Group
Carta	$2	United States	Fintech	Menlo Ventures, Spark Capital, Union Square Ventures
Graphcore	$2	United Kingdom	Application & Data Integration Software	Dell Technologies Capital, Pitango Venture Capital, Amadeus Capital Partners
Insidesales.com	$2	United States	Big Data	Microsoft Ventures, US Venture Partners, Kleiner Perkins Caufield & Byers
Pax Labs	$2	United States	Consumer Electronics	Tao Capital Partners, Global Asset Capital, Tiger Global Management
Pony.ai	$2	United States	AutoTech	Sequoia Capital China, IDG Capital, DCM Ventures
Revolut	$2	United Kingdom	Fintech	index Ventures, DST Global, Ribbit Capital
Squarespace	$2	United States	Internet Software & Services	General Atlantic, Index Ventures, Accel Partners
CureVac	$2	Germany	Biotechnology	dievini Hopp BioTech Holding & Co., Eli Lilly & Co., LBBW Venture Capital
Darktrace	$2	United Kingdom	Cybersecurity	KKR, Ten Eleven Ventures, Summit Partners
Jusfoun Big Data	$2	China	Big Data	Boxin Capital, DT Capital Partners, IDG Capital
ServiceTitan	$2	United States	Internet Software & Services	Bessemer Venture Partners, ICONIQ Capital, Battery Ventures
BlaBlaCar	$2	France	On-Demand	Accel Partners, Index Ventures, Insight Venture Partners
CAOCAO	$2	China	On Demand	People Electrical Appliance Group China, Zhongrong International Trust
Dataminr	$2	United States	BI & Analytics	Venrock, Institutional Venture Partners, Goldman Sachs
Delhivery	$2	India	Supply Chain & Logistics	Times Internet, Nexus Venture Partners, SoftBank Group
Gan & Lee Pharmaceuticals	$2	China	Biotechnology	Qiming Venture Partners, Goldman Sachs, Hillhouse Capital Management
Infinidat	$2	Israel	Hardware	TPG Growth, Goldman Sachs
Looker	$2	United States	Business Intelligence, Analytics & Performance Mgmt	Redpoint Ventures, First Round Capital, capitalG
TransferWise	$2	United Kingdom	Fintech	IA Ventures, Index Ventures, SV Angel
AIWAYS	$2	China	Auto Tech	Jiangsu Sha Steel Group, Shanghai Puyin Industry, Funa Yuanchuang Technology
Quanergy Systems	$2	United States	Auto Tech	Delphi Automotive, Samsung Ventures, Motus Ventures
Promasidor Holdings	$2	South Africa	Food and Beverage	IFC, Ajinomoto
Oxford Nanopore Technologies	$2	United Kingdom	Healthcare	Illumina, Invesco Perpetual, IP Group
DouyuTV	$2	China	Internet Software & Services	CMB International Capital, Nanshan Capital, Tencent Holdings
Aihuishou	$2	China	Marketplace	Morningside Ventures, JD.com, Tiantu Capital
Asana	$2	United States	Internet Software & Services	8VC, Benchmark, Generation Investment Management
Chime	$2	United States	Fintech	Forerunner Ventures, Crosslink Capital, Homebrew
Desktop Metal	$2	United States	3D Printing	Australian Future Fund, GE Ventures, Data Collective
Freshworks	$2	United States	Internet Software & Services	Accel, Tiger Global Management, capitalG
GuaHao (We Doctor)	$2	China	Healthcare	Tencent, Morningside Group
ironSource	$2	Israel	Mobile Software & Services	Access Industries, Clal Industries and Investments
Mu Sigma	$2	United States	Big Data	Sequoia Capital, General Atlantic
Nextdoor	$2	United States	Social	Benchmark Capital, DAG Ventures, Insight Venture Partners
Segment	$2	United States	Internet Software & Services	Accel, Y Combinator, Thrive Capital
STX Entertainment	$2	United States	Entertainment	Tencent, TPG Growth, Hony Capital
Tujia	$2	China	eCommerce/Marketplace	GGV Capital, QiMing Venture Partnersl
Tuandaiwang	$1	China	Fintech	Beihai Hongtai Investment, China Minsheng Investment, Yisheng Innovation
Coocaa	$1	China	Consumer Hardware	Baidu, Tencent Holdings
Allbirds	$1	United States	Apparel	Lerer Hippeau Ventures, T. Rowe Price, Tiger Global Management
AppLovin	$1	United States	Adtech	Orient Hontai Capital, Webb Investment Network
AvidXchange	$1	United States	Fintech	Temasek Holdings, Charlotte Angel Partners, TPG Growth
C3 IoT	$1	United States	IoT	Makena Capital Management, TPG Growth, Breyer Capital
Cabify	$1	Spain	On Demand	Seaya Ventures, Otter Rock Capital, Rakuten
CGTZ	$1	China	Fintech	Shunwei Capital Partners, China Media Group, Guangzhou Huiyin Aofeng Equity Investment Fund
Gett	$1	Israel	On-demand	Volkswagen, Access Industries, Vostok New Ventures
Hike	$1	India	Social	Foxconn, Tiger Global management, Tencent
Koudai Gouwu	$1	China	eCommerce/Marketplace	New Enterprise Associates, Tiger Global management, Tencent
Wemakeprice	$1	South Korea	eCommerce/Marketplace	IMM Investment, NXC
Docker	$1	United States	Internet Software & Services	Greylock Partners, Lightspeed Venture Partners, Lowercase Capital
Zeta Interactive	$1	United States	Internet Software & Services	GSO Capital Partners, Franklin Square
Intercom	$1	United States	Mobile & Telecommunications	FirstMark Capital, Tiger Global Management
Monzo	$1	United Kingdom	Fintech	Passion Capital, Thrive Capital, Orange Digital Ventures
Starry	$1	United States	Sales Tech	Social Capital, Bessemer Venture Partners
Atom Bank	$1	United Kingdom	Fintech	Toscafund Asset Management, Woodford Investment Management, BBVA
Butterfly Network	$1	United States	Healthcare	Bill & Melinda Gates Foundation, Aeris Capital,
ezCater	$1	United States	Food & Grocery	Insight Venture Partners, ICONIQ Capital, Launchpad Venture Group
4Paradigm	$1	China	Cybersecurity	Sequoia Capital China, China Construction Bank, Bank of China
Clover Health	$1	United States	Healthcare	Google Ventures, Sequoia Capital, First Round Capital
Glossier	$1	United States	eCommerce	Forerunner Ventures, Institutional Venture Partners, Thrive Capital
Human Longevity	$1	United States	Healthcare	Celgene, GE Ventures, Draper Fisher Jurvetson
KeepTruckin	$1	United States	Supply Chain & Logistics	Google Ventures, Index Ventures, Scale Venture Partners
OfferUp	$1	United States	eCommerce/Marketplace	Andreessen Horowitz, GGV Capital, T. Rowe Price
Ten-X	$1	United States	Internet Software & Services	Stone Point Capital, Google Capital
Thumbtack	$1	United States	eCommerce/Marketplace	Tiger Global, Sequoia Capital, Google Capital
Viva Republica (Toss)	$1	South Korea	Fintech	Bessemer Venture Partners, Qualcomm Ventures, Kleiner Perkins Caufield & Byers
Warby Parker	$1	United States	eCommerce/Marketplace	BoxGroup, Felicis Ventures, First Round Capital
Yiguo (易果生鲜)	$1	China	Food & Grocery	Alibaba Group, KKR, Goldman Sachs
HeartFlow	$1	United States	Digital Health	BlueCross BlueShield Venture Partners, US Venture Partners
Logic Show (Luojisiwei)	$1	China	Ed Tech	Sequoia Capital China, Qiming Venture Partners, Tencent Holdings
Automattic	$1	United States	Internet Software & Services	Insight Venture Partners, Lowercase Capital, Polaris Partners
Deezer	$1	France	Internet Software & Services	Orange Digital Ventures, Access Industries
Tuhu	$1	China	Auto Tech	Qiming Venture Partners, Yaxia Automobile, Far East Horizon
BrewDog	$1	United Kingdom	Food & Beverages	TSG Consumer Partners, Crowdcube
LIfeMiles	$1	Colombia	Business Products & Services	Advent International
Doctolib	$1	France	Digital Health	BPI France, Kerala Ventures, Accel
Actifio	$1	United States	Big Data	Greylock Partners, North Bridge Venture Partners, Technology Crossover Ventures
Airtable	$1	United States	Internet Software & Services	Caffeinated Capital, CRV, Founder Collective
Brex	$1	United States	Fintech	DST Global, Ribbit Capital, Greenoaks Capital Management
Casper	$1	United States	eCommerce / D2C	Norwest Venture Partners, New Enterprise Associates, Lerer Hippeau Ventures
GitLab	$1	United States	DevOps	Google Ventures, ICONIQ Capital, Khosla Ventures
Global Fashion Group	$1	Luxembourg	eCommerce/Marketplace	Access Industries, Rocket Internet, Tengelmann Ventures
Outreach	$1	United States	BI & Analytics	Mayfield Fund, M12, Trinity Ventures
OVH	$1	France	Big Data	KKR, TowerBrook Capital Partners
Proteus Digital Health	$1	United States	Healthcare	Novartis, Essex Woodlands, The Carlyle Group
Shopclues	$1	India	eCommerce/Marketplace	Nexus Venture Partners, GIC Special Investments, Tiger Global Management
TangoMe	$1	United States	Social	Draper Fisher Jurtson, Qualcomm Ventures, Alibaba Group
Tradeshift	$1	United States	Fintech / Supply Chain	Notion Capital, Scentan Ventures, Kite Ventures
Yijiupi (易久批)	$1	China	e-commerce	Source Code Capital, Meituan Dianping, Tencent Holdings
TuSimple	$1	United States	AutoTech	Sina Weibo Fund, Zhiping Capital, Composite Capital Partners
Radius Payments Solutions	$1	United Kingdom	Internet Software & Services	Inflexion Private Equity
Formlabs	$1	United States	3D Printing	Pitango Venture Capital, DFJ Growth Fund, Foundry Group
Jiuxian	$1	China	eCommerce/Marketplace	Sequoia Capital China, Rich Land Capital, Merrysunny Wealth
AppDirect	$1	United States	Internet Software & Services	Mithril, iNovia Capital, Foundry Group
Jumia	$1	Nigeria	eCommerce/Marketplace	AXA
Avaloq Group	$1	Switzerland	Fintech	Warbug Pincus
10X Genomics	$1	United States	Genomics	Fidelity Investments, Paladin Capital Group, Meritech Capital Partners
17zuoye	$1	China	EdTech	DST Global, Temasek Holdings
58 Daojia	$1	China	Internet Software & Services	KKR, Alibaba Group, Ping An Insurance
9f Group	$1	China	Fintech	China Cinda Asset Management, IDG Capital
About You	$1	Germany	eCommerce	German Media Pool, Seven Venture Capital
Adaptive Biotechnologies	$1	United States	Healthcare	Illumina, Celgene, Casdin Capital
Age of Learning	$1	United States	Edtech	Iconiq Capital
Aijia Life	$1	China	Construction Tech	Tiantu Capital, Fortune Capital, Zhenghedao Fund
Airwallex	$1	Australia	Fintech	DST Global, Sequoia Capital China, Tencent Holdings
Apus Group	$1	China	Mobile Software & Services	Redpoint Ventures, QiMing Venture Partners, Chengwei Capital
BeiBei	$1	China	eCommerce/Marketplace	Banyan Capital, New Horizon Capital, IDG Capital Partners
BigBasket	$1	India	eCommerce/Marketplace	Alibaba Group, Bessemer Venture Partners, Helion Venture Partners
Bill.com	$1	United States	Fintech	August Capital, DCM Ventures, Emergence Capital Partners
Bolt	$1	Estonia	On-demand	Didi Chuxing, Diamler, TMT Investments
Bukalapak	$1	Indonesia	eCommerce	500 Startups, Batavia Incubator, Emtek Group
Calm	$1	United States	Health & Wellness	Insight Venture Partners, TPG Growth, Sound Ventures
Canva	$1	Australia	Collaboration & Project Management	Sequoia Capital China, Blackbird Ventures, Matrix Partners
Cell C	$1	South Africa	Telecommunications	Blue Label Telecoms, Net1 UEPS Technologies
Celonis	$1	Germany	BI & Analytics	Accel, 83North
CloudFlare	$1	United States	Cybersecurity	New Enterprise Associates, Pelion Venture Partners, Union Square Ventures
Cohesity	$1	United States	Data Storage	SoftBank Group, Sequoia Capital, Wing Venture Capital
Collibra	$1	United States	Regtech / AI	Index Ventures, Battery Ventures, ICONIQ Capital
Convoy	$1	United States	Supply Chain	Greylock Partners, capitalG, Y Combinator
Coursera	$1	United States	Edtech	New Enterprise Associates, Kleiner Perkins Caufield & Byers, GSV Capital, Learn Capital
Ding Xiang Yuan	$1	China	Digital Health	Tencent Holdings, DCM Ventures
Dream11	$1	India	Sports/Gaming	Kaalari Capital, Tencent Holdings, Steadview Capital
Dt Dream	$1	China	Internet Software & Services	Alibaba Group, China Everbright Investment Management, Yinxinggu Capital
Face++ (Megvii)	$1	China	AI / Facial Recognition	Ant Financial Services Group, Russia-China Investment Fund, Foxconn Technology Company
Fanli	$1	China	eCommerce/Marketplace	QiMing Venture Partners, Steam boat Ventures
Geek+	$1	China	Robotics	Volcanics Ventures, Vertex Ventures China, Warburg Pincus
Ginkgo BioWorks	$1	United States	Biotechnology	Y Combinator, Data Collective, MassVentures
GoodRx	$1	United States	Travel Tech	Silver Lake Partners, SV Angel, Upfront Ventures
Gusto	$1	United States	Fintech	General Catalyst Partners, Google Ventures, Kleiner Perkins Caufield & Byers
Health Catalyst	$1	United States	Digital Health	Sequoia Capital, Kaiser Permanente Ventures, Norwest Venture Partners
Hims	$1	United States	Consumer Products & Services	Forerunner Ventures, Thrive Capital, Redpoint Ventures
Huike Group (Uniquedu Corporation)	$1	China	HR Tech	Fosun RZ Capital, Oceanwide Holdings, Shenzhen Qianhe Capital Management Co.
HuJiang	$1	China	Edtech	China Minsheng Investment, Baidu, Wanxin Media
iCarbonX	$1	China	Healthcare	Tencent, Vcanbio
iFood	$1	Brazil	On Demand	Movile, Just Eat, Naspers
Illumio	$1	United States	Cybersecurity	Data Collective, Formation 8, General Catalyst Partners
InMobi	$1	India	Adtech	Kleiner Perkins Caufield & Byers, Softbank Corp., Sherpalo Ventures
iTutorGroup	$1	China	Ed Tech	QiMing Venture Partners, Temasek Holdings, Silverlink Capital
JFrog	$1	United States	DevOps	Gemini Israel Ventures, VMware, Battery Ventures
JOLLY Information Technology	$1	China	ecommerce	Legend Capital, CDH Investments, Sequoia Capital China
Kabbage	$1	United States	Fintech	BlueRun Ventures, SV Angel, Mohr Davidow Ventures
