Beer Name (Full),matches
Breckenridge Brewery Avalanche Amber Ale,Breckenridge Brewery Avalanche Ale
BrewDog 5AM Saint,BrewDog 5 A.M. Saint
Brewery Ommegang Three Philosophers - Bourbon Barrel-Aged,Brewery Ommegang Bourbon Barrel Aged Three Philosophers
Brewery Ommegang Hennepin,Brewery Ommegang Hennepin (Farmhouse Saison)
Brewery Ommegang Abbey Ale,Brewery Ommegang Ommegang (Abbey Ale)
Brewery Ommegang Witte Wheat Ale,Brewery Ommegang Ommegang Witte
Brewery Ommegang Rare Vos Amber Ale,Brewery Ommegang Rare Vos (Amber Ale)
Brewery Ommegang Three Philosophers,Brewery Ommegang Three Philosophers Belgian Style Blend (Quadrupel)
Brooklyn Brewery Black Chocolate Stout,Brooklyn Brewery Brooklyn Black Chocolate Stout
Brooklyn Brewery Black OPS,Brooklyn Brewery Brooklyn Black OPS
Brooklyn Brewery Brown Ale,Brooklyn Brewery Brooklyn Brown Ale
Brooklyn Brewery Dry Irish Stout,Brooklyn Brewery Brooklyn Dry Stout
Brooklyn Brewery East India Pale Ale,Brooklyn Brewery Brooklyn East India Pale Ale
Brooklyn Brewery Lager,Brooklyn Brewery Brooklyn Lager
Brooklyn Brewery Local 1,Brooklyn Brewery Brooklyn Local 1
Brooklyn Brewery Local 2,Brooklyn Brewery Brooklyn Local 2
Brooklyn Brewery Pilsner,Brooklyn Brewery Brooklyn Pilsner
Brooklyn Brewery Sorachi Ace,Brooklyn Brewery Brooklyn Sorachi Ace
Brooklyn Brewery Summer Ale,Brooklyn Brewery Brooklyn Summer Ale
Brooklyn Brewery Winter Ale,Brooklyn Brewery Brooklyn Winter Ale
Brouwerij Bockor N.V. Cuvée Des Jacobins Rouge,Brouwerij Bockor N.V. Cuvee Des Jacobins Rouge
Brouwerij Bockor N.V. Kriek Des Jacobins,Brouwerij Bockor N.V. Jacobins Kriek
Brouwerij Boon Oude Geuze Boon,Brouwerij Boon Boon Oude Geuze
Brouwerij Bosteels Kwak,Brouwerij Bosteels Pauwel Kwak
Brouwerij Corsendonk Agnus Dei (Abbey Pale Ale),Brouwerij Corsendonk Corsendonk Agnus / Abbey Pale Ale
Brouwerij De Dolle Brouwers Arabier,Brouwerij De Dolle Brouwers De Dolle Arabier
Brouwerij De Dolle Brouwers Boskeun,Brouwerij De Dolle Brouwers De Dolle Bos Keun
Brouwerij De Dolle Brouwers Dulle Teve (Mad Bitch),Brouwerij De Dolle Brouwers De Dolle Dulle Teve (Mad Bitch)
Brouwerij De Dolle Brouwers Extra Export Stout,Brouwerij De Dolle Brouwers De Dolle Extra Export Stout
Brouwerij De Dolle Brouwers Oerbier,Brouwerij De Dolle Brouwers De Dolle Oerbier
Brouwerij De Dolle Brouwers Stille Nacht,Brouwerij De Dolle Brouwers De Dolle Stille Nacht
Brouwerij De Koninck NV De Koninck APA (Antwaarpse Pale Ale),Brouwerij De Koninck NV De Koninck
Brouwerij De Molen Tsarina Esra,Brouwerij De Molen Tsarina Esra Reserva
Brouwerij De Troch De Troch Oude Gueuze,Brouwerij De Troch De Troch Gueuze
Brouwerij Drie Fonteinen Doesjel,Brouwerij Drie Fonteinen Drie Fonteinen Doesjel
Brouwerij Drie Fonteinen Framboos,Brouwerij Drie Fonteinen Drie Fonteinen Framboos
Brouwerij Drie Fonteinen Hommage,Brouwerij Drie Fonteinen Drie Fonteinen Hommage
Brouwerij Drie Fonteinen Oude Geuze,Brouwerij Drie Fonteinen Drie Fonteinen Oude Geuze
Brouwerij Drie Fonteinen Oude Kriek,Brouwerij Drie Fonteinen Drie Fonteinen Oude Kriek
Brouwerij Drie Fonteinen Schaarbeekse Kriek,Brouwerij Drie Fonteinen Drie Fonteinen Schaerbeekse Kriek
Brouwerij Haacht NV Tongerlo Blond,Brouwerij Haacht NV Tongerlo 6 Dubbel Blond
Brouwerij Huyghe Delirium Noël (Christmas),Brouwerij Huyghe Delirium Noël
Brouwerij Lindemans Pomme (Apple),Brouwerij Lindemans Lindemans Apple
Brouwerij Lindemans Cassis,Brouwerij Lindemans Lindemans Cassis
Brouwerij Lindemans Framboise,Brouwerij Lindemans Lindemans Framboise
Brouwerij Lindemans Gueuze,Brouwerij Lindemans Lindemans Gueuze
Brouwerij Lindemans Kriek,Brouwerij Lindemans Lindemans Kriek
Brouwerij Lindemans Oude Lambik,Brouwerij Lindemans Lindemans Oude Lambik
Brouwerij Lindemans Pêche,Brouwerij Lindemans Lindemans Pêche
Brouwerij Mort Subite Mort Subite Blonde Lambic,Brouwerij Mort Subite Mort Subite Oude Lambik
Brouwerij Oud Beersel Lambiek Oud Beersel,Brouwerij Oud Beersel Oud Beersel Lambik
Brouwerij Rodenbach N.V. Rodenbach Alexander,Brouwerij Rodenbach N.V. Alexander Rodenbach
Brouwerij St. Bernardus NV Abt 12,Brouwerij St. Bernardus NV St. Bernardus Abt 12
Brouwerij St. Bernardus NV Pater 6,Brouwerij St. Bernardus NV St. Bernardus Pater 6
Brouwerij St. Bernardus NV Prior 8,Brouwerij St. Bernardus NV St. Bernardus Prior 8
Brouwerij St. Bernardus NV Tripel,Brouwerij St. Bernardus NV St. Bernardus Tripel
Brouwerij Straffe Hendrik / Huisbrouwerij De Halve Maan Straffe Hendrik Bruges Tripel Bier 9°,Brouwerij Straffe Hendrik / Huisbrouwerij De Halve Maan Straffe Hendrik Brugse Tripel Bier 9°
Brouwerij Timmermans-John Martin N.V. Faro,Brouwerij Timmermans-John Martin N.V. Timmermans Faro
Brouwerij Timmermans-John Martin N.V. Framboise Lambicus,Brouwerij Timmermans-John Martin N.V. Timmermans Framboise Lambic
Brouwerij Timmermans-John Martin N.V. Strawberry Lambicus,Brouwerij Timmermans-John Martin N.V. Timmermans Strawberry
Brouwerij Van Honsebrouck N.V. Kasteel Tripel,Brouwerij Van Honsebrouck N.V. Kasteel Triple
Brouwerij Van Steenberge N.V. Augustijn Donker Brune,Brouwerij Van Steenberge N.V. Augustijn Brune
Brouwerij Van Steenberge N.V. Bornem Double,Brouwerij Van Steenberge N.V. Bornem Dubbel
Brouwerij Van Steenberge N.V. Gulden Draak,Brouwerij Van Steenberge N.V. Gulden Draak (Dark Triple)
Brouwerij Van Steenberge N.V. Gulden Draak 9000 Quadruple,Brouwerij Van Steenberge N.V. Gulden Draak Quad
Brouwerij Van Steenberge N.V. Piraat,Brouwerij Van Steenberge N.V. Piraat 9
Brouwerij Van Viven Viven Porter / Viven Smoked Porter,Brouwerij Van Viven Viven Porter
Brouwerij Westvleteren (Sint-Sixtusabdij van Westvleteren) Trappist Westvleteren BlondBrouwerij Westvleteren (Sint-Sixtusabdij van Westvleteren),Brouwerij Westvleteren (Sint-Sixtusabdij van Westvleteren) Trappist Westvleteren Blonde
Brouwerij Westvleteren (Sint-Sixtusabdij van Westvleteren) Trappist Westvleteren 12 (XII)Brouwerij Westvleteren (Sint-Sixtusabdij van Westvleteren),Brouwerij Westvleteren (Sint-Sixtusabdij van Westvleteren) Trappist Westvleteren 12
Brouwerij Westvleteren (Sint-Sixtusabdij van Westvleteren) Trappist Westvleteren 8 (VIII)Brouwerij Westvleteren (Sint-Sixtusabdij van Westvleteren),Brouwerij Westvleteren (Sint-Sixtusabdij van Westvleteren) Trappist Westvleteren 8
Browar Okocim S.A. (Carlsberg) O.K. BeerBrowar Okocim S.A. (Carlsberg),Browar Okocim S.A. (Carlsberg) O.K. Beer
Browar Okocim S.A. (Carlsberg) Okocim MocneBrowar Okocim S.A. (Carlsberg),Browar Okocim S.A. (Carlsberg) Okocim Mocne
Browar Van Pur S.A. (Brau Union Polska) Karpackie SuperBrowar Van Pur S.A. (Brau Union Polska),Browar Van Pur S.A. (Brau Union Polska) Karpackie
Browary Warka Sp. z o.o. Warka Premium (Strong),Browary Warka Sp. z o.o. Warka Strong
Browerij Nacional Balashi Pilsener,Browerij Nacional Balashi Balashi
Butternuts Beer & Ale Moo Thunder Stout Farmhouse Ale,Butternuts Beer & Ale Moo Thunder Stout
Calfkiller Brewing Company J. Henry Original Mild Ale,Calfkiller Brewing Company J. Henry Mild Brown Ale
Cameron's Brewing Co. Cosmic Cream Ale,Cameron's Brewing Co. Cream Ale
Camo Brewing Company Camo Silver Ice,Camo Brewing Company Camo Silver ICE
Capital Brewery Garten Bräu Munich Dark,Capital Brewery Capital Dark
Capital Brewery Supper Club,Capital Brewery Supper Club Lager
Captain Lawrence Brewing Co. Clearwater Kölsch,Captain Lawrence Brewing Co. Captain's Kölsch
Captain Lawrence Brewing Co. Smoked Porter,Captain Lawrence Brewing Co. Imperial Smoked Porter
Captain Lawrence Brewing Co. Nor' Easter Winter Warmer,Captain Lawrence Brewing Co. Nor' Easter
Captain Lawrence Brewing Co. Sun Block,Captain Lawrence Brewing Co. Sun Block Witte
Carton Brewing Company Boat Beer,Carton Brewing Company Boat
Cascade Brewery Company Ltd. Cascade Stout,Cascade Brewery Company Ltd. Cascade Export Stout
Cascade Brewing / Raccoon Lodge & Brewpub Apricot Ale,Cascade Brewing / Raccoon Lodge & Brewpub Cascade Apricot Ale
Cascade Brewing / Raccoon Lodge & Brewpub Cascade Noyaux,Cascade Brewing / Raccoon Lodge & Brewpub Cascade Noyeaux
Cascade Brewing / Raccoon Lodge & Brewpub Sang Noir,Cascade Brewing / Raccoon Lodge & Brewpub Cascade Sang Noir
Cascade Brewing / Raccoon Lodge & Brewpub Sang Royal,Cascade Brewing / Raccoon Lodge & Brewpub Cascade Sang Royal
Casco Bay Brewing Co. Casco Bay Riptide Red Ale,Casco Bay Brewing Co. Casco Bay RipTide Red Ale
Cathedral Square Brewery Abbey Ale,Cathedral Square Brewery Belgian-Style Abbey Ale
Central Waters Brewing Company Brewer's Reserve Bourbon Barrel Barleywine,Central Waters Brewing Company Bourbon Barrel Barleywine
Central Waters Brewing Company Mudpuppy,Central Waters Brewing Company Mudpuppy Porter
Ceres Brewery (Royal Unibrew) Ceres Royal Stout (Ceres Extra Strong Stout)Ceres Brewery (Royal Unibrew),Ceres Brewery (Royal Unibrew) Ceres Royal Stout (Ceres Extra Strong Stout)
Ceres Brewery (Royal Unibrew) Ceres Strong Ale ExportCeres Brewery (Royal Unibrew),Ceres Brewery (Royal Unibrew) Ceres Strong Ale Export
"Cervecería Cuauhtémoc Moctezuma, S.A. de C.V. Bohemia Oscura","Cervecería Cuauhtémoc Moctezuma, S.A. de C.V. Bohemia Obscura"
"Cervecería Cuauhtémoc Moctezuma, S.A. de C.V. Dos Equis Ambar","Cervecería Cuauhtémoc Moctezuma, S.A. de C.V. Dos Equis Amber Lager"
Choc Beer Co. / Pete's Place Summer Belgian-Style Blonde Ale,Choc Beer Co. / Pete's Place Belgian-Style Blonde Ale
Christian Moerlein Brewing Company Emancipator Doppelbock,Christian Moerlein Brewing Company Christian Moerlein Doppelbock
Christian Moerlein Brewing Company Lager House Original Golden Helles,Christian Moerlein Brewing Company Christian Moerlein Lager House Original Golden Helles
Christian Moerlein Brewing Company Over-The-Rhine Ale,Christian Moerlein Brewing Company Christian Moerlein Over-The-Rhine Ale
Cigar City Brewing Big Sound,Cigar City Brewing Big Sound Scotch Ale
Cigar City Brewing Florida Cracker,Cigar City Brewing Florida Cracker White Ale
Cigar City Brewing Hillsborough River Dry Irish Stout (Patio Tools),Cigar City Brewing Hillsborough River Dry Stout (Patio Tools) - Cedar Aged (Humidor Series)
Cigar City Brewing Patio Tools,Cigar City Brewing Hillsborough River Dry Stout (Patio Tools)
Cigar City Brewing Hotter Than Helles Lager,Cigar City Brewing Hotter Than Helles
Cigar City Brewing Maduro Brown Ale,Cigar City Brewing Maduro Oatmeal Brown Ale
Cigar City Brewing Cubano-Style Espresso Brown Ale,Cigar City Brewing Maduro Oatmeal Brown Ale - Cubano-Style Espresso
Cigar City Brewing Oatmeal Raisin Cookie Brown Ale,Cigar City Brewing Maduro Oatmeal Brown Ale - Oatmeal Raisin Cookie
"City Brewing Company, LLC Earthquake High Gravity Lager (10%)","City Brewing Company, LLC Earthquake High Gravity Lager"
City Steam Brewery Café The Naughty Nurse,City Steam Brewery Café City Steam Naughty Nurse Pale Ale
COAST Brewing Company 32°/50° Kölsch,COAST Brewing Company 32/50
Columbus Brewing Company Summer Teeth,Columbus Brewing Company Columbus Summer Teeth
Columbus Brewing Company Uncle Rusty,Columbus Brewing Company Columbus Uncle Rusty
Coop Ale Works Gran Sport Porter,Coop Ale Works Gran-Sport Porter
Coopers Brewery Limited Best Extra Stout,Coopers Brewery Limited Coopers Best Extra Stout
Coopers Brewery Limited Dark Ale,Coopers Brewery Limited Coopers Dark Ale
Coopers Brewery Limited Extra Strong Vintage Ale,Coopers Brewery Limited Coopers Extra Strong Vintage Ale
Coopers Brewery Limited Mild Ale,Coopers Brewery Limited Coopers Mild Ale
Coopers Brewery Limited Original Pale Ale,Coopers Brewery Limited Coopers Original Pale Ale
Coopers Brewery Limited Sparkling Ale,Coopers Brewery Limited Coopers Sparkling Ale
Coors Brewing Company Batch 19Coors Brewing Company (Molson-Coors),Coors Brewing Company Batch 19
Coors Brewing Company Blue Moon Belgian WhiteCoors Brewing Company (Molson-Coors),Coors Brewing Company Blue Moon Belgian White
Coors Brewing Company Blue Moon Spring Blonde Wheat AleCoors Brewing Company (Molson-Coors),Coors Brewing Company Blue Moon Spring Blonde Wheat Ale
Coors Brewing Company Blue Moon Summer Honey WheatCoors Brewing Company (Molson-Coors),Coors Brewing Company Blue Moon Summer Honey Wheat
Coors Brewing Company Keystone IceCoors Brewing Company (Molson-Coors),Coors Brewing Company Keystone Ice
Coors Brewing Company Keystone LightCoors Brewing Company (Molson-Coors),Coors Brewing Company Keystone Light
Craftsman Brewing Co. Spring Braggot,Craftsman Brewing Co. Craftsman Spring Braggot
Crooked Stave Artisan Beer Project Surette Provision Saison,Crooked Stave Artisan Beer Project Crooked Stave Surette
Cucapá Brewing Company Chupacabras Pale Ale,Cucapá Brewing Company Cucapá Chupacabras Pale Ale
D.L. Geary Brewing Company Geary's London Porter,D.L. Geary Brewing Company Geary's London Style Porter
Dark Horse Brewing Company 4 Elf,Dark Horse Brewing Company Dark Horse 4 Elf
Dark Horse Brewing Company Belgian Style Amber Ale,Dark Horse Brewing Company Dark Horse Amber Ale
Dark Horse Brewing Company Boffo Brown Ale,Dark Horse Brewing Company Dark Horse Boffo Brown Ale
Dark Horse Brewing Company Bourbon Barrel Aged Plead The 5th,Dark Horse Brewing Company Dark Horse Bourbon Barrel Aged Plead The 5th
Dark Horse Brewing Company Crooked Tree IPA,Dark Horse Brewing Company Dark Horse Crooked Tree IPA
Dark Horse Brewing Company Double Crooked Tree IPA,Dark Horse Brewing Company Dark Horse Double Crooked Tree IPA
Dark Horse Brewing Company Fore Smoked Stout,Dark Horse Brewing Company Dark Horse Fore Smoked Stout
Dark Horse Brewing Company One Oatmeal Stout,Dark Horse Brewing Company Dark Horse One Oatmeal Stout Ale
Dark Horse Brewing Company Perkulator Coffee Dopplebock,Dark Horse Brewing Company Dark Horse Perkulator Coffee Dopplebock
Dark Horse Brewing Company Raspberry Ale,Dark Horse Brewing Company Dark Horse Raspberry Ale
Dark Horse Brewing Company Reserve Special Black Ale,Dark Horse Brewing Company Dark Horse Reserve Special Black Bier Ale
Dark Horse Brewing Company Sapient Trip Ale,Dark Horse Brewing Company Dark Horse Sapient Trip Ale
Dark Horse Brewing Company Scotty Karate Scotch Ale,Dark Horse Brewing Company Dark Horse Scotty Karate Scotch Ale
Dark Horse Brewing Company Thirsty Trout Porter,Dark Horse Brewing Company Dark Horse Thirsty Trout Porter
Dark Horse Brewing Company Too Cream Stout,Dark Horse Brewing Company Dark Horse Too Cream Stout
Dark Horse Brewing Company Tres Blueberry Stout,Dark Horse Brewing Company Dark Horse Tres Blueberry Stout
De Leyerth Brouwerijen (Urthel) Urthel Hop-ItDe Leyerth Brouwerijen (Urthel),De Leyerth Brouwerijen (Urthel) Urthel Hop-It
De Leyerth Brouwerijen (Urthel) Urthel SamaranthDe Leyerth Brouwerijen (Urthel),De Leyerth Brouwerijen (Urthel) Urthel Samaranth
De Proefbrouwerij (bvba Andelot) Reinaert Flemish Wild AleDe Proefbrouwerij (bvba Andelot),De Proefbrouwerij (bvba Andelot) Reinaert Flemish Wild Ale
De Proefbrouwerij (bvba Andelot) Zoetzuur Flemish AleDe Proefbrouwerij (bvba Andelot),De Proefbrouwerij (bvba Andelot) Zoetzuur Flemish Ale
Deka Brewery Nicola Traditional,Deka Brewery Nicola
Deschutes Brewery Hop Henge,Deschutes Brewery Hop Henge Experimental IPA
Deschutes Brewery Twilight Summer Ale,Deschutes Brewery Twilight Ale
Detroit Beer Co. The Detroit Dwarf,Detroit Beer Co. Detroit Beer Co. The Detroit Dwarf
Devils Backbone Brewing Company Dark Abby,Devils Backbone Brewing Company Dark Abbey
Dinkelacker-Schwabenbraeu AG Dinkelacker CD-Pils,Dinkelacker-Schwabenbraeu AG Dinkel Acker Cd-Pils
Dock Street Brewery & Restaurant Dock Street Rye IPA,Dock Street Brewery & Restaurant Rye IPA
Dogfish Head Brewery Midas Touch,Dogfish Head Brewery Midas Touch Golden Elixir
Dogfish Head Brewery Namaste White Belgian-Style Witbier,Dogfish Head Brewery Namaste
Dogfish Head Brewery Raison D'Être,Dogfish Head Brewery Raison D'etre
Dogfish Head Brewery Raison D'Extra,Dogfish Head Brewery Raison D'extra
Dragonmead Microbrewery Andromeda Heather Ale,Dragonmead Microbrewery Dragonmead Andromeda Ale
Dragonmead Microbrewery Bishop Bob's Holy Smoke,Dragonmead Microbrewery Dragonmead Bishop Bob's Holy Smoke
Dragonmead Microbrewery Erik The Red,Dragonmead Microbrewery Dragonmead Erik The Red
Dragonmead Microbrewery Final Absolution Trippel,Dragonmead Microbrewery Dragonmead Final Absolution Trippel
Dragonmead Microbrewery Ring Of Fire,Dragonmead Microbrewery Dragonmead Ring Of Fire
Drake's Brewing Co. Black Robusto Porter,Drake's Brewing Co. Drake's Black Robusto Porter
Driftwood Brewery Crooked Coast Altbier,Driftwood Brewery Crooked Coast Amber Ale
DuClaw Brewing Company Euforia,DuClaw Brewing Company Euphoria
DuClaw Brewing Company Funk Blueberry Citrus Wheat,DuClaw Brewing Company Funk
East End Brewing Company Smokestack,East End Brewing Company Smokestack Heritage Porter
Einbecker Brauhaus AG Mai-Ur-Bock,Einbecker Brauhaus AG Einbecker Mai-Ur-Bock
Einbecker Brauhaus AG Ur-Bock Dunkel,Einbecker Brauhaus AG Einbecker Ur-Bock Dunkel
Einbecker Brauhaus AG Winter-Bock,Einbecker Brauhaus AG Einbecker Winter-Bock
Einstök Ölgerð Icelandic DoppelbockEinstök Ölgerð (Einstök Beer Company),Einstök Ölgerð Icelandic Doppelbock
Einstök Ölgerð Icelandic Toasted PorterEinstök Ölgerð (Einstök Beer Company),Einstök Ölgerð Icelandic Toasted Porter
Elevator Brewery & Draught Haus Bleeding Buckeye Red Ale,Elevator Brewery & Draught Haus Elevator Bleeding Buckeye Red Ale
Elevator Brewery & Draught Haus Dark Horse Lager,Elevator Brewery & Draught Haus Elevator Dark Horse Lager
Elysian Brewing Company Dragonstooth Stout,Elysian Brewing Company Dragon's Tooth Oatmeal Stout
Empyrean Brewing Company Burning Skye Scottish Style Ale,Empyrean Brewing Company Burning Skye Scottish Ale
Epic Brewing Company Epic Larger,Epic Brewing Company Epic Lager
Erdinger Weissbräu Oktoberfest Weissbier,Erdinger Weissbräu Erdinger Oktoberfest Weissbier
Erdinger Weissbräu Erdinger Weissbier (Hefe-Weizen),Erdinger Weissbräu Erdinger Weissbier
Erdinger Weissbräu Erdinger Weissbier Alkoholfrei (Non-Alcoholic),Erdinger Weissbräu Erdinger Weissbier Alkoholfrei
Erie Brewing Co. Derailed Black Cherry Cream Ale,Erie Brewing Co. Derailed Black Cherry Ale
Erie Brewing Co. Ol' Red Cease & Desist Wee Heavy Ale,Erie Brewing Co. Ol' Red Cease And Desist
Evil Twin Brewing Ashtray Heart,Evil Twin Brewing Evil Twin Ashtray Heart
Evil Twin Brewing Imperial Biscotti Break,Evil Twin Brewing Evil Twin Biscotti Break
Evil Twin Brewing Yin & Yang,Evil Twin Brewing Evil Twin Yang
Evolution Craft Brewing Company Rise Up Coffee Stout,Evolution Craft Brewing Company Rise Up Stout
Evolution Craft Brewing Company Secret Spot Alt Ale,Evolution Craft Brewing Company Secret Spot Winter Ale
Fat Heads Brewery & Saloon Alpen Glow,Fat Heads Brewery & Saloon Alpen Glow Weizenbock
Fat Heads Brewery & Saloon Bumble Berry Honey Blueberry Ale,Fat Heads Brewery & Saloon Bumbleberry Honey Blueberry Ale
Fat Heads Brewery & Saloon Holly Jolly Christmas Ale,Fat Heads Brewery & Saloon Christmas Ale
Fat Heads Brewery & Saloon Head Hunter,Fat Heads Brewery & Saloon Fat Head's Head Hunter IPA
Fat Heads Brewery & Saloon Hop JuJu,Fat Heads Brewery & Saloon Hop JuJu Imperial IPA
Fiddlehead Brewing Company Fiddlehead IPA,Fiddlehead Brewing Company IPA
"Fireman's Brew, Inc. Fireman's Brew Brunette Beer","Fireman's Brew, Inc. Fireman's Brew Brewnette Beer"
Firestone Walker Brewing Co. §ucaba,Firestone Walker Brewing Co. §ucaba (Abacus)
Firestone Walker Brewing Co. Bravo 2017,Firestone Walker Brewing Co. Bravo Brown
Firestone Walker Brewing Co. DBA (Double Barrel Ale),Firestone Walker Brewing Co. Double Barrel Ale
Firestone Walker Brewing Co. Pale 31 California Pale Ale,Firestone Walker Brewing Co. Pale 31
Firestone Walker Brewing Co. Stickee Monkee,Firestone Walker Brewing Co. Sticky Monkey
Firestone Walker Brewing Co. Velvet Merkin,Firestone Walker Brewing Co. Velvet Merlin (Merkin)
Flossmoor Station Restaurant & Brewery Pullman Nut Brown,Flossmoor Station Restaurant & Brewery Pullman Brown Ale
Flying Dog Brewery Gonzo - Barrel-Aged,Flying Dog Brewery Barrel-Aged Gonzo Imperial Porter
Flying Dog Brewery Doggie Style,Flying Dog Brewery Doggie Style Classic Pale Ale
Flying Dog Brewery Gonzo,Flying Dog Brewery Gonzo Imperial Porter
Flying Dog Brewery Horn Dog,Flying Dog Brewery Horn Dog Barley Wine Style Ale
Flying Dog Brewery Hefeweizen,Flying Dog Brewery Imperial Hefeweizen
Flying Dog Brewery K-9 Winter Ale,Flying Dog Brewery K-9 Cruiser Winter Ale
Flying Dog Brewery Raging Bitch,Flying Dog Brewery Raging Bitch Belgian-Style IPA
Flying Dog Brewery Road Dog,Flying Dog Brewery Road Dog Porter
Flying Dog Brewery Snake Dog,Flying Dog Brewery Snake Dog IPA
Flying Fish Brewing Company Abbey Dubbel,Flying Fish Brewing Company Bourbon Barrel Abbey Dubbel
Flying Fish Brewing Company Exit 1 Bayshore Oyster Stout.,Flying Fish Brewing Company Exit 1
Flying Monkeys Craft Brewery NetherWorld Cascadian Dark Ale,Flying Monkeys Craft Brewery Flying Monkeys Netherworld Cascadian Dark Ale
Foothills Brewing Company People's Porter - Barrel-Aged,Foothills Brewing Company Barrel Aged Peoples' Porter
Foothills Brewing Company Sexual Chocolate - Barrel-Aged,Foothills Brewing Company Barrel Aged Sexual Chocolate
Foothills Brewing Company Baltic Porter,Foothills Brewing Company Foothills Baltic Porter
Fordham Brewing Company Copperhead Ale,Fordham Brewing Company Fordham Copperhead Ale
Fordham Brewing Company Helles Lager,Fordham Brewing Company Fordham Helles Lager
Fordham Brewing Company Rosie Parks Oyster Stout,Fordham Brewing Company Oyster Stout
Founders Brewing Company All Day IPA,Founders Brewing Company Founders All Day IPA
Founders Brewing Company Backwoods Bastard,Founders Brewing Company Founders Backwoods Bastard
Founders Brewing Company Blushing Monk,Founders Brewing Company Founders Blushing Monk
Founders Brewing Company Breakfast Stout,Founders Brewing Company Founders Breakfast Stout
Founders Brewing Company CBS (Canadian Breakfast Stout),Founders Brewing Company Founders CBS Imperial Stout
Founders Brewing Company Centennial IPA,Founders Brewing Company Founders Centennial IPA
Founders Brewing Company Cerise,Founders Brewing Company Founders Cerise
Founders Brewing Company Devil Dancer,Founders Brewing Company Founders Devil Dancer
Founders Brewing Company Dirty Bastard,Founders Brewing Company Founders Dirty Bastard
Founders Brewing Company Double Trouble,Founders Brewing Company Founders Double Trouble
Founders Brewing Company Harvest Ale,Founders Brewing Company Founders Harvest Ale
Founders Brewing Company Curmudgeon,Founders Brewing Company Founders Kaiser Curmudgeon
Founders Brewing Company KBS (Kentucky Breakfast Stout),Founders Brewing Company Founders KBS (Kentucky Breakfast Stout)
Founders Brewing Company Oatmeal Stout,Founders Brewing Company Founders Oatmeal Stout
Founders Brewing Company Porter,Founders Brewing Company Founders Porter
Founders Brewing Company Red's Rye IPA,Founders Brewing Company Founders Red's Rye PA
Founders Brewing Company Rübæus,Founders Brewing Company Founders Rübæus
Founders Brewing Company Sumatra Mountain Brown,Founders Brewing Company Founders Sumatra Mountain Brown
Four Peaks Brewing Company 8th Street Pale Ale,Four Peaks Brewing Company 8th Street Ale
Four Peaks Brewing Company Sunbru,Four Peaks Brewing Company Sunbru Kölsch-Style Ale
Fremont Brewing Company Dark Star,Fremont Brewing Company Dark Star Oatmeal Stout
Fremont Brewing Company B-Bomb (Bourbon Abominable Winter Ale),Fremont Brewing Company Bourbon Barrel Abominable
Genesee Brewing Co. / Dundee Brewing Co. Original Honey Brown Extra Rich Lager (Beer Brewed With Honey),Genesee Brewing Co. / Dundee Brewing Co. Dundee Original Honey Brown Lager
Genesee Brewing Co. / Dundee Brewing Co. Genesee Spring Bock,Genesee Brewing Co. / Dundee Brewing Co. Genesee Bock
Goose Island Beer Co. Goose Green Line Pale Ale,Goose Island Beer Co. Green Line Pale Ale
Goose Island Beer Co. Pepe Nero Belgian Style Ale,Goose Island Beer Co. Pepe Nero
Goose Island Beer Co. Père Jacques,Goose Island Beer Co. Pere Jacques
Gordon Biersch Brewery Restaurant Blonde Bock,Gordon Biersch Brewery Restaurant Gordon Biersch Blonde Bock
Gordon Biersch Brewery Restaurant Czech Style Pilsner,Gordon Biersch Brewery Restaurant Gordon Biersch Czech Style Pilsner
Gordon Biersch Brewery Restaurant Dunkelweizen,Gordon Biersch Brewery Restaurant Gordon Biersch Dunkelweizen
Gordon Biersch Brewery Restaurant Golden Export,Gordon Biersch Brewery Restaurant Gordon Biersch Golden Export
Gordon Biersch Brewery Restaurant Hefeweizen,Gordon Biersch Brewery Restaurant Gordon Biersch Hefeweizen
Gordon Biersch Brewery Restaurant Maibock,Gordon Biersch Brewery Restaurant Gordon Biersch Maibock
Gordon Biersch Brewery Restaurant Märzen,Gordon Biersch Brewery Restaurant Gordon Biersch Märzen
Gordon Biersch Brewery Restaurant Schwarzbier,Gordon Biersch Brewery Restaurant Gordon Biersch Schwarzbier
Gordon Biersch Brewery Restaurant Winter Bock,Gordon Biersch Brewery Restaurant Gordon Biersch Winter Bock
Grand Teton Brewing Co. Bone Warmer Imperial Amber Ale,Grand Teton Brewing Co. Bone Warmer Amber Ale
Grand Teton Brewing Co. Oud Bruin Belgian Style Ale,Grand Teton Brewing Co. Oud Bruin
Great Dane Pub & Brewing Company (Downtown) Black Earth PorterGreat Dane Pub & Brewing Company (Downtown),Great Dane Pub & Brewing Company (Downtown) Black Earth Porter
Great Dane Pub & Brewing Company (Downtown) Tri-Pepper PilsenerGreat Dane Pub & Brewing Company (Downtown),Great Dane Pub & Brewing Company (Downtown) Tri-Pepper Pilsener
Great Divide Brewing Company Hibernation Ale - Barrel-Aged,Great Divide Brewing Company Barrel Aged Hibernation Ale
Great Divide Brewing Company Old Ruffian,Great Divide Brewing Company Old Ruffian Barley Wine
