Beer Name (Full),matches
Great Divide Brewing Company Old Ruffian - Barrel-Aged,Great Divide Brewing Company Barrel Aged Old Ruffian
Great Divide Brewing Company Yeti,Great Divide Brewing Company Barrel Aged Yeti
Great Divide Brewing Company Claymore,Great Divide Brewing Company Claymore Scotch Ale
Great Divide Brewing Company Colette,Great Divide Brewing Company Colette Farmhouse Ale
Great Divide Brewing Company Hoss Oktoberfest Lager,Great Divide Brewing Company Hoss
Great Lakes Brewing Company Edmund Fitzgerald,Great Lakes Brewing Company Coffee Infused Edmund Fitzgerald Porter
Great Lakes Brewing Company Alberta Clipper,Great Lakes Brewing Company Great Lakes Alberta Clipper
Great Lakes Brewing Company Blackout Stout - Barrel-Aged,Great Lakes Brewing Company Great Lakes Barrel-Aged Blackout Stout
Great Lakes Brewing Company Big Black Smoke,Great Lakes Brewing Company Great Lakes Big Black Smoke
Great Lakes Brewing Company Blackout Stout,Great Lakes Brewing Company Great Lakes Blackout Stout
Great Lakes Brewing Company Christmas Ale,Great Lakes Brewing Company Great Lakes Christmas Ale
Great Lakes Brewing Company Commodore Perry,Great Lakes Brewing Company Great Lakes Commodore Perry IPA
Great Lakes Brewing Company Conway's Irish Ale,Great Lakes Brewing Company Great Lakes Conway's Irish Ale
Great Lakes Brewing Company Dortmunder Gold,Great Lakes Brewing Company Great Lakes Dortmunder Gold
Great Lakes Brewing Company Eliot Ness,Great Lakes Brewing Company Great Lakes Eliot Ness
Great Lakes Brewing Company Holy Moses White Ale,Great Lakes Brewing Company Great Lakes Holy Moses
Great Lakes Brewing Company Imperial Dortmunder,Great Lakes Brewing Company Great Lakes Imperial Dortmunder
Great Lakes Brewing Company Lake Erie Monster,Great Lakes Brewing Company Great Lakes Lake Erie Monster
Great Lakes Brewing Company Moondog Ale,Great Lakes Brewing Company Great Lakes Moondog ESB
Great Lakes Brewing Company Nosferatu,Great Lakes Brewing Company Great Lakes Nosferatu
Great Lakes Brewing Company Ohio City Oatmeal Stout,Great Lakes Brewing Company Great Lakes Ohio City Oatmeal Stout
Great Lakes Brewing Company Oktoberfest,Great Lakes Brewing Company Great Lakes Oktoberfest
Great Lakes Brewing Company The Wright Pils,Great Lakes Brewing Company Great Lakes The Wright Pils
Green Flash Brewing Co. Hop Head Red Ale,Green Flash Brewing Co. Green Flash Hop Head Red Ale
Green Flash Brewing Co. Trippel,Green Flash Brewing Co. Green Flash Trippel
Green Flash Brewing Co. West Coast IPA,Green Flash Brewing Co. Green Flash West Coast I.P.A.
Green Man Brewery ESB,Green Man Brewery Green Man ESB
Green Man Brewery India Pale Ale,Green Man Brewery Green Man India Pale Ale
Green Man Brewery Porter,Green Man Brewery Green Man Porter
Green Valley Brewing Company (Crooked Creek) Stone Mill Organic Pale AleGreen Valley Brewing Company (Crooked Creek),Green Valley Brewing Company (Crooked Creek) Stone Mill Organic Pale Ale
Green Valley Brewing Company (Crooked Creek) Wild Hop Organic Amber LagerGreen Valley Brewing Company (Crooked Creek),Green Valley Brewing Company (Crooked Creek) Wild Hop Organic Amber Lager
Green's Gluten Free Beers Green's Endeavour Dubbel Dark Ale,Green's Gluten Free Beers Green's Endeavour
Gritty McDuff's Brewing Company Best Bitter,Gritty McDuff's Brewing Company Gritty McDuff's Best Bitter
Gritty McDuff's Brewing Company Black Fly Stout,Gritty McDuff's Brewing Company Gritty McDuff's Black Fly Stout
Gritty McDuff's Brewing Company Christmas Ale,Gritty McDuff's Brewing Company Gritty McDuff's Christmas Ale
Gritty McDuff's Brewing Company Halloween Ale,Gritty McDuff's Brewing Company Gritty McDuff's Halloween Ale
Gritty McDuff's Brewing Company Scottish Ale,Gritty McDuff's Brewing Company Gritty McDuff's Scottish Ale
Grupo Cruzcampo SA Cruzcampo Gran Reserva,Grupo Cruzcampo SA Cruzcampo Gran Reserve
Gubernija Brewery Duonos Gira Kvass,Gubernija Brewery Gubernija Duonos Gira Kvass
Gubernija Brewery Grand 9.5 Beer,Gubernija Brewery Gubernija Grand 9.5 Beer
Gueuzerie Tilquin Oude Gueuze Tilquin à L'Ancienne,Gueuzerie Tilquin Oude Gueuze Tilquin à L’Ancienne
Guinness Ltd. Guinness Draught Extra Cold,Guinness Ltd. Guinness Draught  Extra Cold
Guinness Ltd. Smithwick's Imported Premium Irish Ale,Guinness Ltd. Smithwick's
HaandBryggeriet Akevitt,HaandBryggeriet Akevitt Porter (Barrel-Aged Porter)
Hacker-Pschorr Bräu GmbH Hacker-Pschorr Munchner Kellerbier (Anno 1417),Hacker-Pschorr Bräu GmbH Hacker-Pschorr Anno 1417
Hacker-Pschorr Bräu GmbH Hacker-Pschorr Dunkel Weisse (Weisse Dark),Hacker-Pschorr Bräu GmbH Hacker-Pschorr Dunkle Weisse
Hacker-Pschorr Bräu GmbH Hacker-Pschorr Hefe Weisse Naturtrüb,Hacker-Pschorr Bräu GmbH Hacker-Pschorr Hefe Weisse Natürtrub
Hacker-Pschorr Bräu GmbH Hacker-Pschorr Oktoberfest Märzen,Hacker-Pschorr Bräu GmbH Hacker-Pschorr Oktoberfest-Märzen
Hanssens Artisanaal bvba Experimental Cassis,Hanssens Artisanaal bvba Hanssens Experimental Cassis
Hanssens Artisanaal bvba Experimental Raspberry,Hanssens Artisanaal bvba Hanssens Experimental Raspberry
Hanssens Artisanaal bvba Oudbeitje,Hanssens Artisanaal bvba Oudbeitje Lambic
Harpoon Brewery Harpoon Dark,Harpoon Brewery Barrel Aged Munich Dark
Harpoon Brewery Octoberfest Beer,Harpoon Brewery Catamount Octoberfest Beer
Harpoon Brewery Chocolate Stout,Harpoon Brewery Harpoon Chocolate Stout
Harpoon Brewery IPA,Harpoon Brewery Harpoon IPA
Harpoon Brewery Winter Warmer,Harpoon Brewery Harpoon Winter Warmer
Harviestoun Brewery Ltd. Old Engine Oil Black Ale,Harviestoun Brewery Ltd. Old Engine Oil
Heavy Seas Beer Peg Leg Imperial Stout,Heavy Seas Beer Heavy Seas - Peg Leg (Imperial Stout)
Heavy Seas Beer The Great’ER Pumpkin,Heavy Seas Beer Heavy Seas - The Great Pumpkin
Heavy Seas Beer Yule Tide (2015+),Heavy Seas Beer Heavy Seas - Yule Tide
Heineken Nederland B.V. Buckler Non-Alcoholic Brew,Heineken Nederland B.V. Buckler 0%
Highland Brewing Black Mocha Stout,Highland Brewing Highland Black Mocha Stout
Highland Brewing Gaelic Ale,Highland Brewing Highland Gaelic Ale
Highland Brewing Oatmeal Porter,Highland Brewing Highland Oatmeal Porter
Highland Brewing Thunderstruck Coffee Porter,Highland Brewing Highland Thunderstruck Coffee Porter
"Hijos De Rivera, S.A. Estrella Galicia Especial","Hijos De Rivera, S.A. Estrella Galicia"
Hill Farmstead Brewery Abner,Hill Farmstead Brewery Abner Imperial IPA
Hill Farmstead Brewery Clara Grisette,Hill Farmstead Brewery Clara
Hill Farmstead Brewery Earl Coffee Oatmeal Stout,Hill Farmstead Brewery Earl Oatmeal Coffee Stout
Hill Farmstead Brewery Edward,Hill Farmstead Brewery Edward Pale Ale
Hill Farmstead Brewery Everett Porter,Hill Farmstead Brewery Everett Robust Porter
Hill Farmstead Brewery Holger Danske (with Kissmeyer),Hill Farmstead Brewery Holger Danske
Hofbrauhaus Freising Jägerbier Export Hell,Hofbrauhaus Freising Jägerbier Natürtrub Export Hell
Hofbrauhaus Wolters GmbH Wolters Pilsener,Hofbrauhaus Wolters GmbH Wolters Pilsener Premium
Hook Norton Brewery Co. Ltd. Hooky Bitter,Hook Norton Brewery Co. Ltd. Hooky  Bitter
Hoppin' Frog Brewery B.O.R.I.S. The Crusher,Hoppin' Frog Brewery B.O.R.I.S. The Crusher Oatmeal-Imperial Stout
Hoppin' Frog Brewery B.O.R.I.S. Oatmeal Imperial Stout - Barrel-Aged,Hoppin' Frog Brewery Barrel Aged B.O.R.I.S. Oatmeal Imperial Stout
Hoppin' Frog Brewery Frosted Frog Christmas Ale - Barrel-Aged,Hoppin' Frog Brewery Barrel Aged Frosted Frog Christmas Ale
Hoppin' Frog Brewery D.O.R.I.S. The Destroyer,Hoppin' Frog Brewery D.O.R.I.S. The Destroyer Double Imperial Stout
Hövels Hausbrauerei Hövels Original,Hövels Hausbrauerei Hövels Original Bitterbier
Hudepohl-Schoenling Brewing Co. Hudepohl Amber Lager,Hudepohl-Schoenling Brewing Co. Amber Lager
Innis & Gunn Original Oak Aged Beer,Innis & Gunn Innis And Gunn Oak Aged Beer
Ipswich Ale Brewery Ipswich Original Pale Ale,Ipswich Ale Brewery Ipswich Original Ale
Iron Horse Brewery Double Rainbow,Iron Horse Brewery Double Rainbow Ale
Isle Of Skye Brewery Skye Black,Isle Of Skye Brewery Black Cuillin
Ithaca Beer Company CascaZilla,Ithaca Beer Company Cascazilla
J.W. Lees & Co (Brewers) Ltd J.W. Lees Harvest Ale (Calvados Cask)J.W. Lees & Co (Brewers) Ltd,J.W. Lees & Co (Brewers) Ltd J.W. Lees Harvest Ale (Calvados Cask)
J.W. Lees & Co (Brewers) Ltd J.W. Lees Harvest Ale (Lagavulin Whisky Cask)J.W. Lees & Co (Brewers) Ltd,J.W. Lees & Co (Brewers) Ltd J.W. Lees Harvest Ale (Lagavulin Whisky Cask)
J.W. Lees & Co (Brewers) Ltd J.W. Lees Harvest Ale (Port Cask)J.W. Lees & Co (Brewers) Ltd,J.W. Lees & Co (Brewers) Ltd J.W. Lees Harvest Ale (Port Cask)
J.W. Lees & Co (Brewers) Ltd J.W. Lees Harvest Ale (Sherry Cask)J.W. Lees & Co (Brewers) Ltd,J.W. Lees & Co (Brewers) Ltd J.W. Lees Harvest Ale (Sherry Cask)
J.W. Lees & Co (Brewers) Ltd Manchester Star AleJ.W. Lees & Co (Brewers) Ltd,J.W. Lees & Co (Brewers) Ltd Manchester Star Ale
J.W. Lees & Co (Brewers) Ltd Moonraker AleJ.W. Lees & Co (Brewers) Ltd,J.W. Lees & Co (Brewers) Ltd Moonraker Ale
Jackie O's Pub & Brewery Berliner Weisse,Jackie O's Pub & Brewery Berliner Weiss
Jack's Abby Brewing Copper Legend Octoberfest,Jack's Abby Brewing Copper Legend
Jack's Abby Brewing Kiwi Rising - Double IPL,Jack's Abby Brewing Kiwi Rising
Jacob Leinenkugel Brewing Company Berry Weiss,Jacob Leinenkugel Brewing Company Leinenkugel's Berry Weiss
Jacob Leinenkugel Brewing Company Creamy Dark,Jacob Leinenkugel Brewing Company Leinenkugel's Creamy Dark
Jacob Leinenkugel Brewing Company Honey Weiss,Jacob Leinenkugel Brewing Company Leinenkugel's Honey Weiss
Jacob Leinenkugel Brewing Company Oktoberfest,Jacob Leinenkugel Brewing Company Leinenkugel's Oktoberfest
Jacob Leinenkugel Brewing Company Original,Jacob Leinenkugel Brewing Company Leinenkugel's Original
Jacob Leinenkugel Brewing Company Red Lager,Jacob Leinenkugel Brewing Company Leinenkugel's Red
Jacob Leinenkugel Brewing Company Summer Shandy,Jacob Leinenkugel Brewing Company Leinenkugel's Summer Shandy
Jester King Craft Brewery Black Metal Farmhouse Imperial Stout,Jester King Craft Brewery Black Metal Imperial Stout
Jester King Craft Brewery Das Wunderkind!,Jester King Craft Brewery Das Wunderkind
John Martin's (John Martin SA) Gordon Finest GoldJohn Martin's (John Martin SA),John Martin's (John Martin SA) Gordon Finest Gold
Jolly Pumpkin Artisan Ales La Roja Du Kriek,Jolly Pumpkin Artisan Ales Roja De Kriek
Jopen Bier BV Haarlem Bokbier,Jopen Bier BV Haarlem Jopen Bokbier
Jopen Bier BV Haarlem Extra Stout,Jopen Bier BV Haarlem Jopen Extra Stout
Jopen Bier BV Haarlem Koyt,Jopen Bier BV Haarlem Jopen Koyt
JOS. Schlitz Brewing Co. (Pabst) Schlitz (Classic 1960's Formula)JOS. Schlitz Brewing Co. (Pabst),JOS. Schlitz Brewing Co. (Pabst) Schlitz Gusto (Classic 1960's Formula)
JOS. Schlitz Brewing Co. (Pabst) Schlitz High Gravity V.S.L Very Smooth LagerJOS. Schlitz Brewing Co. (Pabst),JOS. Schlitz Brewing Co. (Pabst) Schlitz High Gravity V.S.L Very Smooth Lager
JOS. Schlitz Brewing Co. (Pabst) Schlitz Red Bull X. L. Xtra Long Malt LiquorJOS. Schlitz Brewing Co. (Pabst),JOS. Schlitz Brewing Co. (Pabst) Schlitz Red Bull X. L. Xtra Long Malt Liquor
Kaltenberg International / König Ludwig International GmbH & Co.KG König Ludwig Weiss,Kaltenberg International / König Ludwig International GmbH & Co.KG Konig Ludwig Hell
Keegan Ales Mother's Milk Stout,Keegan Ales Mothers Milk Stout
Kiuchi Brewery Hitachino Nest Real Ginger Ale,Kiuchi Brewery Hitachino Nest Real Ginger Brew
Kiuchi Brewery Hitachino Nest Ancient Nipponia,Kiuchi Brewery Hitachino Nipponia
Klosterbrauerei Andechs Andechser Export Dunkel,Klosterbrauerei Andechs Andechser Dunkel
Klosterbrauerei Andechs Andechs Weissbier Dunkel,Klosterbrauerei Andechs Andechser Dunkles Weissbier
Klosterbrauerei Ettal / Ettaler Klosterbetriebe GmbH Benediktiner Weissbier,Klosterbrauerei Ettal / Ettaler Klosterbetriebe GmbH Ettaler Benediktiner Weizen
Klosterbrauerei Ettal / Ettaler Klosterbetriebe GmbH Ettaler Curator Dunkler Doppelbock (US Import Version),Klosterbrauerei Ettal / Ettaler Klosterbetriebe GmbH Ettaler Curator Doppelbock (US Import Version)
Klosterbrauerei Ettal / Ettaler Klosterbetriebe GmbH Benediktiner Weissbier Dunkel,Klosterbrauerei Ettal / Ettaler Klosterbetriebe GmbH Ettaler Weißbier Dunkel
Köstritzer Schwarzbierbrauerei GmbH & Co. Schwarzbier,Köstritzer Schwarzbierbrauerei GmbH & Co. Köstritzer Schwarzbier
Kuhnhenn Brewing Company Aldebaran,Kuhnhenn Brewing Company Kuhnhenn Aldebaran
Kuhnhenn Brewing Company Bourbon Barrel-Aged Barley Wine,Kuhnhenn Brewing Company Kuhnhenn Bourbon Barrel Barley Wine
Kuhnhenn Brewing Company Fourth Dementia - Bourbon Barrel-Aged,Kuhnhenn Brewing Company Kuhnhenn Bourbon Barrel Fourth Dementia
Kuhnhenn Brewing Company Braggot,Kuhnhenn Brewing Company Kuhnhenn Braggot
Kuhnhenn Brewing Company Cherry Oud Bruin,Kuhnhenn Brewing Company Kuhnhenn Cherry Olde Brune
Kuhnhenn Brewing Company Crème Brûlée Java Stout,Kuhnhenn Brewing Company Kuhnhenn Crème Brûlée Java Stout
Kuhnhenn Brewing Company Dark Heathen Triple Bock,Kuhnhenn Brewing Company Kuhnhenn Dark Heathen Triple Bock
Kuhnhenn Brewing Company Raspberry Eisbock,Kuhnhenn Brewing Company Kuhnhenn Eisbock
Kuhnhenn Brewing Company Foreign Export Stout,Kuhnhenn Brewing Company Kuhnhenn Foreign Export Stout
Kuhnhenn Brewing Company Fourth Dementia (4D),Kuhnhenn Brewing Company Kuhnhenn Fourth Dementia (4D)
Kuhnhenn Brewing Company Heather Ale,Kuhnhenn Brewing Company Kuhnhenn Heather Ale
Kuhnhenn Brewing Company Penetration Porter,Kuhnhenn Brewing Company Kuhnhenn Penetration Porter
Kuhnhenn Brewing Company Simcoe Silly,Kuhnhenn Brewing Company Kuhnhenn Simcoe Silly
Kuhnhenn Brewing Company Winter Wonder Lager,Kuhnhenn Brewing Company Kuhnhenn Winter Wonder Lager
Kulmbacher Brauerei AG Mönchshof Kellerbier,Kulmbacher Brauerei AG Mönchshof Kellerbier (Kellerbräu)
Labatt Brewing Company Ltd. Labatt Max Ice,Labatt Brewing Company Ltd. Labatt Ice
Lagunitas Brewing Company Imperial Stout,Lagunitas Brewing Company Black Rain Imperial Stout
Lagunitas Brewing Company The Hairy Eyeball,Lagunitas Brewing Company Hairy Eyeball Ale
Lagunitas Brewing Company Lucky 13 Mondo Large Red Ale,Lagunitas Brewing Company Lagunitas Lucky 13 Mondo Large Red Ale
Lagunitas Brewing Company PILS (Czech Style Pilsner),Lagunitas Brewing Company Lagunitas PILS (Czech Style Pilsner)
Lagunitas Brewing Company Lagunitas Sucks,Lagunitas Brewing Company Lagunitas Sucks Holiday Ale
Lagunitas Brewing Company New DogTown Pale Ale,Lagunitas Brewing Company New Dogtown Pale Ale
Lagunitas Brewing Company The Waldos' Special Ale,Lagunitas Brewing Company Waldos' Special Ale
Lake Louie Brewery Company Warped Speed Scotch Ale,Lake Louie Brewery Company Lake Louie Warped Speed Scotch Ale
"Lakefront Brewery, Inc. Pumpkin Lager","Lakefront Brewery, Inc. Pumpkin Lager Beer"
Lancaster Brewing Company Shoo-Fly Pie Porter,Lancaster Brewing Company Porter
Laughing Dog Brewing Anubis,Laughing Dog Brewing Anubis Imperial Coffee Porter
Lawson's Finest Liquids Double Sunshine,Lawson's Finest Liquids Double Sunshine IPA
Lawson's Finest Liquids Permagrin,Lawson's Finest Liquids Permagrin Rye Pale Ale
Lech Browary Wielkopolski (SABMiller) Lech PremiumLech Browary Wielkopolski (SABMiller),Lech Browary Wielkopolski (SABMiller) Lech Premium
Left Hand Brewing Company Fade To Black - Volume 1,Left Hand Brewing Company Fade To Black Volume 1 - Foreign Export Stout
Left Hand Brewing Company Good Juju,Left Hand Brewing Company Good Juju (Ginger Ale)
Left Hand Brewing Company Milk Stout,Left Hand Brewing Company Left Hand Milk Stout
Left Hand Brewing Company Oktoberfest,Left Hand Brewing Company Left Hand Oktoberfest
Left Hand Brewing Company Sawtooth,Left Hand Brewing Company Sawtooth Ale
Les Brasseurs de Gayant La Goudale,Les Brasseurs de Gayant Goudale
Les Trois Mousquetaires Grande Cuvée Porter Baltique,Les Trois Mousquetaires Les Trois Mousquetaires Porter Baltique
Live Oak Brewing Company Big Bark Amber Lager,Live Oak Brewing Company Live Oak Big Bark Amber Lager
Live Oak Brewing Company HefeWeizen,Live Oak Brewing Company Live Oak HefeWeizen
Live Oak Brewing Company Smoaktoberfest,Live Oak Brewing Company Live Oak Oaktoberfest
Live Oak Brewing Company Pilz,Live Oak Brewing Company Live Oak Pilz
Live Oak Brewing Company Primus Weizenbock,Live Oak Brewing Company Live Oak Primus Weizenbock
Live Oak Brewing Company Roggenbier,Live Oak Brewing Company Live Oak Roggenbier
Local Option Mourning Wood,Local Option Morning Wood
Lonerider Brewing Shotgun Betty Hefeweizen Ale,Lonerider Brewing Shotgun Betty
Magic Hat Brewing Company Circus Boy The Hefeweizen!,Magic Hat Brewing Company Circus Boy
Magic Hat Brewing Company Single Chair Golden Ale,Magic Hat Brewing Company Single Chair Ale
Mahrs-Bräu Bock-Bier,Mahrs-Bräu Mahr's Bock-Bier
Mahrs-Bräu Christmas Bock,Mahrs-Bräu Mahr's Christmas Bock
Maine Beer Company Peeper,Maine Beer Company Peeper Ale
Marin Brewing Company Star Brew-Triple Wheat Ale,Marin Brewing Company Marin Star Brew-Triple Wheat Ale
Marin Brewing Company San Quentin's Breakout Stout,Marin Brewing Company San Quentin Breakout Stout
Maritime Pacific Brewing Company Jolly Roger Christmas Ale,Maritime Pacific Brewing Company Maritime Pacific Jolly Roger Christmas Ale
Market Street Brewing Co. and Restaurant D'Artagnan Dark British Ale,Market Street Brewing Co. and Restaurant Market Street D'Artagnan Dark British Ale
Marshall Wharf Brewing Company / Three Tides Restaurant Deep Purple Rauchbier,Marshall Wharf Brewing Company / Three Tides Restaurant Deep Purple
Marshall Wharf Brewing Company / Three Tides Restaurant Illegal Ale-Ien,Marshall Wharf Brewing Company / Three Tides Restaurant Illegal Ale-ien
Matt Brewing Company Saranac Black Forest Black Beer,Matt Brewing Company Saranac Black Forest
Matt Brewing Company Saranac Long John Lager,Matt Brewing Company Saranac Lager
Matt Brewing Company Saranac American Pale Ale,Matt Brewing Company Saranac Pale Ale
Matt Brewing Company Saranac Rauchbier Smoked Lager,Matt Brewing Company Saranac Rauchbier
Maui Brewing Co. Coconut Hiwa Porter,Maui Brewing Co. CoCoNut Porter
Maui Brewing Co. Pineapple Mana Wheat,Maui Brewing Co. Mana Wheat
Mayflower Brewing Company Golden Ale,Mayflower Brewing Company Mayflower Golden Ale
Mayflower Brewing Company Pale Ale,Mayflower Brewing Company Mayflower Pale Ale
Mayflower Brewing Company Porter,Mayflower Brewing Company Mayflower Porter
Mayflower Brewing Company Thanksgiving Ale,Mayflower Brewing Company Mayflower Thanksgiving Ale
McNeill's Brewery Dead Horse IPA,McNeill's Brewery McNeill's Dead Horse IPA
Midtfyns Bryghus Chili Tripel,Midtfyns Bryghus Midtfyns Chili Tripel
Mikkeller ApS Vesterbro Spontanale,Mikkeller ApS Spontanale
Mill Street Brew Pub Cobblestone Stout,Mill Street Brew Pub Mill Street Cobblestone Stout
Mill Street Brew Pub Lemon Tea Ale,Mill Street Brew Pub Mill Street Lemon Tea Ale
Mill Street Brew Pub Original Organic Lager,Mill Street Brew Pub Mill Street Original Organic Lager
Mill Street Brew Pub Schleimhammer Roggenbier,Mill Street Brew Pub Mill Street Schleimhammer Roggenbier
Mill Street Brew Pub Vanilla Porter,Mill Street Brew Pub Mill Street Vanilla Porter
Mill Street Brew Pub Weizenbock,Mill Street Brew Pub Mill Street Weizenbock
Miller Brewing Co. Miller Genuine Draft 64,Miller Brewing Co. Miller Genuine Draft Light 64
Miller Brewing Co. Milwaukee's Best,Miller Brewing Co. Milwaukee's Best Dry
Millstream Brewing Company Schild Brau Amber,Millstream Brewing Company Millstream Schild Brau Amber
Millstream Brewing Company Schokolade Bock,Millstream Brewing Company Millstream Schokolade Bock
Minneapolis Town Hall Brewery Dortmunder Local Export Lager,Minneapolis Town Hall Brewery Dortmunder Lager
Moat Mountain Smoke House & Brewing Co. Bone Shaker Brown,Moat Mountain Smoke House & Brewing Co. Moat Brown
Moat Mountain Smoke House & Brewing Co. Czech Pilsner,Moat Mountain Smoke House & Brewing Co. Moat Czech Pilsner
Moat Mountain Smoke House & Brewing Co. Smoke House Porter,Moat Mountain Smoke House & Brewing Co. Moat Smoke House Porter
Moat Mountain Smoke House & Brewing Co. Square Tail Stout,Moat Mountain Smoke House & Brewing Co. Moat Stout
Molson Coors Canada Molson Brador,Molson Coors Canada Brador
Monastyrskiy Kvas Monastyrskiy Okroshka Kvass (Монастырский Окрошка Квас),Monastyrskiy Kvas Monastyrskiy Okroshka Kvas
Moonlight Brewing Company Death & Taxes,Moonlight Brewing Company Death & Taxes Black Beer
Moorhouse's Brewery (Burnley) Ltd Black CatMoorhouse's Brewery (Burnley) Ltd,Moorhouse's Brewery (Burnley) Ltd Black Cat
Moosehead Breweries Ltd. Lager,Moosehead Breweries Ltd. Alpine Lager
Moylan's Brewery Dragoon's Irish Dry Stout,Moylan's Brewery Moylans Dragoons Dry Irish Stout
Murphy Brewery Ireland Limited Murphy's Irish Red,Murphy Brewery Ireland Limited Murphy's Irish Red Beer
Muskoka Brewery Cream Ale,Muskoka Brewery Dry Hopped Cream Ale
Narragansett Brewing Co. Fest Märzen Lager,Narragansett Brewing Co. Narragansett Fest
Nebraska Brewing Company HopAnomaly - Reserve Series Aged In French Oak Chardonnay Barrels,Nebraska Brewing Company Hop God Reserve Series Aged In French Oak Chardonnay Barrels
Nebraska Brewing Company Melange A Trois - Reserve Series Aged In French Oak Chardonnay Barrels,Nebraska Brewing Company Melange A Trois Reserve Series Aged In French Oak Chardonnay Barrels
Nebraska Brewing Company Brunette Nut Brown Ale,Nebraska Brewing Company NBC Brunette Nut Brown Ale
Nelson Brewing Company After Dark,Nelson Brewing Company After Dark Mild
New Belgium Brewing 1554,New Belgium Brewing 1554 Enlightened Black Ale
New Belgium Brewing Abbey,New Belgium Brewing Abbey Belgian Style Ale
New Belgium Brewing Mothership Wit,New Belgium Brewing Mothership Wit (Organic Wheat Beer)
"New Belgium Brewing Tart Lychee, Tropical Sour",New Belgium Brewing Tart Lychee
New Belgium Brewing Trippel,New Belgium Brewing Trippel Grand Cru
New England Brewing Co. 668 Neighbor Of The Beast,New England Brewing Co. 668 The Neighbor Of The Beast
New Glarus Brewing Company Thumbprint Apple Ale,New Glarus Brewing Company Apple Ale
New Glarus Brewing Company Dancing Man,New Glarus Brewing Company Dancing Man Wheat
New Glarus Brewing Company Hometown Blonde,New Glarus Brewing Company Home Town Blonde
New Glarus Brewing Company Moon Man No Coast Pale Ale,New Glarus Brewing Company Moon Man
New Holland Brewing Company Pilgrim's Dole,New Holland Brewing Company Bourbon Barrel Aged Pilgrim's Dole
New Holland Brewing Company Black Hatter,New Holland Brewing Company New Holland Black Hatter
New Holland Brewing Company El Mole Ocho,New Holland Brewing Company New Holland El Mole Ocho
New Holland Brewing Company Full Circle,New Holland Brewing Company New Holland Full Circle
New Holland Brewing Company Ichabod Ale,New Holland Brewing Company New Holland Ichabod Ale
New Holland Brewing Company The Poet,New Holland Brewing Company New Holland The Poet
New Orleans Lager & Ale Brewing Company (NOLA) Irish Channel StoutNew Orleans Lager & Ale Brewing Company (NOLA),New Orleans Lager & Ale Brewing Company (NOLA) Irish Channel Stout
New Orleans Lager & Ale Brewing Company (NOLA) NOLA Blonde AleNew Orleans Lager & Ale Brewing Company (NOLA),New Orleans Lager & Ale Brewing Company (NOLA) NOLA Blonde Ale
New Orleans Lager & Ale Brewing Company (NOLA) Smoky MaryNew Orleans Lager & Ale Brewing Company (NOLA),New Orleans Lager & Ale Brewing Company (NOLA) Smoky Mary
Nøgne Ø - Det Kompromissløse Bryggeri A/S Special Holiday Ale,Nøgne Ø - Det Kompromissløse Bryggeri A/S Special Holiday Ale - Nøgne Ø/Jolly Pumpkin Artisan Ales/Stone Brewing Co.
North Coast Brewing Co. Old Rasputin,North Coast Brewing Co. Old Rasputin XI
North Coast Brewing Co. Red Seal Ale,North Coast Brewing Co. Ruedrich's Red Seal Ale
Notch Brewing Black Lager (Černé Pivo),Notch Brewing Notch Černé Pivo
Notch Brewing Session Pils,Notch Brewing Notch Session Pils
O'Connor Brewing Co. El Guapo Agave IPA,O'Connor Brewing Co. El Guapo IPA
Odell Brewing Company IPA,Odell Brewing Company British IPA
Odell Brewing Company Easy Street Wheat,Odell Brewing Company Chili Easy Street Wheat
Odell Brewing Company 90 Shilling,Odell Brewing Company Oak Aged 90 Shilling
Odell Brewing Company Cutthroat,Odell Brewing Company Odell Cutthroat Pale Ale
Odell Brewing Company Extra Special Red,Odell Brewing Company Odell Extra Special Red Ale
O'Fallon Brewery Pumpkin Beer,O'Fallon Brewery Pumpkin Ale
O'Fallon Brewery Smoked Porter,O'Fallon Brewery Smoke (Smoked Porter)
Old Forge Brewing Company Celestial Blonde Ale,Old Forge Brewing Company Celestial Blond Ale
Omnipollo Levon,Omnipollo Leon
Orkney Brewery Skull Splitter,Orkney Brewery SkullSplitter
Orkney Brewery Red MacGregor,Orkney Brewery The Red MacGregor
Oskar Blues Grill & Brew G'Knight,Oskar Blues Grill & Brew G'Knight Imperial Red Ale
Oskar Blues Grill & Brew Gubna,Oskar Blues Grill & Brew GUBNA Imperial IPA
Oskar Blues Grill & Brew Ten FIDY - Bourbon Barrel Aged,Oskar Blues Grill & Brew Ten Fidy (Oak-Aged)
Otter Creek Brewing / Wolaver's Otter Creek Fresh Slice,Otter Creek Brewing / Wolaver's Otter Creek Solstice
Pabst Brewing Company Pabst Blue Ribbon Non-Alcoholic,Pabst Brewing Company Pabst Non-Alcoholic
Palmetto Brewing Company Aftershock,Palmetto Brewing Company Palmetto Aftershock
Panil Barriquée (Italy Version),Panil Panil Barriquée (Italy Version)
Panil Barriquée (Sour Version),Panil Panil Barriquée (Sour Version)
Panil  Divina,Panil Panil Divina
Paulaner Brauerei GmbH & Co. KG Hefe-Weissbier Alkoholfrei,Paulaner Brauerei GmbH & Co. KG Paulaner Hefe-Weissbier Alkoholfrei
