Beer Name (Full),matches
(512) Brewing Company (512) Pecan Porter(512) Brewing Company,(512) Brewing Company (512) Pecan Porter
(512) Brewing Company (512) Whiskey Barrel Aged Double Pecan Porter(512) Brewing Company,(512) Brewing Company (512) Whiskey Barrel Aged Double Pecan Porter
Žatecký Pivovar Žatec Dark Lager,Žatecký Pivovar Žatec Dark Lager
21st Amendment Brewery Brew Free Or Die IPA,21st Amendment Brewery 21st Amendment IPA
21st Amendment Brewery Lower De Boom Barleywine,21st Amendment Brewery Lower Da Boom Barleywine
Abita Brewing Co. Pecan Ale,Abita Brewing Co. Pecan Harvest Ale
Abita Brewing Co. Strawberry Lager,Abita Brewing Co. Strawberry Harvest Lager
AC Golden Brewing Company Colorado Native Amber Lager,AC Golden Brewing Company Colorado Native Lager
Alaskan Brewing Co. Amber,Alaskan Brewing Co. Alaskan Amber
Alaskan Brewing Co. Heritage Coffee Brown Ale,Alaskan Brewing Co. Alaskan Heritage Coffee Brown Ale
Alaskan Brewing Co. Smoked Porter,Alaskan Brewing Co. Alaskan Smoked Porter
Alaskan Brewing Co. Stout,Alaskan Brewing Co. Alaskan Stout
Alaskan Brewing Co. White,Alaskan Brewing Co. Alaskan White
Alaskan Brewing Co. Winter Ale,Alaskan Brewing Co. Alaskan Winter Ale
Ale Asylum Madtown Nutbrown,Ale Asylum Mad Town Nut Brown
AleSmith Brewing Company Evil Dead Red,AleSmith Brewing Company AleSmith Evil Dead Red
AleSmith Brewing Company Grand Cru,AleSmith Brewing Company AleSmith Grand Cru Ale
AleSmith Brewing Company Horny Devil,AleSmith Brewing Company AleSmith Horny Devil
AleSmith Brewing Company IPA,AleSmith Brewing Company AleSmith IPA
AleSmith Brewing Company Lil' Devil,AleSmith Brewing Company AleSmith Lil' Devil
AleSmith Brewing Company My Bloody Valentine,AleSmith Brewing Company AleSmith My Bloody Valentine
AleSmith Brewing Company Nut Brown Ale,AleSmith Brewing Company AleSmith Nautical Nut Brown Ale
AleSmith Brewing Company Old Numbskull,AleSmith Brewing Company AleSmith Old Numbskull
AleSmith Brewing Company Speedway Stout,AleSmith Brewing Company AleSmith Speedway Stout
AleSmith Brewing Company Wee Heavy,AleSmith Brewing Company AleSmith Wee Heavy
AleSmith Brewing Company Anvil,AleSmith Brewing Company Anvil Ale ESB
AleSmith Brewing Company Old Numbskull - Bourbon Barrel-Aged,AleSmith Brewing Company AleSmith Old Numbskull - Barrel Aged
AleSmith Brewing Company Speedway Stout - Bourbon Barrel-Aged,AleSmith Brewing Company AleSmith Speedway Stout - Barrel Aged
AleSmith Brewing Company Speedway Stout - Vietnamese Coffee,AleSmith Brewing Company AleSmith Speedway Stout - Vietnamese Coffee
AleSmith Brewing Company Wee Heavy - Barrel-Aged,AleSmith Brewing Company AleSmith Wee Heavy - Barrel Aged
Alexander Keith's India Pale Ale,Alexander Keith's Alexander Keith's India Pale Ale
Allagash Brewing Company Black,Allagash Brewing Company Allagash Black
Allagash Brewing Company Confluence Ale,Allagash Brewing Company Allagash Confluence Ale
Allagash Brewing Company Coolship Cerise,Allagash Brewing Company Allagash Coolship Cerise
Allagash Brewing Company Coolship Red,Allagash Brewing Company Allagash Coolship Red
Allagash Brewing Company Coolship Resurgam,Allagash Brewing Company Allagash Coolship Resurgam
Allagash Brewing Company Dubbel Ale,Allagash Brewing Company Allagash Dubbel Ale
Allagash Brewing Company Grand Cru,Allagash Brewing Company Allagash Grand Cru
Allagash Brewing Company Hugh Malone,Allagash Brewing Company Allagash Hugh Malone
Allagash Brewing Company Interlude,Allagash Brewing Company Allagash Interlude
Allagash Brewing Company Tripel Ale,Allagash Brewing Company Allagash Tripel Ale
Allagash Brewing Company Victor Ale,Allagash Brewing Company Allagash Victor Ale
Allagash Brewing Company Victoria Ale,Allagash Brewing Company Allagash Victoria Ale
Allagash Brewing Company White,Allagash Brewing Company Allagash White
Alltech’s Lexington Brewing and Distilling Co. Kentucky Vanilla Barrel Cream Ale,Alltech’s Lexington Brewing and Distilling Co. Kentucky Cream Ale
Alpine Beer Company Duet,Alpine Beer Company Duet IPA
Anaheim Brewery 1888,Anaheim Brewery 1888.0
Anchor Brewing Company Old Foghorn,Anchor Brewing Company Anchor Old Foghorn
Anchorage Brewing Company Citra Bitter Monk,Anchorage Brewing Company Bitter Monk
Anderson Valley Brewing Company Belk's ESB,Anderson Valley Brewing Company Boont ESB
Anderson Valley Brewing Company Summer Solstice,Anderson Valley Brewing Company Summer Solstice Cerveza Crema
Anheuser-Busch Hurricane Malt Liquor,Anheuser-Busch Hurricane
Anheuser-Busch Michelob AmberBock,Anheuser-Busch Michelob Amber Bock
Anheuser-Busch Michelob Dunkel Weisse,Anheuser-Busch Michelob DunkelWeisse
Anheuser-Busch Michelob Ultra Lime & Prickly Pear Cactus,Anheuser-Busch Michelob Ultra Lime Cactus
Anheuser-Busch Michelob Ultra Fruit Pomegranate Raspberry,Anheuser-Busch Michelob Ultra Pomegranate Raspberry
Anheuser-Busch Natty Daddy (8%),Anheuser-Busch Natty Daddy
Arcadia Brewing Company Angler's Ale,Arcadia Brewing Company Arcadia Angler's Ale
Arcadia Brewing Company B-Craft Black,Arcadia Brewing Company Arcadia B-Craft Black IPA
Arcadia Brewing Company Big Dick's Olde Ale,Arcadia Brewing Company Arcadia Big Dick's Olde Ale
Arcadia Brewing Company Cocoa Loco,Arcadia Brewing Company Arcadia Cocoa Loco
Arcadia Brewing Company IPA,Arcadia Brewing Company Arcadia IPA
Arcadia Brewing Company Jaw-Jacker,Arcadia Brewing Company Arcadia Jaw-Jacker
Arcadia Brewing Company London Porter,Arcadia Brewing Company Arcadia London Porter
Arcadia Brewing Company Nut Brown Ale,Arcadia Brewing Company Arcadia Nut Brown Ale
Arcadia Brewing Company Shipwreck Porter - Bourbon Barrel-Aged,Arcadia Brewing Company Arcadia Shipwreck Porter
Arcadia Brewing Company Sky High Rye,Arcadia Brewing Company Arcadia Sky High Rye
Arcadia Brewing Company Whitsun Ale,Arcadia Brewing Company Arcadia Whitsun Ale
Arcense Stoombierbouwerij (Hertog Jan Brouwerij) Hertog Jan Grand PrestigeArcense Stoombierbouwerij (Hertog Jan Brouwerij),Arcense Stoombierbouwerij (Hertog Jan Brouwerij) Hertog Jan Grand Prestige
Asahi Breweries Ltd Asahi Dry Black,Asahi Breweries Ltd Asahi Honnama Clear Black
Asahi Breweries Ltd Asahi Dry Premium,Asahi Breweries Ltd Asahi Premium
Asahi Breweries Ltd Clear Sakura Beer,Asahi Breweries Ltd Clear Asahi
Atwater Block Brewery Bourbon Barrel Aged Shaman's Porter,Atwater Block Brewery Atwater Bourbon Barrel Aged Shaman's Porter
Atwater Block Brewery Maibock,Atwater Block Brewery Atwater Maibock
Atwater Block Brewery Vanilla Java Porter (VJP),Atwater Block Brewery Atwater Vanilla Java Porter
Atwater Block Brewery Voodoovator,Atwater Block Brewery Atwater Voodoovator
Atwater Block Brewery Winterbock,Atwater Block Brewery Atwater Winter Bock
August Schell Brewing Company Schell's Schmaltz's Alt,August Schell Brewing Company Barrel Aged Schmaltz's Alt
August Schell Brewing Company Schell's FireBrick,August Schell Brewing Company FireBrick
August Schell Brewing Company Schell's Oktoberfest,August Schell Brewing Company Oktoberfest
Austin Beerworks Pearl-Snap,Austin Beerworks Pearl Snap Pils
Avery Brewing Company Karma Belgian Style Pale Ale,Avery Brewing Company Karma
Aviator Brewing Company Hot Rod Red,Aviator Brewing Company HotRod Red
Ballast Point Brewing Company Barmy,Ballast Point Brewing Company Barmy Ale
Ballast Point Brewing Company Big Eye,Ballast Point Brewing Company Big Eye Double Ginger
Ballast Point Brewing Company Black Marlin,Ballast Point Brewing Company Black Marlin Porter
Ballast Point Brewing Company Dorado,Ballast Point Brewing Company Dorado Double IPA
Ballast Point Brewing Company Fathom IPL,Ballast Point Brewing Company Fathom India Pale Lager
Ballast Point Brewing Company Sculpin,Ballast Point Brewing Company Ghost Pepper Sculpin
Ballast Point Brewing Company Grunion Pale Ale,Ballast Point Brewing Company Pale Ale
Ballast Point Brewing Company Piper Down,Ballast Point Brewing Company Pepper Piper Down (Habanero)
Ballast Point Brewing Company Piper Down - Bourbon Barrel-Aged,Ballast Point Brewing Company Piper Down Scottish Ale (Bourbon Barrel Aged)
Ballast Point Brewing Company Sour Wench,Ballast Point Brewing Company Sour Wench Blackberry Ale
Ballast Point Brewing Company Victory At Sea - Barrel-Aged,Ballast Point Brewing Company Victory At Sea (Barrel Aged) Imperial Porter
Ballast Point Brewing Company Victory At Sea - Coffee And Vanilla,Ballast Point Brewing Company Victory At Sea Coffee Vanilla Imperial Porter
Ballast Point Brewing Company Wahoo White Beer,Ballast Point Brewing Company Wahoo Wheat Beer
Bayerische Staatsbrauerei Weihenstephan Original Alkoholfrei,Bayerische Staatsbrauerei Weihenstephan Weihenstephaner Alkoholfrei Original
Bayerische Staatsbrauerei Weihenstephan Original Helles,Bayerische Staatsbrauerei Weihenstephan Weihenstephaner Original
Bayerische Staatsbrauerei Weihenstephan Festbier,Bayerische Staatsbrauerei Weihenstephan Weihenstephaner Festbier
Bayerische Staatsbrauerei Weihenstephan Hefeweissbier,Bayerische Staatsbrauerei Weihenstephan Weihenstephaner Hefeweissbier
Bayerische Staatsbrauerei Weihenstephan Hefeweissbier Dunkel,Bayerische Staatsbrauerei Weihenstephan Weihenstephaner Hefeweissbier Dunkel
Bayerische Staatsbrauerei Weihenstephan Korbinian,Bayerische Staatsbrauerei Weihenstephan Weihenstephaner Korbinian
Bayerische Staatsbrauerei Weihenstephan Kristallweissbier,Bayerische Staatsbrauerei Weihenstephan Weihenstephaner Kristallweissbier
Bayerische Staatsbrauerei Weihenstephan Pils (Pilsner),Bayerische Staatsbrauerei Weihenstephan Weihenstephaner Pilsner
Bayerische Staatsbrauerei Weihenstephan Tradition,Bayerische Staatsbrauerei Weihenstephan Weihenstephaner Tradition
Bayerische Staatsbrauerei Weihenstephan Vitus,Bayerische Staatsbrauerei Weihenstephan Weihenstephaner Vitus
"Bayern Brewing, Inc. Dancing Trout Ale","Bayern Brewing, Inc. Bayern Dancing Trout Ale"
"Bayern Brewing, Inc. Dragon's Breath","Bayern Brewing, Inc. Bayern Dragon's Breath"
"Bayern Brewing, Inc. Face Plant","Bayern Brewing, Inc. Face Plant Doppelweizen"
Beacon Hotel (Sarah Hughes Brewery) Original Sarah Hughes Dark Ruby MildBeacon Hotel (Sarah Hughes Brewery),Beacon Hotel (Sarah Hughes Brewery) Original Sarah Hughes Dark Ruby Mild
Bear Republic Brewing Co. Peter Brown Tribute Ale,Bear Republic Brewing Co. Pete's Brown (Tribute Ale)
Beau's All Natural Brewing Company Bog Water,Beau's All Natural Brewing Company Bogwater
Beaver Brewing Company Roggenbier,Beaver Brewing Company Roggenator
Belhaven Brewery Company Ltd. McCallum's Stout,Belhaven Brewery Company Ltd. Belhaven McCallum's Stout
Belhaven Brewery Company Ltd. Scottish Ale,Belhaven Brewery Company Ltd. Belhaven Scottish Ale
Belhaven Brewery Company Ltd. Scottish Stout,Belhaven Brewery Company Ltd. Belhaven Scottish Stout
Berkshire Brewing Company Inc. River Guide,Berkshire Brewing Company Inc. River Ale
Bernard Family Brewery Bernard Cerne (Dark),Bernard Family Brewery Bernard Cerne
BFM Brasserie Des Franches-Montagnes Abbaye De Saint Bon-ChienBFM (Brasserie des Franches-Montagnes),BFM Brasserie Des Franches-Montagnes Abbaye De Saint Bon-Chien
BFM Brasserie Des Franches-Montagnes La MeuleBFM (Brasserie des Franches-Montagnes),BFM Brasserie Des Franches-Montagnes La Meule
Bierbrouwerij De Koningshoeven B.V. La Trappe Quadrupel - Oak-Aged,Bierbrouwerij De Koningshoeven B.V. La Trappe Quadrupel Barrique (Oak Aged)
Bières de Chimay S.A. Grande Réserve (Blue),Bières de Chimay S.A. Chimay Grande Réserve (Blue)
Bières de Chimay S.A. Première (Red),Bières de Chimay S.A. Chimay Première (Red)
Bières de Chimay S.A. Tripel (White),Bières de Chimay S.A. Chimay Tripel (White)
Big Boss Brewing Angry Angel,Big Boss Brewing Angry Angel Kolsch
Big Boss Brewing Bad Penny,Big Boss Brewing Bad Penny Brown Ale
Big Sky Brewing Company Ivan The Terrible Imperial Stout - Barrel-Aged,Big Sky Brewing Company Ivan The Terrible
Big Sky Brewing Company Montana Trout Slayer Wheat Ale,Big Sky Brewing Company Montana Trout Slayer Ale
Big Sky Brewing Company Olde Bluehair Barley Wine,Big Sky Brewing Company Olde Bluehair - Barrel Aged
Big Woods Brewing Co. Busted Knuckle Ale,Big Woods Brewing Co. Busted Knuckle Red Ale
Binding-Brauerei AG Schofferhofer Hefeweizen Grapefruit Bier,Binding-Brauerei AG Schofferhofer Grapefruit Hefeweizen
Birra Moretti (Heineken) Birra MorettiBirra Moretti (Heineken),Birra Moretti (Heineken) Birra Moretti
Bitburger Brauerei Alkoholfrei,Bitburger Brauerei Bitburger Alkoholfrei
Bitburger Brauerei Drive,Bitburger Brauerei Bitburger Drive
Bitburger Brauerei Premium Pils (Premium Beer),Bitburger Brauerei Bitburger Premium Pils
BJ's Chicago Pizza & Brewery Inc. Jeremiah Red Ale,BJ's Chicago Pizza & Brewery Inc. BJ's Jeremiah Red Ale
Blue Point Brewing Company Blueberry Ale,Blue Point Brewing Company Blue Point Blueberry
Blue Point Brewing Company White IPA,Blue Point Brewing Company Blue Point IPA
Blue Point Brewing Company Oktoberfest,Blue Point Brewing Company Blue Point Oktoberfest
Blue Point Brewing Company Old Howling Bastard,Blue Point Brewing Company Blue Point Old Howling Bastard
Blue Point Brewing Company RastafaRye Ale,Blue Point Brewing Company Blue Point Rastafa Rye Ale
Blue Point Brewing Company Summer Ale,Blue Point Brewing Company Blue Point Summer Ale
Blue Point Brewing Company Toasted Lager,Blue Point Brewing Company Blue Point Toasted Lager
Blue Point Brewing Company Toxic Sludge,Blue Point Brewing Company Blue Point Toxic Sludge
Blue Point Brewing Company Mother Pumpkin Ale,Blue Point Brewing Company Blue Point's Mother Pumpkin Ale
Borodino ZAO Brordinskiy Classical Kvass (Бородинский Классический Квас),Borodino ZAO Borodinskiy Kvas
Boston Beer Company (Samuel Adams) Griffin's BowBoston Beer Company (Samuel Adams),Boston Beer Company (Samuel Adams) Griffin's Bow
Boston Beer Company (Samuel Adams) Sam Adams LightBoston Beer Company (Samuel Adams),Boston Beer Company (Samuel Adams) Sam Adams Light
Boston Beer Company (Samuel Adams) Samuel Adams Black LagerBoston Beer Company (Samuel Adams),Boston Beer Company (Samuel Adams) Samuel Adams Black Lager
Boston Beer Company (Samuel Adams) Samuel Adams Blackberry WitbierBoston Beer Company (Samuel Adams),Boston Beer Company (Samuel Adams) Samuel Adams Blackberry Witbier
Boston Beer Company (Samuel Adams) Samuel Adams Boston Ale (Stock Ale)Boston Beer Company (Samuel Adams),Boston Beer Company (Samuel Adams) Samuel Adams Boston Ale (Stock Ale)
Boston Beer Company (Samuel Adams) Samuel Adams Boston LagerBoston Beer Company (Samuel Adams),Boston Beer Company (Samuel Adams) Samuel Adams Boston Lager
Boston Beer Company (Samuel Adams) Samuel Adams Brick RedBoston Beer Company (Samuel Adams),Boston Beer Company (Samuel Adams) Samuel Adams Brick Red
Boston Beer Company (Samuel Adams) Samuel Adams Cherry WheatBoston Beer Company (Samuel Adams),Boston Beer Company (Samuel Adams) Samuel Adams Cherry Wheat
Boston Beer Company (Samuel Adams) Samuel Adams Chocolate BockBoston Beer Company (Samuel Adams),Boston Beer Company (Samuel Adams) Samuel Adams Chocolate Bock
Boston Beer Company (Samuel Adams) Samuel Adams Cherry Chocolate BockBoston Beer Company (Samuel Adams),Boston Beer Company (Samuel Adams) Samuel Adams Chocolate Cherry Bock
Boston Beer Company (Samuel Adams) The Vixen Chocolate Chili BockBoston Beer Company (Samuel Adams),Boston Beer Company (Samuel Adams) Samuel Adams Chocolate Chili Bock
Boston Beer Company (Samuel Adams) Samuel Adams Coastal WheatBoston Beer Company (Samuel Adams),Boston Beer Company (Samuel Adams) Samuel Adams Coastal Wheat
Boston Beer Company (Samuel Adams) Samuel Adams Cranberry LambicBoston Beer Company (Samuel Adams),Boston Beer Company (Samuel Adams) Samuel Adams Cranberry Lambic
Boston Beer Company (Samuel Adams) Samuel Adams Cream StoutBoston Beer Company (Samuel Adams),Boston Beer Company (Samuel Adams) Samuel Adams Cream Stout
Boston Beer Company (Samuel Adams) Samuel Adams Double Bock (Imperial Series)Boston Beer Company (Samuel Adams),Boston Beer Company (Samuel Adams) Samuel Adams Double Bock (Imperial Series)
Boston Beer Company (Samuel Adams) Samuel Adams DunkelweizenBoston Beer Company (Samuel Adams),Boston Beer Company (Samuel Adams) Samuel Adams Dunkelweizen
Boston Beer Company (Samuel Adams) Samuel Adams East-West KölschBoston Beer Company (Samuel Adams),Boston Beer Company (Samuel Adams) Samuel Adams East-West Kölsch
Boston Beer Company (Samuel Adams) Samuel Adams Hallertau Imperial PilsnerBoston Beer Company (Samuel Adams),Boston Beer Company (Samuel Adams) Samuel Adams Hallertau Imperial Pilsner
Boston Beer Company (Samuel Adams) Samuel Adams Harvest Pumpkin AleBoston Beer Company (Samuel Adams),Boston Beer Company (Samuel Adams) Samuel Adams Harvest Pumpkin Ale
Boston Beer Company (Samuel Adams) Samuel Adams HefeweizenBoston Beer Company (Samuel Adams),Boston Beer Company (Samuel Adams) Samuel Adams Hefeweizen
Boston Beer Company (Samuel Adams) Samuel Adams Holiday PorterBoston Beer Company (Samuel Adams),Boston Beer Company (Samuel Adams) Samuel Adams Holiday Porter
Boston Beer Company (Samuel Adams) Samuel Adams Honey PorterBoston Beer Company (Samuel Adams),Boston Beer Company (Samuel Adams) Samuel Adams Honey Porter
Boston Beer Company (Samuel Adams) Samuel Adams Imperial StoutBoston Beer Company (Samuel Adams),Boston Beer Company (Samuel Adams) Samuel Adams Imperial Stout
Boston Beer Company (Samuel Adams) Samuel Adams Imperial WhiteBoston Beer Company (Samuel Adams),Boston Beer Company (Samuel Adams) Samuel Adams Imperial White
Boston Beer Company (Samuel Adams) Samuel Adams Irish RedBoston Beer Company (Samuel Adams),Boston Beer Company (Samuel Adams) Samuel Adams Irish Red
Boston Beer Company (Samuel Adams) Samuel Adams Latitude 48 IPABoston Beer Company (Samuel Adams),Boston Beer Company (Samuel Adams) Samuel Adams Latitude 48 IPA
Boston Beer Company (Samuel Adams) Samuel Adams Mighty Oak AleBoston Beer Company (Samuel Adams),Boston Beer Company (Samuel Adams) Samuel Adams Mighty Oak Ale
Boston Beer Company (Samuel Adams) Samuel Adams New World Tripel (Barrel Room Collection)Boston Beer Company (Samuel Adams),Boston Beer Company (Samuel Adams) Samuel Adams New World Tripel (Barrel Room Collection)
Boston Beer Company (Samuel Adams) Samuel Adams Noble PilsBoston Beer Company (Samuel Adams),Boston Beer Company (Samuel Adams) Samuel Adams Noble Pils
Boston Beer Company (Samuel Adams) Samuel Adams OctoberfestBoston Beer Company (Samuel Adams),Boston Beer Company (Samuel Adams) Samuel Adams Octoberfest
Boston Beer Company (Samuel Adams) Samuel Adams Old Fezziwig AleBoston Beer Company (Samuel Adams),Boston Beer Company (Samuel Adams) Samuel Adams Old Fezziwig Ale
Boston Beer Company (Samuel Adams) Samuel Adams Pale AleBoston Beer Company (Samuel Adams),Boston Beer Company (Samuel Adams) Samuel Adams Pale Ale
Boston Beer Company (Samuel Adams) Samuel Adams Revolutionary Rye AleBoston Beer Company (Samuel Adams),Boston Beer Company (Samuel Adams) Samuel Adams Revolutionary Rye Ale
Boston Beer Company (Samuel Adams) Samuel Adams Scotch AleBoston Beer Company (Samuel Adams),Boston Beer Company (Samuel Adams) Samuel Adams Scotch Ale
Boston Beer Company (Samuel Adams) Samuel Adams Stony Brook Red (Barrel Room Collection)Boston Beer Company (Samuel Adams),Boston Beer Company (Samuel Adams) Samuel Adams Stony Brook Red (Barrel Room Collection)
Boston Beer Company (Samuel Adams) Samuel Adams Summer AleBoston Beer Company (Samuel Adams),Boston Beer Company (Samuel Adams) Samuel Adams Summer Ale
Boston Beer Company (Samuel Adams) Samuel Adams UtopiasBoston Beer Company (Samuel Adams),Boston Beer Company (Samuel Adams) Samuel Adams Utopias
Boston Beer Company (Samuel Adams) Samuel Adams Wee Heavy (Imperial Series)Boston Beer Company (Samuel Adams),Boston Beer Company (Samuel Adams) Samuel Adams Wee Heavy (Imperial Series)
Boston Beer Company (Samuel Adams) Samuel Adams White AleBoston Beer Company (Samuel Adams),Boston Beer Company (Samuel Adams) Samuel Adams White Ale
Boston Beer Company (Samuel Adams) Samuel Adams Winter LagerBoston Beer Company (Samuel Adams),Boston Beer Company (Samuel Adams) Samuel Adams Winter Lager
BottleTree Beer Co. Belgian Blonde,BottleTree Beer Co. BottleTree Belgian Blonde
Boulder Beer / Wilderness Pub Obovoid,Boulder Beer / Wilderness Pub Bourbon Barrel Obovoid
Boulevard Brewing Co. Bourbon Barrel Quad Barrel-Aged Ale (BBQ),Boulevard Brewing Co. Bourbon Barrel Quad (BBQ)
Boulevard Brewing Co. Dark Truth,Boulevard Brewing Co. Dark Truth Stout
Boulevard Brewing Co. Nutcracker Winter Warmer Ale,Boulevard Brewing Co. Nutcracker Ale
Boulevard Brewing Co. Saison-Brett,Boulevard Brewing Co. Saison - Brett
Boulevard Brewing Co. Tank 7,Boulevard Brewing Co. Tank 7 Farmhouse Ale
Boulevard Brewing Co. The Sixth Glass Quadrupel Ale,Boulevard Brewing Co. The Sixth Glass
Brasserie Cantillon 50 Degrees North-4 Degrees East,Brasserie Cantillon Cantillon 50 Degrees North-4 Degrees East
Brasserie Cantillon Blåbær Lambik,Brasserie Cantillon Cantillon Blåbær Lambik
Brasserie Cantillon Brabantiae,Brasserie Cantillon Cantillon Brabantiae
Brasserie Cantillon Bruocsella (1900) Grand Cru,Brasserie Cantillon Cantillon Bruocsella (1900) Grand Cru
Brasserie Cantillon Faro,Brasserie Cantillon Cantillon Faro
Brasserie Cantillon Fou' Foune,Brasserie Cantillon Cantillon Fou' Foune
Brasserie Cantillon Lou Pepe - Framboise,Brasserie Cantillon Cantillon Framboise
Brasserie Cantillon Gueuze 100% Lambic,Brasserie Cantillon Cantillon Gueuze 100% Lambic
Brasserie Cantillon Iris,Brasserie Cantillon Cantillon Iris
Brasserie Cantillon Kriek 100% Lambic,Brasserie Cantillon Cantillon Kriek 100% Lambic
Brasserie Cantillon Lambic,Brasserie Cantillon Cantillon Lambic
Brasserie Cantillon Lou Pepe - Gueuze,Brasserie Cantillon Cantillon Lou Pepe - Gueuze
Brasserie Cantillon Lou Pepe - Kriek,Brasserie Cantillon Cantillon Lou Pepe - Kriek
Brasserie Cantillon Mamouche,Brasserie Cantillon Cantillon Mamouche
Brasserie Cantillon Rosé De Gambrinus,Brasserie Cantillon Cantillon Rosé De Gambrinus
Brasserie Cantillon Saint Lamvinus,Brasserie Cantillon Cantillon Saint Lamvinus
Brasserie Cantillon Vigneronne,Brasserie Cantillon Cantillon Vigneronne
Brasserie d'Achouffe Chouffe-Bok 6666,Brasserie d'Achouffe Chouffe-Bok
Brasserie d'Achouffe La Chouffe (Blonde),Brasserie d'Achouffe La Chouffe
Brasserie de la Senne Stouterik (The Brussels Stout),Brasserie de la Senne Stouterik
Brasserie de l'Abbaye du Val-Dieu Blond,Brasserie de l'Abbaye du Val-Dieu Val-Dieu Blond
Brasserie de l'Abbaye du Val-Dieu Brune,Brasserie de l'Abbaye du Val-Dieu Val-Dieu Brune
Brasserie de l'Abbaye du Val-Dieu Grand Cru,Brasserie de l'Abbaye du Val-Dieu Val-Dieu Grand Cru
Brasserie de l'Abbaye du Val-Dieu Triple,Brasserie de l'Abbaye du Val-Dieu Val-Dieu Triple
Brasserie de Silly S.A. Scotch De Silly,Brasserie de Silly S.A. Scotch Silly
Brasserie Des Gabariers (L&L Cognac SA) XO BeerBrasserie des Gabariers (L&L Cognac SA),Brasserie Des Gabariers (L&L Cognac SA) XO Beer
Brasserie Dieu Du Ciel Péché Mortel,Brasserie Dieu Du Ciel Péché Mortel (Bourbon Barrel)
Brasserie Dieu Du Ciel Rigor Mortis Abt,Brasserie Dieu Du Ciel Rigor Mortis ABT
Brasserie Dieu Du Ciel Rosée D'Hibiscus,Brasserie Dieu Du Ciel Rosée D'hibiscus
Brasserie Dieu Du Ciel Route Des Épices,Brasserie Dieu Du Ciel Route Des Épices (Ale Rousse Au Poivre)
Brasserie Grain d' Orge (Brasserie Jeanne d'Arc SA) BelzebuthBrasserie Grain d' Orge (Brasserie Jeanne d'Arc SA),Brasserie Grain d' Orge (Brasserie Jeanne d'Arc SA) Belzebuth
Brasserie La Binchoise (Malterie des Remparts) La Binchoise Blonde TraditionBrasserie La Binchoise (Malterie des Remparts),Brasserie La Binchoise (Malterie des Remparts) La Binchoise Blonde Tradition
Brasserie Meteor Wendelinus Blonde,Brasserie Meteor Wendelinus
Brasserie Pietra Pietra (Amber),Brasserie Pietra Amber
Brasserie Thiriez L'Ambrée D'Esquelbecq / Thiriez Amber,Brasserie Thiriez LAmbrée DEsquelbecq / Thiriez Amber
Brasseries Kronenbourg Kronenbourg 1664 Blanc,Brasseries Kronenbourg Kronenbourg
Brauerei Beck & Co. Beck's Non-Alcoholic,Brauerei Beck & Co. Beck's Alkoholfrei
Brauerei C. & A. Veltins GmbH & Co. Pilsener,Brauerei C. & A. Veltins GmbH & Co. Veltins Pilsner
Brauerei Früh Am Dom Früh Kölsch,Brauerei Früh Am Dom Früh Kolsch
Brauerei Gebrüder Maisel GmbH & Co. Weisse Alkoholfrei,Brauerei Gebrüder Maisel GmbH & Co. Maisel's Weisse Alkoholfrei
Brauerei Gebrüder Maisel GmbH & Co. Weisse Dunkel,Brauerei Gebrüder Maisel GmbH & Co. Maisel's Weisse Dunkel
Brauerei Gebrüder Maisel GmbH & Co. Weisse Kristall,Brauerei Gebrüder Maisel GmbH & Co. Maisel's Weisse Kristall
Brauerei Gebrüder Maisel GmbH & Co. Weisse Original,Brauerei Gebrüder Maisel GmbH & Co. Maisel's Weisse Original
Brauerei Göss (Brau Union) GösserBrauerei Göss (Brau Union),Brauerei Göss (Brau Union) Gösser
Brauerei Göss (Brau Union) Gösser Dark BeerBrauerei Göss (Brau Union),Brauerei Göss (Brau Union) Gösser Dark Beer
Brauerei Heller-Trum / Schlenkerla Aecht Schlenkerla Fastenbier (Lentbeer),Brauerei Heller-Trum / Schlenkerla Aecht Schlenkerla Fastenbier
Brauerei Heller-Trum / Schlenkerla Aecht Schlenkerla Kräusen,Brauerei Heller-Trum / Schlenkerla Aecht Schlenkerla Krausen
Brauerei Hofstetten Krammer GmbH & Co. KG Heller Bock Saphir,Brauerei Hofstetten Krammer GmbH & Co. KG Saphir Bock
Brauerei Im Füchschen Füchschen Alt,Brauerei Im Füchschen Im Füchschen Alt
Brauerei Pinkus Mueller Pinkus Weizen,Brauerei Pinkus Mueller Organic Hefe-Weizen
Brauerei Schloss Eggenberg Samichlaus Classic Bier,Brauerei Schloss Eggenberg Samichlaus Bier
Breckenridge Brewery 471 Small Batch IPA,Breckenridge Brewery 471 IPA
