Beer Name (Full),matches
Paulaner Brauerei GmbH & Co. KG Hefe-Weissbier Dunkel,Paulaner Brauerei GmbH & Co. KG Paulaner Hefe-Weissbier Dunkel
Paulaner Brauerei GmbH & Co. KG Hefe-Weissbier Naturtrüb,Paulaner Brauerei GmbH & Co. KG Paulaner Hefe-Weissbier Naturtrüb
Paulaner Brauerei GmbH & Co. KG Oktoberfest Märzen,Paulaner Brauerei GmbH & Co. KG Paulaner Oktoberfest-Märzen
Paulaner Brauerei GmbH & Co. KG Original Münchner Dunkel,Paulaner Brauerei GmbH & Co. KG Paulaner Original Münchner Dunkel
Paulaner Brauerei GmbH & Co. KG Münchner Hell (Original Munich Lager),Paulaner Brauerei GmbH & Co. KG Paulaner Original Münchner
Paulaner Brauerei GmbH & Co. KG Premium Pils,Paulaner Brauerei GmbH & Co. KG Paulaner Premium Pils
Paulaner Brauerei GmbH & Co. KG Weissbier Kristallklar,Paulaner Brauerei GmbH & Co. KG Paulaner Weissbier Kristallklar
Paulaner Brauerei GmbH & Co. KG Oktoberfest Bier (Oktoberfest Wiesn),Paulaner Brauerei GmbH & Co. KG Paulaner Wiesn Bier
Paulaner Brauerei GmbH & Co. KG Salvator,Paulaner Brauerei GmbH & Co. KG Salvator Doppel Bock
Peak Organic Brewing Company Nut Brown Ale,Peak Organic Brewing Company Peak Organic Nut Brown Ale
Peak Organic Brewing Company Summer Session Ale,Peak Organic Brewing Company Peak Organic Summer Session Ale
Peak Organic Brewing Company Weiss Principal Imperial Hefe,Peak Organic Brewing Company Peak Organic Weiss Principal
Perennial Artisan Ales Devil's Heart Of Gold,Perennial Artisan Ales Heart Of Gold
Phillips Brewing Company Longboat Chocolate Porter,Phillips Brewing Company Longboat Double Chocolate Porter
Picobrouwerij Alvinne / Den Bierzolder Undressed,Picobrouwerij Alvinne / Den Bierzolder Wild Undressed
Pisgah Brewing Co. Valdez,Pisgah Brewing Co. Pisgah Valdez
Pivovarský D&#367;m Šamp - Pivní Sekt,Pivovarský D&#367;m amp - Pivní Sekt
Pivovary Staropramen Staropramen Granat Beer,Pivovary Staropramen Staropramen Granat Prague
Portsmouth Brewery Portsmouth Killer B,Portsmouth Brewery Portsmouth Killer Bee
Portsmouth Brewery Wheat Wine,Portsmouth Brewery Portsmouth Wheat Wine
Portsmouth Brewing Co. / Mault's Brewpub Red Bird Ale,Portsmouth Brewing Co. / Mault's Brewpub Portsmouth Brewing Red Bird Ale
Professor Fritz Briem 13th Century Grut Bier,Professor Fritz Briem Professor Fritz Briem 13th Century Grut Bier
Professor Fritz Briem 1809,Professor Fritz Briem Professor Fritz Briem 1809 Berliner Weisse
Professor Fritz Briem Grodziskie,Professor Fritz Briem Professor Fritz Briem Grodziskie
Propeller Brewery Extra Special Bitter (ESB),Propeller Brewery Propeller Extra Special Bitter (ESB)
Propeller Brewery Kristall Weizen,Propeller Brewery Propeller Kristall Weizen
Public House Brewing Company Revelation Stout,Public House Brewing Company Revalations Stout
Purple Moose Brewery Snowdonia Ale (Cwrw Eryri),Purple Moose Brewery Snowdonia Ale
"Pyramid Breweries, Inc. Pyramid Apricot Ale","Pyramid Breweries, Inc. Audacious Apricot Ale"
"Pyramid Breweries, Inc. Pyramid Hefeweizen","Pyramid Breweries, Inc. Haywire Hefeweizen"
"Pyramid Breweries, Inc. India Pale Lager","Pyramid Breweries, Inc. Pale Ale"
Rahr & Sons Brewing Company Texas Red Amber Lager,Rahr & Sons Brewing Company Rahr's Red Amber Lager
Railway City Brewing Company Dead Elephant,Railway City Brewing Company Railway City Dead Elephant Ale
Real Ale Brewing Company Coffee Porter,Real Ale Brewing Company Shade Grown Coffee Porter
Ridgeway Brewing Bad Elf Winter's Ale,Ridgeway Brewing Bad Elf
Ridgeway Brewing Criminally Bad Elf Barleywine-Style Ale,Ridgeway Brewing Criminally Bad Elf
Ridgeway Brewing Insanely Bad Elf Imperial Red Ale,Ridgeway Brewing Insanely Bad Elf
Ridgeway Brewing Lump Of Coal Dark Holiday Stout,Ridgeway Brewing Lump Of Coal
Ridgeway Brewing Bitter,Ridgeway Brewing Ridgeway Bitter
Ridgeway Brewing Very Bad Elf Special Reserve Ale,Ridgeway Brewing Very Bad Elf
Rinkuškiai Alaus Darykloje Žaibo,Rinkuškiai Alaus Darykloje aibo
Rinkuškiai Alaus Darykloje Before-After Premium Lager (12% ABV),Rinkuškiai Alaus Darykloje Before-After Premium Lager
River Horse Brewing Co. Tripel Horse,River Horse Brewing Co. Bourbon Tripel Horse
River Horse Brewing Co. Hipp-O-Lantern Imperial Pumpkin Ale,River Horse Brewing Co. Hipp-O-Lantern
River Horse Brewing Co. Oatmeal Milk Stout,River Horse Brewing Co. Oatmeal Milk Stout Ale Redux
River Horse Brewing Co. Belgian Freeze Belgian Style Winter Ale,River Horse Brewing Co. River Horse Belgian Freeze Belgian Style Winter Ale
River Horse Brewing Co. Summer Blonde Ale,River Horse Brewing Co. River Horse Summer Blonde
RJ Rockers Brewing Company Black Perle Dark India Pale Ale,RJ Rockers Brewing Company Black Perle
RJ Rockers Brewing Company The First Snow Ale,RJ Rockers Brewing Company First Snow Ale
Robert Cain & Company Limited Cain's Finest Bitter,Robert Cain & Company Limited Cain's Best Bitter
Rochester Mills Beer Co. Rochester Red,Rochester Mills Beer Co. Rochester Mills Rochester Red
Rock Art Brewery Mountain Holidays In Vermont,Rock Art Brewery Mountain Holidays In Vermont Rich Creamy Bock Lager
Rock Art Brewery The Vermonster,Rock Art Brewery Vermonster
Rogue Ales Brutal,Rogue Ales Brutal Bitter Ale
Rogue Ales Irish Style Lager,Rogue Ales Kells Irish Style Lager
Rohrbach Brewing Company (Brewpub) Next Door AleRohrbach Brewing Company (Brewpub),Rohrbach Brewing Company (Brewpub) Next Door Ale
Royal Unibrew A/S Faxe Premium,Royal Unibrew A/S Faxe Premium Danish Lager
Royal Unibrew A/S Faxe Royal Strong,Royal Unibrew A/S Faxe Strong
Russian River Brewing Company Blind Pig,Russian River Brewing Company Blind Pig IPA
Saint Arnold Brewing Company Amber Ale,Saint Arnold Brewing Company Saint Arnold Amber Ale
Saint Arnold Brewing Company Brown Ale,Saint Arnold Brewing Company Saint Arnold Brown Ale
Saint Arnold Brewing Company Christmas Ale,Saint Arnold Brewing Company Saint Arnold Christmas Ale
Saint Arnold Brewing Company Fancy Lawnmower,Saint Arnold Brewing Company Saint Arnold Fancy Lawnmower
Saint Arnold Brewing Company Oktoberfest,Saint Arnold Brewing Company Saint Arnold Oktoberfest
Saint Arnold Brewing Company Santo,Saint Arnold Brewing Company Saint Arnold Santo
Saint Arnold Brewing Company Spring Bock,Saint Arnold Brewing Company Saint Arnold Spring Bock
Saint Arnold Brewing Company Summer Pils,Saint Arnold Brewing Company Saint Arnold Summer Pils
Samuel Smith Old Brewery (Tadcaster) India AleSamuel Smith Old Brewery (Tadcaster),Samuel Smith Old Brewery (Tadcaster) Samuel Smith's India Ale
Samuel Smith Old Brewery (Tadcaster) Nut Brown AleSamuel Smith Old Brewery (Tadcaster),Samuel Smith Old Brewery (Tadcaster) Samuel Smith's Nut Brown Ale
Samuel Smith Old Brewery (Tadcaster) Old Brewery BitterSamuel Smith Old Brewery (Tadcaster),Samuel Smith Old Brewery (Tadcaster) Samuel Smith's Old Brewery Bitter
Samuel Smith Old Brewery (Tadcaster) Organic Pale AleSamuel Smith Old Brewery (Tadcaster),Samuel Smith Old Brewery (Tadcaster) Samuel Smith's Old Brewery Pale Ale
Samuel Smith Old Brewery (Tadcaster) Pure Brewed Organic Lager BeerSamuel Smith Old Brewery (Tadcaster),Samuel Smith Old Brewery (Tadcaster) Samuel Smith's Pure Brewed Lager Beer
Samuel Smith Old Brewery (Tadcaster) Winter Welcome AleSamuel Smith Old Brewery (Tadcaster),Samuel Smith Old Brewery (Tadcaster) Samuel Smith's Winter Welcome Ale
Samuel Smith Old Brewery (Tadcaster) Yorkshire StingoSamuel Smith Old Brewery (Tadcaster),Samuel Smith Old Brewery (Tadcaster) Samuel Smith's Yorkshire Stingo
Samuel Smith Old Brewery (Tadcaster) Imperial StoutSamuel Smith Old Brewery (Tadcaster),Samuel Smith Old Brewery (Tadcaster) Samuel Smith's Imperial Stout
Samuel Smith Old Brewery (Tadcaster) Oatmeal StoutSamuel Smith Old Brewery (Tadcaster),Samuel Smith Old Brewery (Tadcaster) Samuel Smith's Oatmeal Stout
Samuel Smith Old Brewery (Tadcaster) Extra StoutSamuel Smith Old Brewery (Tadcaster),Samuel Smith Old Brewery (Tadcaster) Samuel Smith's Old Brewery Extra Stout
Schorschbräu Schorschbock 31%,Schorschbräu Schorschbräu Schorschbock 31%
Schorschbräu Schorschbock 57%,Schorschbräu Schorschbräu Schorschbock 57%
Sea Dog Brewing Company Old East India Pale Ale,Sea Dog Brewing Company Sea Dog Old East India Pale Ale
Sea Dog Brewing Company Old Gollywobbler Brown Ale,Sea Dog Brewing Company Sea Dog Old Gollywobbler Brown Ale
Sea Dog Brewing Company Owl's Head Light Ale,Sea Dog Brewing Company Sea Dog Owl's Head Light Ale
Sharp's Brewery Doom Bar,Sharp's Brewery Doom Bar Bitter
Sheepscot Valley Brewing Company Bold Coast Pemaquid Ale,Sheepscot Valley Brewing Company Pemaquid Ale
Shepherd Neame Ltd Spitfire Premium Kentish Ale,Shepherd Neame Ltd Spitfire (Premium Ale Export)
Shepherd Neame Ltd Double Stout (2012- ),Shepherd Neame Ltd Double Stout
Shipyard Brewing Co. Longfellow,Shipyard Brewing Co. Longfellow Winter Ale
Shipyard Brewing Co. Old Thumper,Shipyard Brewing Co. Old Thumper ESA
Shipyard Brewing Co. Prelude,Shipyard Brewing Co. Prelude Special Ale
Shipyard Brewing Co. Pugsley's Signature Series: Barley Wine,Shipyard Brewing Co. Shipyard Barley Wine Style Ale (Pugsley's Signature Series)
Shipyard Brewing Co. Export Ale,Shipyard Brewing Co. Shipyard Export Ale
Shipyard Brewing Co. Pugsley's Signature Series: Imperial Porter,Shipyard Brewing Co. Shipyard Imperial Porter (Pugsley's Signature Series)
Shipyard Brewing Co. Pugsley's Signature Series: Smashed Blueberry,Shipyard Brewing Co. Shipyard Smashed Blueberry (Pugsley's Signature Series)
Shipyard Brewing Co. Pugsley's Signature Series: Smashed Pumpkin,Shipyard Brewing Co. Shipyard Smashed Pumpkin (Pugsley's Signature Series)
Short's Brewing Company Black Cherry Porter,Short's Brewing Company Bourbon Black Cherry Porter
Short's Brewing Company Good Humans Ale (Dry Hopped Double Brown Ale),Short's Brewing Company Good Humans
Short's Brewing Company Soft Parade,Short's Brewing Company Imperial Soft Parade
Short's Brewing Company Autumn Ale,Short's Brewing Company Short's Autumn Ale
Short's Brewing Company Bellaire Brown Ale,Short's Brewing Company Short's Bellaire Brown Ale
Short's Brewing Company Sustenance Black Beer - Bourbon Barrel-Aged,Short's Brewing Company Short's Bourbon Barrel Sustenance Black Beer
Short's Brewing Company Pontius Road Pilsner,Short's Brewing Company Short's Pontius Road Pilsner
Short's Brewing Company Publican Porter (Imperial London Porter),Short's Brewing Company Short's Publican Porter (Imperial London Porter)
Short's Brewing Company Sustenance Black Bier,Short's Brewing Company Short's Sustenance Black Bier
Short's Brewing Company The Curl,Short's Brewing Company Short's The Curl
Short's Brewing Company The Magician,Short's Brewing Company Short's The Magician
Short's Brewing Company Woodmaster,Short's Brewing Company Short's The Woodmaster
Short's Brewing Company Uncle Steve's Irish Stout,Short's Brewing Company Short's Uncle Steve's Irish Stout
Short's Brewing Company Village Reserve,Short's Brewing Company Short's Village Reserve
Sierra Blanca Brewing Company (Rio Grande) Rio Grande Outlaw LagerSierra Blanca Brewing Company (Rio Grande),Sierra Blanca Brewing Company (Rio Grande) Rio Grande Outlaw Lager
Sierra Blanca Brewing Company (Rio Grande) Rio Grande Pancho Verde Chile CervezaSierra Blanca Brewing Company (Rio Grande),Sierra Blanca Brewing Company (Rio Grande) Rio Grande Pancho Verde Chile Cerveza
Sierra Nevada Brewing Co. Pale Ale,Sierra Nevada Brewing Co. Chico Special Pale Ale
Sierra Nevada Brewing Co. Hoptimum,Sierra Nevada Brewing Co. Hoptimum Double IPA - Beer Camp #19
Sierra Nevada Brewing Co. Life and Limb,Sierra Nevada Brewing Co. Life & Limb
Sierra Nevada Brewing Co. Northern Hemisphere Harvest Wet Hop IPA,Sierra Nevada Brewing Co. Northern Hemisphere Harvest Wet Hop Ale
Sierra Nevada Brewing Co. Ovila Abbey Barrel Aged Dubbel,Sierra Nevada Brewing Co. Ovila Abbey Dubbel
Sierra Nevada Brewing Co. Celebration Fresh Hop IPA,Sierra Nevada Brewing Co. Sierra Nevada Celebration Ale
Sierra Nevada Brewing Co. Narwhal Imperial Stout,Sierra Nevada Brewing Co. Sierra Nevada Imperial Stout
Sierra Nevada Brewing Co. Porter,Sierra Nevada Brewing Co. Sierra Nevada Porter
Sierra Nevada Brewing Co. Ruthless Rye IPA,Sierra Nevada Brewing Co. Sierra Nevada Ruthless Rye IPA
Sierra Nevada Brewing Co. Maple Scotch-Style Ale,Sierra Nevada Brewing Co. Sierra Nevada Scotch Ale
Sierra Nevada Brewing Co. Stout,Sierra Nevada Brewing Co. Sierra Nevada Stout
Sierra Nevada Brewing Co. Torpedo Extra IPA,Sierra Nevada Brewing Co. Sierra Nevada Torpedo Extra IPA
Sierra Nevada Brewing Co. Vienna Style Lager,Sierra Nevada Brewing Co. Sierra Nevada Vienna Style Lager
Sierra Nevada Brewing Co. Kölsch,Sierra Nevada Brewing Co. Sierra Nevada Kölsch Style Ale
Sixpoint Brewery The Crisp,Sixpoint Brewery Sehr Crisp Pilsner
Slavutych Brewery Kvas Taras (квас тарас),Slavutych Brewery Kvas Taras
Sleeman Breweries Ltd. Sleeman Original Draught,Sleeman Breweries Ltd. Original Draught
Smuttynose Brewing Company Smuttynose Baltic Porter,Smuttynose Brewing Company Smuttynose Baltic Porter (Big Beer Series)
Smuttynose Brewing Company Old Brown Dog,Smuttynose Brewing Company Smuttynose Old Brown Dog Ale
Smuttynose Brewing Company Pumpkin Ale,Smuttynose Brewing Company Smuttynose Pumpkin Ale
Smuttynose Brewing Company Robust Porter,Smuttynose Brewing Company Smuttynose Robust Porter
Smuttynose Brewing Company Smuttynose S'muttonator (Heritage Series),Smuttynose Brewing Company Smuttynose S'muttonator (Big Beer Series)
Snake River Brewing Company & Brewpub Jenny Lake Lager,Snake River Brewing Company & Brewpub Snake River Lager
Snake River Brewing Company & Brewpub Zonker Stout,Snake River Brewing Company & Brewpub Snake River Zonker Stout
Southampton Publick House Southampton Biere De Garde,Southampton Publick House Biere De Garde
Southampton Publick House Southampton Burton IPA,Southampton Publick House Southampton Burton Ale
Southern Tier Brewing Company 2XSTOUT,Southern Tier Brewing Company 2X Stout
Southern Tier Brewing Company Choklat (Blackwater Series),Southern Tier Brewing Company Choklat
Southern Tier Brewing Company Imperial Cherry Gose,Southern Tier Brewing Company Imperial Cherry Saison
Southern Tier Brewing Company Krampus,Southern Tier Brewing Company Krampus (Imperial Helles Lager)
Southern Tier Brewing Company Pumking - Rum Barrel Aged,Southern Tier Brewing Company Oak Aged Pumking
Southern Tier Brewing Company Old Man Winter,Southern Tier Brewing Company Old Man (Winter Ale)
Spaten-Franziskaner-Bräu Franziskaner Weissbier Kristallklar,Spaten-Franziskaner-Bräu Franziskaner Club-Weisse Kristalklar
Spaten-Franziskaner-Bräu Spaten Münchner Hell (München/Premium Lager),Spaten-Franziskaner-Bräu Spaten Münchner Hell (Premium Lager)
Spoetzl Brewery Shiner Bohemian Black Lager,Spoetzl Brewery Bohemian Black Lager
Spoetzl Brewery Shiner Bavarian Style Amber,Spoetzl Brewery Shiner 98 Bavarian Style Amber
Spoetzl Brewery Shiner Dortmunder (Spring Ale),Spoetzl Brewery Shiner Dortmunder
Spoetzl Brewery Shiner Märzen-Style Oktoberfest,Spoetzl Brewery Shiner Oktoberfest
Sprecher Brewing Company Dunkle Weizen,Sprecher Brewing Company Dunkel Weizen
Sprecher Brewing Company Scotch Ale,Sprecher Brewing Company Pipers Scotch-Style Ale
Sprecher Brewing Company Winter Lager,Sprecher Brewing Company Winter Brew
Spring House Brewing Company Planet Bean,Spring House Brewing Company Planet Bean Coffee Stout
St. Georgenbräu Buttenheimer Keller Bier,St. Georgenbräu St. Georgenbräu Keller Bier
St. Peter's Brewery Co Ltd Best Bitter,St. Peter's Brewery Co Ltd St. Peter's Best Bitter
St. Peter's Brewery Co Ltd Cream Stout,St. Peter's Brewery Co Ltd St. Peter's Cream Stout
St. Peter's Brewery Co Ltd English Ale,St. Peter's Brewery Co Ltd St. Peter's English Ale
St. Peter's Brewery Co Ltd Golden Ale,St. Peter's Brewery Co Ltd St. Peter's Golden Ale
St. Peter's Brewery Co Ltd India Pale Ale,St. Peter's Brewery Co Ltd St. Peter's India Pale Ale
St. Peter's Brewery Co Ltd Old-Style Porter,St. Peter's Brewery Co Ltd St. Peter's Old-Style Porter
St. Peter's Brewery Co Ltd Ruby Red Ale,St. Peter's Brewery Co Ltd St. Peter's Ruby Red Ale
St. Peter's Brewery Co Ltd The Saints Whisky Beer,St. Peter's Brewery Co Ltd St. Peter's The Saints Whisky Beer
St. Peter's Brewery Co Ltd Winter Ale,St. Peter's Brewery Co Ltd St. Peter's Winter Ale
Starr Hill Brewery Boxcarr Pumpkin Porter,Starr Hill Brewery Box Car Pumpkin Porter
Starr Hill Brewery Amber Ale,Starr Hill Brewery Starr Hill Amber Ale
Starr Hill Brewery The Love Wheat Beer,Starr Hill Brewery The Love
Stone Brewing Co. Ruination Double IPA 2.0,Stone Brewing Co. Stone Ruination IPA
Stone Brewing Co. Smoked Porter,Stone Brewing Co. Stone Smoked Porter
Stoudts Brewing Co. Blonde Double MaiBock,Stoudts Brewing Co. Stoudt's Blonde Double MaiBock
Stoudts Brewing Co. Gold Lager,Stoudts Brewing Co. Stoudt's Gold Lager
Stoudts Brewing Co. Pils,Stoudts Brewing Co. Stoudts Pils
Stoudts Brewing Co. Scarlet Lady Ale,Stoudts Brewing Co. Stoudt's Scarlet Lady ESB
Straight To Ale Unobtanium Barrel-Aged Old Ale,Straight To Ale Barrel-Aged Unobtanium Old Ale
Summit Brewing Company Extra Pale Ale,Summit Brewing Company Summit Extra Pale Ale
Summit Brewing Company Great Northern,Summit Brewing Company Summit Great Northern Porter
Summit Brewing Company Maibock,Summit Brewing Company Summit Maibock
Summit Brewing Company Oatmeal Stout,Summit Brewing Company Summit Oatmeal Stout
Summit Brewing Company Oktoberfest,Summit Brewing Company Summit Oktoberfest Marzen
Summit Brewing Company Winter Ale,Summit Brewing Company Summit Winter Ale
Sun King Brewing Company Ring Of Dingle,Sun King Brewing Company Ring Of Dingle Irish Stout
Sun King Brewing Company Wee Mac,Sun King Brewing Company Wee Mac Brown
Suntory Kinmugi (Rich Malt),Suntory Suntory Rich Malt
Surly Brewing Company Hell Lager,Surly Brewing Company Hell
SweetWater Brewing Company 420 Extra Pale Ale,SweetWater Brewing Company Sweetwater 420 Extra Pale Ale
SweetWater Brewing Company Blue,SweetWater Brewing Company Sweetwater Blue
SweetWater Brewing Company Festive Ale,SweetWater Brewing Company Sweetwater Festive Ale
SweetWater Brewing Company Georgia Brown,SweetWater Brewing Company Sweetwater Georgia Brown
SweetWater Brewing Company IPA,SweetWater Brewing Company Sweetwater IPA
SweetWater Brewing Company Motor Boat,SweetWater Brewing Company Sweetwater Motor Boat
SweetWater Brewing Company Waterkeeper Hefeweizen,SweetWater Brewing Company Sweetwater Waterkeeper Hefeweizen
T & R Theakston Ltd. Old Peculier,T & R Theakston Ltd. Theakston Old Peculier
Taiwan Tobacco & Liquor Corporation Taiwan Beer Draft Beer Only 18 Days,Taiwan Tobacco & Liquor Corporation Taiwan Beer
Terrapin Beer Company Wake-n-Bake Coffee Oatmeal Imperial Stout,Terrapin Beer Company Terrapin Coffee Oatmeal Imperial Stout
Terrapin Beer Company Gamma Ray,Terrapin Beer Company Terrapin Gamma Ray
Terrapin Beer Company Golden Ale,Terrapin Beer Company Terrapin Golden Ale
Terrapin Beer Company Hopsecutioner,Terrapin Beer Company Terrapin Hopsecutioner
Terrapin Beer Company Moo-Hoo Chocolate Milk Stout,Terrapin Beer Company Terrapin Moo-Hoo Chocolate Milk Stout
Terrapin Beer Company Pumpkinfest,Terrapin Beer Company Terrapin Pumpkinfest
Terrapin Beer Company Sound Czech,Terrapin Beer Company Terrapin Sound Czech
The Brew Kettle Taproom & Smokehouse / Production Works Dark Helmet Imperial Schwarzbier,The Brew Kettle Taproom & Smokehouse / Production Works Ringneck Dark Helmet Imperial Schwarzbier
The Brewer's Art Proletary Ale,The Brewer's Art Brewer's Art Proletary Ale
The Brewer's Art Resurrection,The Brewer's Art Brewer's Art Resurrection
The Bronx Brewery Rye Pale Ale,The Bronx Brewery Pale Ale
The Bruery Mélange No. 3,The Bruery Melange No. 3
The Bruery Smoking Wood - Bourbon Barrel-Aged,The Bruery Smoking Wood Rye Barrel Aged
The Bruery Trade Winds,The Bruery Trade Winds Tripel
The Duck-Rabbit Craft Brewery Amber Ale,The Duck-Rabbit Craft Brewery Duck-Rabbit Amber Ale
The Duck-Rabbit Craft Brewery Baltic Porter,The Duck-Rabbit Craft Brewery Duck-Rabbit Baltic Porter
The Duck-Rabbit Craft Brewery Barleywine Ale,The Duck-Rabbit Craft Brewery Duck-Rabbit Barleywine Ale
The Duck-Rabbit Craft Brewery Brown Ale,The Duck-Rabbit Craft Brewery Duck-Rabbit Brown Ale
The Duck-Rabbit Craft Brewery Duck-Rabbator,The Duck-Rabbit Craft Brewery Duck-Rabbit Duck-Rabbator
The Duck-Rabbit Craft Brewery Milk Stout,The Duck-Rabbit Craft Brewery Duck-Rabbit Milk Stout
The Duck-Rabbit Craft Brewery Porter,The Duck-Rabbit Craft Brewery Duck-Rabbit Porter
The Duck-Rabbit Craft Brewery Rabid Duck,The Duck-Rabbit Craft Brewery Duck-Rabbit Rabid Duck
The Duck-Rabbit Craft Brewery Schwarzbier,The Duck-Rabbit Craft Brewery Duck-Rabbit Schwarzbier
The Duck-Rabbit Craft Brewery Wee Heavy Scotch Style Ale,The Duck-Rabbit Craft Brewery Duck-Rabbit Wee Heavy Scotch Style Ale
The Fat Cat Beer Company Fat Cat Lager,The Fat Cat Beer Company Fat Cat Lager Beer
The Kernel Brewery Export Stout London 1890,The Kernel Brewery Export Stout
The Livery Umami,The Livery Umae Umami
The Lost Abbey Devotion,The Lost Abbey Devotion Ale
The Lost Abbey Red Poppy,The Lost Abbey Double Red Poppy
The Lost Abbey Lost & Found,The Lost Abbey Lost & Found Abbey Ale
The Lost Abbey Saint's Devotion,The Lost Abbey Saints' Devotion
the Nils Oscar Company God Lager,the Nils Oscar Company Nils Oscar God Lager
the Nils Oscar Company Rökporter,the Nils Oscar Company Nils Oscar Rökporter
The Olde Mecklenburg Brewery Dunkel,The Olde Mecklenburg Brewery Dunkel Lager
The Olde Mecklenburg Brewery Früh Bock,The Olde Mecklenburg Brewery Fruehbock (Früh Bock)
The Olde Mecklenburg Brewery Copper,The Olde Mecklenburg Brewery OMB Copper
The Porterhouse Brewing Company An Brain Blásta,The Porterhouse Brewing Company Brainblasta
Thirsty Dog Brewing Company Bourbon Barrel Aged Siberian Night Imperial Stout,Thirsty Dog Brewing Company Bourbon Barrel Aged Siberian Night
Thomas Creek Brewery Orange Blossom Pilsner² (Squared),Thomas Creek Brewery OBP Squared (Orange Blossom Pilsner Squared)
Thomas Hooker Brewing Company Blonde Ale,Thomas Hooker Brewing Company Thomas Hooker Blonde Ale
Thomas Hooker Brewing Company Irish Red Ale,Thomas Hooker Brewing Company Thomas Hooker Irish Style Red Ale
Thomas Hooker Brewing Company Liberator Doppelbock,Thomas Hooker Brewing Company Thomas Hooker Liberator Doppelbock
Thomas Hooker Brewing Company Munich-Style Lager,Thomas Hooker Brewing Company Thomas Hooker Munich Style Lager
Thomas Hooker Brewing Company Nor'Easter Lager,Thomas Hooker Brewing Company Thomas Hooker Nor'Easter Lager
Three Floyds Brewing Co. & Brewpub Alpha King,Three Floyds Brewing Co. & Brewpub Alpha King Pale Ale
Three Floyds Brewing Co. & Brewpub Behemoth,Three Floyds Brewing Co. & Brewpub Behemoth Blonde Barleywine
Three Floyds Brewing Co. & Brewpub Deesko!,Three Floyds Brewing Co. & Brewpub Deesko
Three Floyds Brewing Co. & Brewpub Hank On Rye,Three Floyds Brewing Co. & Brewpub Ham On Rye
Three Floyds Brewing Co. & Brewpub Lord Rear Admiral,Three Floyds Brewing Co. & Brewpub Lord Admiral Nelson
Three Floyds Brewing Co. & Brewpub BBADL (Bourbon Barrel Aged Dark Lord Imperial Stout),Three Floyds Brewing Co. & Brewpub Oak Aged Dark Lord Imperial Stout
Three Floyds Brewing Co. & Brewpub Robert The Bruce,Three Floyds Brewing Co. & Brewpub Robert The Bruce Scottish Ale
Throwback Brewery Campfire Smoked Porter,Throwback Brewery Throwback Campfire Smoked Porter
Throwback Brewery Spicy Bohemian,Throwback Brewery Throwback Spicy Bohemian
Titletown Brewing Company Johnny Blood Red,"Titletown Brewing Company Johnny ""Blood"" McNally Red Ale"
Tommyknocker Brewery Green Chile Lager,Tommyknocker Brewery Chili Lager
Toppling Goliath Brewing Company Pseudo Sue,Toppling Goliath Brewing Company PseudoSue
Trader Joe's Brewing Company Josephs Brau Winter Brew,Trader Joe's Brewing Company Josephs Brau Winterfest
Trader Joe's Brewing Company Joseph's Brau Bohemian Lager,Trader Joe's Brewing Company Trader Joe's Bohemian Lager
Tröegs Brewing Company Troegenator,Tröegs Brewing Company Troegenator Double Bock
Tröegs Brewing Company Dead Reckoning Porter,Tröegs Brewing Company Tröegs Dead Reckoning Porter
Tröegs Brewing Company Hopback Amber Ale,Tröegs Brewing Company Tröegs Hopback Amber Ale
Tröegs Brewing Company Java Head Stout,Tröegs Brewing Company Tröegs Java Head Stout
Tröegs Brewing Company The Mad Elf,Tröegs Brewing Company Tröegs Mad Elf
Tröegs Brewing Company Nugget Nectar,Tröegs Brewing Company Tröegs Nugget Nectar
Tröegs Brewing Company Perpetual IPA,Tröegs Brewing Company Tröegs Perpetual IPA
Tröegs Brewing Company Rugged Trail Nut Brown Ale,Tröegs Brewing Company Tröegs Rugged Trail Nut Brown Ale
Tröegs Brewing Company Sunshine Pils,Tröegs Brewing Company Tröegs Sunshine Pils
"Tsingtao Brewery Co., Ltd. Tsingtao Beer","Tsingtao Brewery Co., Ltd. Five Star All Malt Beer"
Two Brothers Brewing Company Cane And Ebel,Two Brothers Brewing Company Cane & Ebel
Two Brothers Brewing Company Northwind,Two Brothers Brewing Company Northwind Imperial Stout
Tyranena Brewing Company Devil Over A Barrel Bourbon Barrel-Aged Imperial Coffee Oatmeal Porter,Tyranena Brewing Company Devil Over A Barrel - Bourbon Barrel-Aged Coffee Imperial Oatmeal Porter
Tyranena Brewing Company The Devil Made Me Do It!,Tyranena Brewing Company The Devil Made Me Do It! Coffee Imperial Oatmeal Porter
Uerige Obergärige Hausbrauerei GmbH / Zum Uerige Altbier,Uerige Obergärige Hausbrauerei GmbH / Zum Uerige Uerige Altbier (Classic)
Uerige Obergärige Hausbrauerei GmbH / Zum Uerige Doppelsticke,Uerige Obergärige Hausbrauerei GmbH / Zum Uerige Uerige Doppelsticke
